{
  "name": "GameDrive.org | Updates",
  "downloads": [
    {
      "title": "Nioh 3 update v1.03 – v1.03.01 [GameDrive]",
      "uris": [
        "https://vikingfile.com/f/AIX93fXj06",
        "https://pixeldrain.com/u/B6pc3sZJ",
        "https://gofile.io/d/6uljdW"
      ],
      "uploadDate": "2026-02-14T10:00:00.000Z",
      "fileSize": "78.32 MB",
      "Gamedrive_Link": "https://gamedrive.org/nioh-3-update-v1-03-v1-03-01-gamedrive/"
    },
    {
      "title": "Nioh 3 Update v1.02 – v1.03 [GameDrive]",
      "uris": [
        "https://vikingfile.com/f/JQB54QNCbv",
        "https://pixeldrain.com/u/aQ9KPkuB",
        "https://gofile.io/d/drm1rG"
      ],
      "uploadDate": "2026-02-07T10:00:00.000Z",
      "fileSize": "210.85 MB",
      "Gamedrive_Link": "https://gamedrive.org/nioh-3-update-v1-02-v1-03-gamedrive/"
    },
    {
      "title": "Clair Obscur Expedition 33 update 61339 – 61711 (08.01.2026) [Elamigos Update]",
      "uris": [
        "https://www.rootz.so/d/1WvMAa",
        "https://gofile.io/d/uHrb6T",
        "https://vikingfile.com/f/DoNXHbUIdj",
        "https://buzzheavier.com/su53wms2wvoh"
      ],
      "uploadDate": "2026-02-07T10:00:00.000Z",
      "fileSize": "498.81 MB",
      "Gamedrive_Link": "https://gamedrive.org/clair-obscur-expedition-33-update-61339-61711-08-01-2026-elamigos-update/"
    },
    {
      "title": "Automobilista 2 update 1.6.8.5 – 1.6.9.1 [Elamigos Update]",
      "uris": [
        "https://vikingfile.com/f/STu7pNq5rZ",
        "https://gofile.io/d/hEVTo1"
      ],
      "uploadDate": "2026-01-24T10:00:00.000Z",
      "fileSize": "1.94 GB",
      "Gamedrive_Link": "https://gamedrive.org/automobilista-2-update-1-6-8-5-1-6-9-1-elamigos-update/"
    },
    {
      "title": "Resident Evil 7 Biohazard update 13.06.2022 – 08.05.2023 [Elamigos Update]",
      "uris": [
        "https://vikingfile.com/f/pypRtRcOyc",
        "https://gofile.io/d/6qlToz"
      ],
      "uploadDate": "2026-01-15T10:00:00.000Z",
      "fileSize": "1.05 GB",
      "Gamedrive_Link": "https://gamedrive.org/resident-evil-7-biohazard-update-13-06-2022-08-05-2023-elamigos-update/"
    },
    {
      "title": "GTA  / Grand Theft Auto V Enhanced update 889.22 – 1013.17 (10.12.2025) [Elamigos Update]",
      "uris": [
        "https://www.rootz.so/d/vJWlc",
        "https://gofile.io/d/5xLzQg",
        "https://vikingfile.com/f/k0CO5mPM8c"
      ],
      "uploadDate": "2025-12-16T10:00:00.000Z",
      "fileSize": "2.08 GB",
      "Gamedrive_Link": "https://gamedrive.org/gta-grand-theft-auto-v-enhanced-update-889-22-1013-17-10-12-2025-elamigos-update/"
    },
    {
      "title": "Assetto Corsa EVO update v0.4 – v0.4.1 [GameDrive Update]",
      "uris": [
        "https://gofile.io/d/yTYupf",
        "https://vikingfile.com/f/tyZ6tUiY9q",
        "https://www.rootz.so/d/1MV6q8",
        "https://pixeldrain.com/u/tfyqSi76"
      ],
      "uploadDate": "2025-12-16T10:00:00.000Z",
      "fileSize": "25.47 MB",
      "Gamedrive_Link": "https://gamedrive.org/assetto-corsa-evo-update-v0-4-v0-4-1-gamedrive-update/"
    },
    {
      "title": "Clair Obscur Expedition 33 Update v1.4.0 – v1.5.0 [GameDrive]",
      "uris": [
        "https://www.rootz.so/d/8KglM",
        "https://gofile.io/d/blsAAD",
        "https://vikingfile.com/f/vLnQ8ZWo8k",
        "https://pixeldrain.com/u/8m2BtzjQ"
      ],
      "uploadDate": "2025-12-16T10:00:00.000Z",
      "fileSize": "4.51 GB",
      "Gamedrive_Link": "https://gamedrive.org/clair-obscur-expedition-33-update-v1-4-0-v1-5-0-gamedrive/"
    },
    {
      "title": "Yooka Replaylee update 13.11.2025 [Elamigos Update]",
      "uris": [
        "https://gofile.io/d/A2ZePr",
        "https://www.rootz.so/d/FJJtA",
        "https://vikingfile.com/f/USmx1CWWbz",
        "https://pixeldrain.com/u/Hjz5pMYA"
      ],
      "uploadDate": "2025-12-16T10:00:00.000Z",
      "fileSize": "945.56 MB",
      "Gamedrive_Link": "https://gamedrive.org/yooka-replaylee-update-13-11-2025-elamigos-update/"
    },
    {
      "title": "X4 Foundations update 8.00 – 8.00 H2 (14.10.2025) [Elamigos Update]",
      "uris": [
        "https://gofile.io/d/95Fcd3",
        "https://vikingfile.com/f/mLqENAUABk",
        "https://pixeldrain.com/u/Pptid398"
      ],
      "uploadDate": "2025-12-16T10:00:00.000Z",
      "fileSize": "5.53 MB",
      "Gamedrive_Link": "https://gamedrive.org/x4-foundations-update-8-00-8-00-h2-14-10-2025-elamigos-update/"
    },
    {
      "title": "Wuchang Fallen Feathers update 179243 – 179951 [Elamigos Update]",
      "uris": [
        "https://gofile.io/d/MZYnLQ",
        "https://www.rootz.so/d/1Fu03s",
        "https://vikingfile.com/f/U2QEuyrL10",
        "https://pixeldrain.com/u/8XxgEpEH"
      ],
      "uploadDate": "2025-12-16T10:00:00.000Z",
      "fileSize": "1.13 GB",
      "Gamedrive_Link": "https://gamedrive.org/wuchang-fallen-feathers-update-179243-179951-elamigos-update/"
    },
    {
      "title": "WWE 2K25 update v1.28 – v1.29 [GameDrive]",
      "uris": [
        "https://gofile.io/d/qnhKnx",
        "https://www.rootz.so/d/2I6fB2",
        "https://vikingfile.com/f/4ciGYoS5ot"
      ],
      "uploadDate": "2025-12-16T10:00:00.000Z",
      "fileSize": "369.11 MB",
      "Gamedrive_Link": "https://gamedrive.org/wwe-2k25-update-v1-28-v1-29-gamedrive/"
    },
    {
      "title": "Assetto Corsa EVO update v0.3 – v0.4 [GameDrive Update]",
      "uris": [
        "https://gofile.io/d/3diYgM",
        "https://pixeldrain.com/u/hXUWdVgV",
        "https://vikingfile.com/f/RvmPYtXbXi",
        "https://gofile.io/d/2AoLrA",
        "https://vikingfile.com/f/vVoQlHIvWr"
      ],
      "uploadDate": "2025-12-16T10:00:00.000Z",
      "fileSize": "3.61 GB",
      "Gamedrive_Link": "https://gamedrive.org/assetto-corsa-evo-update-v0-3-v0-4-gamedrive-update/"
    },
    {
      "title": "Pacific Drive update 1.11.0 – 1.12.0 [Elamigos Update]",
      "uris": [
        "https://gofile.io/d/09vbwu",
        "https://vikingfile.com/f/W6q2EdGM1j",
        "https://pixeldrain.com/u/TgKpHgeL"
      ],
      "uploadDate": "2025-11-16T10:00:00.000Z",
      "fileSize": "1.87 GB",
      "Gamedrive_Link": "https://gamedrive.org/pacific-drive-update-1-11-0-1-12-0-elamigos-update/"
    },
    {
      "title": "WWE 2K25 update v1.26 – v1.28 [GameDrive]",
      "uris": [
        "https://gofile.io/d/LLFrdp",
        "https://vikingfile.com/f/7aJArPsEQF",
        "https://pixeldrain.com/u/A8uT6An2"
      ],
      "uploadDate": "2025-11-16T10:00:00.000Z",
      "fileSize": "892.09 MB",
      "Gamedrive_Link": "https://gamedrive.org/wwe-2k25-update-v1-26-v1-28-gamedrive/"
    },
    {
      "title": "Cricket 24 Update v0.2.5488 – v0.2.5521 [GameDrive]",
      "uris": [
        "https://gofile.io/d/PjuVEF",
        "https://vikingfile.com/f/vxvEPUqFuT",
        "https://pixeldrain.com/u/DdJiPs7C"
      ],
      "uploadDate": "2025-11-16T10:00:00.000Z",
      "fileSize": "84.64 MB",
      "Gamedrive_Link": "https://gamedrive.org/cricket-24-update-v0-2-5488-v0-2-5521-gamedrive/"
    },
    {
      "title": "Dispatch Update v1.0.16232 – B20774381 / v1.0.16250– (12.11.25) [GameDrive]",
      "uris": [
        "https://www.rootz.so/d/1e3VoW",
        "https://gofile.io/d/C5cu4t",
        "https://vikingfile.com/f/ILZv6Fv34b",
        "https://pixeldrain.com/u/oWreXprf"
      ],
      "uploadDate": "2025-11-16T10:00:00.000Z",
      "fileSize": "43.66 MB",
      "Gamedrive_Link": "https://gamedrive.org/dispatch-update-v1-0-16232-b20774381-v1-0-16250-12-11-25-gamedrive/"
    },
    {
      "title": "Dispatch Update v1.0.16218 – B20772157 / v1.0.16232– (12.11.25) [GameDrive]",
      "uris": [
        "https://www.rootz.so/d/NLQFk",
        "https://gofile.io/d/DhXoln",
        "https://vikingfile.com/f/NdBfrCOWZd",
        "https://pixeldrain.com/u/xGCka7kG"
      ],
      "uploadDate": "2025-11-16T10:00:00.000Z",
      "fileSize": "44.32 MB",
      "Gamedrive_Link": "https://gamedrive.org/dispatch-update-v1-0-16218-b20772157-v1-0-16232-12-11-25-gamedrive/"
    },
    {
      "title": "Dispatch Update v1.0.15487 – B20762637/ v 1.0.16218– (12.11.25) [GameDrive]",
      "uris": [
        "https://www.rootz.so/d/1a1ewy",
        "https://gofile.io/d/nlSZHr",
        "https://vikingfile.com/f/EBczoilUzU",
        "https://pixeldrain.com/u/oktwaGUP"
      ],
      "uploadDate": "2025-11-16T10:00:00.000Z",
      "fileSize": "6.01 GB",
      "Gamedrive_Link": "https://gamedrive.org/dispatch-update-v1-0-15487-b20762637-v-1-0-16218-12-11-25-gamedrive/"
    },
    {
      "title": "Cricket 24 Update v0.2.5460 – v0.2.5488 [GameDrive]",
      "uris": [
        "https://gofile.io/d/Po2T6l",
        "https://vikingfile.com/f/RvFjFWBu2g",
        "https://pixeldrain.com/u/BKLEp29h"
      ],
      "uploadDate": "2025-11-16T10:00:00.000Z",
      "fileSize": "221.42 MB",
      "Gamedrive_Link": "https://gamedrive.org/cricket-24-update-v0-2-5460-v0-2-5488-gamedrive/"
    },
    {
      "title": "Dispatch Update v1.0.15103 – B20672856/v1.0.15487 – (05.11.25) [GameDrive]",
      "uris": [
        "https://www.rootz.so/d/1JuFYu",
        "https://gofile.io/d/0YVkZd",
        "https://vikingfile.com/f/1NBbI8tdhr",
        "https://pixeldrain.com/u/vS1KKfcP"
      ],
      "uploadDate": "2025-11-16T10:00:00.000Z",
      "fileSize": "3.25 GB",
      "Gamedrive_Link": "https://gamedrive.org/dispatch-update-v1-0-15103-b20672856-v1-0-15487-05-11-25-gamedrive/"
    },
    {
      "title": "The Dark Pictures Anthology Little Hope update 19.12.2022 – 24.05.2023 [Elamigos Update]",
      "uris": [
        "https://gofile.io/d/t4NUwV",
        "https://vikingfile.com/f/txzJy1XehN",
        "https://pixeldrain.com/u/Rf3CvNrk"
      ],
      "uploadDate": "2025-11-16T10:00:00.000Z",
      "fileSize": "580.74 MB",
      "Gamedrive_Link": "https://gamedrive.org/the-dark-pictures-anthology-little-hope-update-19-12-2022-24-05-2023-elamigos-update/"
    },
    {
      "title": "Dispatch Update v1.0.14955 – B20581782/v1.0.15103 – (29.10.25) [GameDrive]",
      "uris": [
        "https://www.rootz.so/d/1oW2jI",
        "https://gofile.io/d/PSBKzf",
        "https://vikingfile.com/f/QY8xnMQabD",
        "https://pixeldrain.com/u/aFp5nGFr"
      ],
      "uploadDate": "2025-11-16T10:00:00.000Z",
      "fileSize": "1.97 GB",
      "Gamedrive_Link": "https://gamedrive.org/dispatch-update-v1-0-14955-b20581782-29-10-25-gamedrive/"
    },
    {
      "title": "The Dark Pictures Anthology House of Ashes update 05.05.2022 [Elamigos Update]",
      "uris": [
        "https://vikingfile.com/f/DF1DqhfdSk",
        "https://pixeldrain.com/u/51TmDWjZ"
      ],
      "uploadDate": "2025-10-17T10:00:00.000Z",
      "fileSize": "112.4 MB",
      "Gamedrive_Link": "https://gamedrive.org/the-dark-pictures-anthology-house-of-ashes-update-05-05-2022-elamigos-update/"
    },
    {
      "title": "Dispatch Update v1.0.14753 – v1.0.14955 (24.10.25) [GameDrive]",
      "uris": [
        "https://www.rootz.so/d/RNH7I",
        "https://gofile.io/d/ctu1P0",
        "https://vikingfile.com/f/j3YRcMdrkt",
        "https://pixeldrain.com/u/GQThFZxF"
      ],
      "uploadDate": "2025-10-17T10:00:00.000Z",
      "fileSize": "31.6 MB",
      "Gamedrive_Link": "https://gamedrive.org/dispatch-update-v1-0-14753-v1-0-14955-24-10-25-gamedrive/"
    },
    {
      "title": "Cricket 24 Update v0.2.5444 – v0.2.5460 [GameDrive]",
      "uris": [
        "https://gofile.io/d/5acCb8",
        "https://vikingfile.com/f/sKbxsvLLve",
        "https://pixeldrain.com/u/wEFJTCop"
      ],
      "uploadDate": "2025-10-17T10:00:00.000Z",
      "fileSize": "168.99 MB",
      "Gamedrive_Link": "https://gamedrive.org/cricket-24-update-v0-2-5444-v0-2-5460-gamedrive/"
    },
    {
      "title": "Assetto Corsa EVO update v0.2.2 – v0.3 [GameDrive Update]",
      "uris": [
        "https://gofile.io/d/TSYt4W",
        "https://vikingfile.com/f/YyDyb8CrHf",
        "https://pixeldrain.com/u/GeSxmRpQ"
      ],
      "uploadDate": "2025-09-17T10:00:00.000Z",
      "fileSize": "2.8 GB",
      "Gamedrive_Link": "https://gamedrive.org/assetto-corsa-evo-update-v0-2-2-v0-3-gamedrive-update/"
    },
    {
      "title": "Mount and Blade II Bannerlord update 1.2.7.31207 – 1.2.9.33689 (01.02.2024) [Elamigos Update]",
      "uris": [
        "https://gofile.io/d/gTlyIv",
        "https://vikingfile.com/f/71MR04FIvj",
        "https://pixeldrain.com/u/sA2s7B46"
      ],
      "uploadDate": "2025-09-17T10:00:00.000Z",
      "fileSize": "828.66 MB",
      "Gamedrive_Link": "https://gamedrive.org/mount-and-blade-ii-bannerlord-update-1-2-7-31207-1-2-9-33689-01-02-2024-elamigos-update/"
    },
    {
      "title": "V Rising update 1.1.0.0 – 1.1.8.0 (16.05.2025) [Elamigos Update]",
      "uris": [
        "https://gofile.io/d/HbSOky",
        "https://vikingfile.com/f/8TWwBTLo6Q",
        "https://pixeldrain.com/u/JiyMHCHv"
      ],
      "uploadDate": "2025-09-17T10:00:00.000Z",
      "fileSize": "123.11 MB",
      "Gamedrive_Link": "https://gamedrive.org/v-rising-update-1-1-0-0-1-1-8-0-16-05-2025-elamigos-update/"
    },
    {
      "title": "We Are Football 2024 update 04.11.2024 – 05.05.2025 [Elamigos Update]",
      "uris": [
        "https://vikingfile.com/f/KpnY9bueQ1",
        "https://gofile.io/d/OiewSa"
      ],
      "uploadDate": "2025-09-17T10:00:00.000Z",
      "fileSize": "21.96 MB",
      "Gamedrive_Link": "https://gamedrive.org/we-are-football-2024-update-04-11-2024-05-05-2025-elamigos-update/"
    },
    {
      "title": "The Chronicles of Myrtana Archolos update 1.2.1 – 1.2.3 [Elamigos Update]",
      "uris": [
        "https://vikingfile.com/f/4LwVpeQnE7",
        "https://gofile.io/d/Jq55x2"
      ],
      "uploadDate": "2025-09-17T10:00:00.000Z",
      "fileSize": "176.36 MB",
      "Gamedrive_Link": "https://gamedrive.org/the-chronicles-of-myrtana-archolos-update-1-2-1-1-2-3-elamigos-update/"
    },
    {
      "title": "Cyberpunk 2077 2.30 – 2.31 (11.09.2025) [Elamigos Update]",
      "uris": [
        "https://vikingfile.com/f/calDOXTrWq",
        "https://gofile.io/d/Y8z5oY"
      ],
      "uploadDate": "2025-09-17T10:00:00.000Z",
      "fileSize": "972.63 MB",
      "Gamedrive_Link": "https://gamedrive.org/cyberpunk-2077-2-30-2-31-11-09-2025-elamigos-update/"
    },
    {
      "title": "Port Royale 4 Extended Edition update 1.6.0 – 1.7.0 [Elamigos Update]",
      "uris": [
        "https://vikingfile.com/f/e8VkBuTi7W",
        "https://gofile.io/d/HkeGtF"
      ],
      "uploadDate": "2025-09-17T10:00:00.000Z",
      "fileSize": "52.82 MB",
      "Gamedrive_Link": "https://gamedrive.org/port-royale-4-extended-edition-update-1-6-0-1-7-0-elamigos-update/"
    },
    {
      "title": "My Time At Portia update 12.05.2022 – 22.07.2022 [Elamigos Update]",
      "uris": [
        "https://vikingfile.com/f/2ne0KwfkL0",
        "https://gofile.io/d/pMD4vA"
      ],
      "uploadDate": "2025-09-17T10:00:00.000Z",
      "fileSize": "6.36 MB",
      "Gamedrive_Link": "https://gamedrive.org/my-time-at-portia-update-12-05-2022-22-07-2022-elamigos-update/"
    },
    {
      "title": "Cricket 24 Update v0.2.5426 – v0.2.5444 [GameDrive]",
      "uris": [
        "https://vikingfile.com/f/YmDc9RM3ay",
        "https://gofile.io/d/MUuP4P",
        "https://pixeldrain.com/u/R29msWTX"
      ],
      "uploadDate": "2025-09-17T10:00:00.000Z",
      "fileSize": "21.83 MB",
      "Gamedrive_Link": "https://gamedrive.org/cricket-24-update-v0-2-5426-v0-2-5444/"
    },
    {
      "title": "The Talos Principle 2 update 692680 – 696260 (13.08.2024; v2.2.0) [Elamigos Update]",
      "uris": [
        "https://vikingfile.com/f/vHXmjyUDcH",
        "https://gofile.io/d/ftIbJh"
      ],
      "uploadDate": "2025-09-17T10:00:00.000Z",
      "fileSize": "400.09 MB",
      "Gamedrive_Link": "https://gamedrive.org/the-talos-principle-2-update-692680-696260-13-08-2024-v2-2-0-elamigos-update/"
    },
    {
      "title": "Disco Elysium update 09.05.2024 – 27.11.2024 [Elamigos Update]",
      "uris": [
        "https://vikingfile.com/f/WrzxAVtvlj",
        "https://gofile.io/d/tDK6Po"
      ],
      "uploadDate": "2025-09-17T10:00:00.000Z",
      "fileSize": "858.57 MB",
      "Gamedrive_Link": "https://gamedrive.org/disco-elysium-update-09-05-2024-27-11-2024-elamigos-update/"
    },
    {
      "title": "Black Mesa Definitive Edition update 12.05.2025 – 01.07.2025 [Elamigos Update]",
      "uris": [
        "https://vikingfile.com/f/Quav8oIbCM",
        "https://gofile.io/d/G7L4fk"
      ],
      "uploadDate": "2025-09-17T10:00:00.000Z",
      "fileSize": "192.51 MB",
      "Gamedrive_Link": "https://gamedrive.org/black-mesa-definitive-edition-update-12-05-2025-01-07-2025-elamigos-update/"
    },
    {
      "title": "A Hat in Time update 04.01.2024 – 04.07.2025 [Elamigos Update]",
      "uris": [
        "https://vikingfile.com/f/2DHW4gFfIZ",
        "https://gofile.io/d/FFeTz1"
      ],
      "uploadDate": "2025-09-17T10:00:00.000Z",
      "fileSize": "108.21 MB",
      "Gamedrive_Link": "https://gamedrive.org/a-hat-in-time-update-04-01-2024-04-07-2025-elamigos-update/"
    },
    {
      "title": "Ruined King A League of Legends Story update 59081 – 60323 (29.03.2023) [Elamigos Update]",
      "uris": [
        "https://vikingfile.com/f/B45sIx5UPv",
        "https://gofile.io/d/bFPPV3",
        "https://pixeldrain.com/u/RK59T2Rm"
      ],
      "uploadDate": "2025-09-17T10:00:00.000Z",
      "fileSize": "103.69 MB",
      "Gamedrive_Link": "https://gamedrive.org/ruined-king-a-league-of-legends-story-update-59081-60323-29-03-2023-elamigos-update/"
    },
    {
      "title": "Guilty Gear STRIVE update 1.44 – 1.48 (21.08.2025) [Elamigos Update]",
      "uris": [
        "https://vikingfile.com/f/NCil2gkBvH",
        "https://gofile.io/d/zxMR4H",
        "https://pixeldrain.com/u/nqfNS6VR"
      ],
      "uploadDate": "2025-09-17T10:00:00.000Z",
      "fileSize": "2.07 GB",
      "Gamedrive_Link": "https://gamedrive.org/guilty-gear-strive-update-1-44-1-48-21-08-2025-elamigos-update/"
    },
    {
      "title": "METAL GEAR SOLID Snake Eater update v1.1.1 – v1.1.2 [GameDrive Update]",
      "uris": [
        "https://vikingfile.com/f/O9atJXS56S",
        "https://gofile.io/d/xbORjM"
      ],
      "uploadDate": "2025-08-18T10:00:00.000Z",
      "fileSize": "867.59 MB",
      "Gamedrive_Link": "https://gamedrive.org/metal-gear-solid-snake-eater-update-v1-1-1-v1-1-2-gamedrive-update/"
    },
    {
      "title": "Jagged Alliance Rage update 3 (09.04.2019) [Elamigos Update]",
      "uris": [
        "https://vikingfile.com/f/JnBxzQBaEk",
        "https://gofile.io/d/gDbMFA",
        "https://pixeldrain.com/u/LJz66xD5"
      ],
      "uploadDate": "2025-08-18T10:00:00.000Z",
      "fileSize": "561.02 MB",
      "Gamedrive_Link": "https://gamedrive.org/jagged-alliance-rage-update-3-09-04-2019-elamigos-update/"
    },
    {
      "title": "Death Stranding Directors Cut update 1.001 – 1.004 [Elamigos Update]",
      "uris": [
        "https://vikingfile.com/f/rxvzIPx5V6",
        "https://gofile.io/d/dxIW6v",
        "https://pixeldrain.com/u/poidUXEv"
      ],
      "uploadDate": "2025-08-18T10:00:00.000Z",
      "fileSize": "5.16 GB",
      "Gamedrive_Link": "https://gamedrive.org/death-stranding-directors-cut-update-1-001-1-004-elamigos-update/"
    },
    {
      "title": "Black Geyser Couriers of Darkness update 1.2.33 – 1.2.59 (04.10.2024) [Elamigos Update]",
      "uris": [
        "https://vikingfile.com/f/XmHkaJYC89",
        "https://gofile.io/d/pGkcrg",
        "https://pixeldrain.com/u/d4X1irLG"
      ],
      "uploadDate": "2025-08-18T10:00:00.000Z",
      "fileSize": "462.60 MB",
      "Gamedrive_Link": "https://gamedrive.org/black-geyser-couriers-of-darkness-update-1-2-33-1-2-59-04-10-2024-elamigos-update/"
    },
    {
      "title": "The Plucky Squire update 1.10.3 – 1.50.18 (09.07.2025) [Elamigos Update]",
      "uris": [
        "https://vikingfile.com/f/eH9ffY2DgK",
        "https://gofile.io/d/EKXcUM",
        "https://pixeldrain.com/u/y28wz2mM"
      ],
      "uploadDate": "2025-08-18T10:00:00.000Z",
      "fileSize": "378.56 MB",
      "Gamedrive_Link": "https://gamedrive.org/the-plucky-squire-update-1-10-3-1-50-18-09-07-2025-elamigos-update/"
    },
    {
      "title": "Stellaris update 4.0.1 – 4.0.21 (17.06.2025) [Elamigos Update]",
      "uris": [
        "https://vikingfile.com/f/zpv392lDMg",
        "https://gofile.io/d/XQd8Sb",
        "https://pixeldrain.com/u/F2FUMrRa"
      ],
      "uploadDate": "2025-08-18T10:00:00.000Z",
      "fileSize": "32.85 MB",
      "Gamedrive_Link": "https://gamedrive.org/stellaris-update-4-0-1-4-0-21-17-06-2025-elamigos-update/"
    },
    {
      "title": "Silent Hill 2 2024 Remake update 30.01.2025 (v1.07) [Elamigos Update]",
      "uris": [
        "https://vikingfile.com/f/XU4m28BBrI",
        "https://gofile.io/d/lwpmqf",
        "https://pixeldrain.com/u/kemBegCk"
      ],
      "uploadDate": "2025-08-18T10:00:00.000Z",
      "fileSize": "263.81 MB",
      "Gamedrive_Link": "https://gamedrive.org/silent-hill-2-2024-remake-update-30-01-2025-v1-07-elamigos-update/"
    },
    {
      "title": "Red Dead Redemption update 1.0.42 (03.12.2024) [Elamigos Update]",
      "uris": [
        "https://vikingfile.com/f/obKRKxEc5q",
        "https://gofile.io/d/rW574l",
        "https://pixeldrain.com/u/j9WY7Z7S"
      ],
      "uploadDate": "2025-08-18T10:00:00.000Z",
      "fileSize": "18.81 MB",
      "Gamedrive_Link": "https://gamedrive.org/red-dead-redemption-update-1-0-42-03-12-2024-elamigos-update/"
    },
    {
      "title": "My Time at Sandrock update 1.4.0.1 – 1.4.2.1 (20.02.2025) [Elamigos Update]",
      "uris": [
        "https://vikingfile.com/f/Jv3c1KIppm",
        "https://gofile.io/d/kwRNrd",
        "https://pixeldrain.com/u/JfepWP3a"
      ],
      "uploadDate": "2025-08-18T10:00:00.000Z",
      "fileSize": "26.69 MB",
      "Gamedrive_Link": "https://gamedrive.org/my-time-at-sandrock-update-1-4-0-1-1-4-2-1-20-02-2025-elamigos-update/"
    },
    {
      "title": "Indiana Jones and the Great Circle update 26.02.2025 [Elamigos Update]",
      "uris": [
        "https://vikingfile.com/f/yQgrbLwB9A",
        "https://gofile.io/d/agI9Ej",
        "https://pixeldrain.com/u/X6p8dTYA"
      ],
      "uploadDate": "2025-08-18T10:00:00.000Z",
      "fileSize": "27.02 MB",
      "Gamedrive_Link": "https://gamedrive.org/indiana-jones-and-the-great-circle-update-26-02-2025-elamigos-update/"
    },
    {
      "title": "Indiana Jones and the Great Circle update 23.04.2025 [Elamigos Update]",
      "uris": [
        "https://vikingfile.com/f/reUSUwhu1e",
        "https://gofile.io/d/ZGU8cV",
        "https://pixeldrain.com/u/RFVfC5rd"
      ],
      "uploadDate": "2025-08-18T10:00:00.000Z",
      "fileSize": "31.26 MB",
      "Gamedrive_Link": "https://gamedrive.org/indiana-jones-and-the-great-circle-update-23-04-2025-elamigos-update/"
    },
    {
      "title": "Indiana Jones and the Great Circle update 10.04.2025 [Elamigos Update]",
      "uris": [
        "https://vikingfile.com/f/ptEgEQBiaK",
        "https://gofile.io/d/YMUNQU",
        "https://pixeldrain.com/u/BECX41YE"
      ],
      "uploadDate": "2025-08-18T10:00:00.000Z",
      "fileSize": "1.74 GB",
      "Gamedrive_Link": "https://gamedrive.org/indiana-jones-and-the-great-circle-update-10-04-2025-elamigos-update/"
    },
    {
      "title": "House Builder update 21.03.2025 – 05.08.2025 [Elamigos Update]",
      "uris": [
        "https://vikingfile.com/f/RnH9SecYQ4",
        "https://gofile.io/d/h0Wr8G",
        "https://pixeldrain.com/u/AjsT5vCh"
      ],
      "uploadDate": "2025-08-18T10:00:00.000Z",
      "fileSize": "375.59 MB",
      "Gamedrive_Link": "https://gamedrive.org/house-builder-update-21-03-2025-05-08-2025-elamigos-update/"
    },
    {
      "title": "Hollowbody update 13.09.2024 – 20.12.2024 [Elamigos Update]",
      "uris": [
        "https://vikingfile.com/f/DGo37xcVjv",
        "https://gofile.io/d/oq0pTo",
        "https://pixeldrain.com/u/kqGFfsqH"
      ],
      "uploadDate": "2025-08-18T10:00:00.000Z",
      "fileSize": "199.2 MB",
      "Gamedrive_Link": "https://gamedrive.org/hollowbody-update-13-09-2024-20-12-2024-elamigos-update/"
    },
    {
      "title": "Dragon Age The Veilguard update 23.01.2025 [Elamigos Update]",
      "uris": [
        "https://vikingfile.com/f/T0sUaR2l6y",
        "https://gofile.io/d/MwaEso",
        "https://pixeldrain.com/u/PgSKgM54"
      ],
      "uploadDate": "2025-08-18T10:00:00.000Z",
      "fileSize": "94.04 MB",
      "Gamedrive_Link": "https://gamedrive.org/dragon-age-the-veilguard-update-23-01-2025-elamigos-update/"
    },
    {
      "title": "Dragon Age The Veilguard update 07.11.2024 [Elamigos Update]",
      "uris": [
        "https://vikingfile.com/f/hiz4cOmRYO",
        "https://gofile.io/d/9RptYc",
        "https://pixeldrain.com/u/SZwxsqiq"
      ],
      "uploadDate": "2025-08-18T10:00:00.000Z",
      "fileSize": "850.16 MB",
      "Gamedrive_Link": "https://gamedrive.org/dragon-age-the-veilguard-update-07-11-2024-elamigos-update/"
    },
    {
      "title": "Dragon Age The Veilguard update 04.12.2024 [Elamigos Update]",
      "uris": [
        "https://vikingfile.com/f/nj44cVsnsd",
        "https://gofile.io/d/o3P2yq",
        "https://pixeldrain.com/u/G3DSdfta"
      ],
      "uploadDate": "2025-08-19T10:00:00.000Z",
      "fileSize": "644.78 MB",
      "Gamedrive_Link": "https://gamedrive.org/dragon-age-the-veilguard-update-04-12-2024-elamigos-update/"
    },
    {
      "title": "Diplomacy is Not an Option update 1.0.54 – 1.0.69 (20.08.2025) [Elamigos Update]",
      "uris": [
        "https://vikingfile.com/f/kYydsyhRHz",
        "https://gofile.io/d/82pX9o",
        "https://pixeldrain.com/u/iNn3BJga"
      ],
      "uploadDate": "2025-08-19T10:00:00.000Z",
      "fileSize": "10.69 MB",
      "Gamedrive_Link": "https://gamedrive.org/diplomacy-is-not-an-option-update-1-0-54-1-0-69-20-08-2025-elamigos-update/"
    },
    {
      "title": "Cricket 24 Update v0.2.5398 – v0.2.5426 [GameDrive]",
      "uris": [
        "https://vikingfile.com/f/2Ji51o2Vsn",
        "https://gofile.io/d/hPdpgh",
        "https://pixeldrain.com/u/ZK3FgEXY"
      ],
      "uploadDate": "2025-08-19T10:00:00.000Z",
      "fileSize": "42.18 MB",
      "Gamedrive_Link": "https://gamedrive.org/cricket-24-update-v0-2-5398-v0-2-5426-gamedrive/"
    },
    {
      "title": "WUCHANG Fallen Feathers update v19367964/v19447727 – v19518578 (1.5) [GameDrive Update]",
      "uris": [
        "https://vikingfile.com/f/HvKorXi91u",
        "https://gofile.io/d/vRryCr"
      ],
      "uploadDate": "2025-08-19T10:00:00.000Z",
      "fileSize": "686.16 MB",
      "Gamedrive_Link": "https://gamedrive.org/wuchang-fallen-feathers-update-v19367964-v19447727-v19518578-1-5-gamedrive-update/"
    },
    {
      "title": "Cricket 24 Update v0.2.5362 – v0.2.5398 [GameDrive]",
      "uris": [
        "https://vikingfile.com/f/UxN1WeCHmj",
        "https://gofile.io/d/sVknM5",
        "https://pixeldrain.com/u/xt1Lw4z2"
      ],
      "uploadDate": "2025-08-19T10:00:00.000Z",
      "fileSize": "427.35 MB",
      "Gamedrive_Link": "https://gamedrive.org/cricket-24-update-v0-2-5362-v0-2-5398-gamedrive/"
    },
    {
      "title": "Workers and Resources Soviet Republic update 1.1.0.7 – 1.1.0.11 [Elamigos Update]",
      "uris": [
        "https://vikingfile.com/f/s9HorA2Xck",
        "https://gofile.io/d/MOJAsM",
        "https://datanodes.to/9k3zgtuh9bic/07700gg65.EU-GameDrive.Org.rar",
        "https://pixeldrain.com/u/sd2EWxN8"
      ],
      "uploadDate": "2025-07-20T10:00:00.000Z",
      "fileSize": "81.61 MB",
      "Gamedrive_Link": "https://gamedrive.org/workers-and-resources-soviet-republic-update-1-1-0-7-1-1-0-11-elamigos-update/"
    },
    {
      "title": "Wartales update 1.0.41212 – 1.0.41402 (22.05.2025) [Elamigos Update]",
      "uris": [
        "https://vikingfile.com/f/7YhF5ooEEn",
        "https://gofile.io/d/xEsI3M",
        "https://datanodes.to/cv3xbf4oan4h/56765yh65.EU-GameDrive.Org.rar",
        "https://pixeldrain.com/u/DRQMdH8o"
      ],
      "uploadDate": "2025-07-20T10:00:00.000Z",
      "fileSize": "3.47 MB",
      "Gamedrive_Link": "https://gamedrive.org/wartales-update-1-0-41212-1-0-41402-22-05-2025-elamigos-update/"
    },
    {
      "title": "WARNO update 150731 – 158113 (18.06.2025) [Elamigos Update]",
      "uris": [
        "https://vikingfile.com/f/GhiyWY7LJB",
        "https://gofile.io/d/jKjQnl",
        "https://datanodes.to/bxhav8t4r213/76j67jg65.EU-GameDrive.Org.rar",
        "https://pixeldrain.com/u/cqyyWoN7"
      ],
      "uploadDate": "2025-07-20T10:00:00.000Z",
      "fileSize": "1.99 GB",
      "Gamedrive_Link": "https://gamedrive.org/warno-update-150731-158113-18-06-2025-elamigos-update/"
    },
    {
      "title": "WARNO update 141373 – 150731 (25.03.2025) [Elamigos Update]",
      "uris": [
        "https://vikingfile.com/f/u7MFCkqJoi",
        "https://gofile.io/d/gEPvwM",
        "https://datanodes.to/uepeoo7h5g0e/65h567jh67g65.EU-GameDrive.Org.rar",
        "https://pixeldrain.com/u/BmQWFg6H"
      ],
      "uploadDate": "2025-07-20T10:00:00.000Z",
      "fileSize": "3.8 GB",
      "Gamedrive_Link": "https://gamedrive.org/warno-update-141373-150731-25-03-2025-elamigos-update/"
    },
    {
      "title": "Warhammer 40000 Inquisitor Martyr update 2.9.1 – 2.9.4 (25.06.2024) [Elamigos Update]",
      "uris": [
        "https://vikingfile.com/f/iEQH3ytsyz",
        "https://gofile.io/d/ls4q4e",
        "https://datanodes.to/jf7q0i7fmgpa/040587350g65.EU-GameDrive.Org.rar",
        "https://pixeldrain.com/u/G2qJpkxZ"
      ],
      "uploadDate": "2025-07-20T10:00:00.000Z",
      "fileSize": "869.58 MB",
      "Gamedrive_Link": "https://gamedrive.org/warhammer-40000-inquisitor-martyr-update-2-9-1-2-9-4-25-06-2024-elamigos-update/"
    },
    {
      "title": "The Casting of Frank Stone update 26.09.2024 [Elamigos Update]",
      "uris": [
        "https://vikingfile.com/f/mokJqUSK7D",
        "https://gofile.io/d/JGzesm",
        "https://datanodes.to/b0c06esawu5v/04074065.EU-GameDrive.Org.rar",
        "https://pixeldrain.com/u/rUoZQUgL"
      ],
      "uploadDate": "2025-07-20T10:00:00.000Z",
      "fileSize": "264.60 MB",
      "Gamedrive_Link": "https://gamedrive.org/the-casting-of-frank-stone-update-26-09-2024-elamigos-update/"
    },
    {
      "title": "Atlas Fallen update 06.08.2024 – 15.10.2024 [Elamigos Update]",
      "uris": [
        "https://vikingfile.com/f/saJhJJZtmK",
        "https://datanodes.to/dcuh5eakq1lm/h65u70gg.EU-GameDrive.Org.rar",
        "https://pixeldrain.com/u/iMbKKtG7"
      ],
      "uploadDate": "2025-07-20T10:00:00.000Z",
      "fileSize": "69.31 MB",
      "Gamedrive_Link": "https://gamedrive.org/atlas-fallen-update-06-08-2024-15-10-2024-elamigos-update/"
    },
    {
      "title": "Age of Mythology Retold update 18.15886 – 18.34798 [Elamigos Update]",
      "uris": [
        "https://vikingfile.com/f/iqejd717YF",
        "https://datanodes.to/ckdu1b3n7kqj/i76i6770gg.EU-GameDrive.Org.rar",
        "https://pixeldrain.com/u/HvGGruY4"
      ],
      "uploadDate": "2025-07-20T10:00:00.000Z",
      "fileSize": "501.16 MB",
      "Gamedrive_Link": "https://gamedrive.org/age-of-mythology-retold-update-18-15886-18-34798-elamigos-update/"
    },
    {
      "title": "WUCHANG Fallen Feathers update v19349081 (1.3) – v19367964 (1.4) [GameDrive Update]",
      "uris": [
        "https://vikingfile.com/f/1RS7na4Ygw",
        "https://gofile.io/d/lP7cnn",
        "https://pixeldrain.com/u/bwHqwpnx"
      ],
      "uploadDate": "2025-07-20T10:00:00.000Z",
      "fileSize": "10.49 MB",
      "Gamedrive_Link": "https://gamedrive.org/wuchang-fallen-feathers-update-v19349081-1-3-v19367964-1-4-gamedrive-update/"
    },
    {
      "title": "WWE 2K25 Update v1.21 incl DLC-RUNE",
      "uris": [
        "https://vikingfile.com/f/hahFAxqH1d",
        "https://gofile.io/d/UMISRu",
        "https://pixeldrain.com/u/mZWu79rQ"
      ],
      "uploadDate": "2025-07-20T10:00:00.000Z",
      "fileSize": "3.69 GB",
      "Gamedrive_Link": "https://gamedrive.org/wwe-2k25-update-v1-21-incl-dlc-rune/"
    },
    {
      "title": "WUCHANG Fallen Feathers update v19308272 – v19349081 (Patch 1.3 (July 24 Update) [GameDrive Update]",
      "uris": [
        "https://vikingfile.com/f/cjgO6JkylS",
        "https://pixeldrain.com/u/VxBzbHov"
      ],
      "uploadDate": "2025-07-20T10:00:00.000Z",
      "fileSize": "186.25 MB",
      "Gamedrive_Link": "https://gamedrive.org/wuchang-fallen-feathers-update-v19308272-v19349081-gamedrive-update/"
    },
    {
      "title": "WWE 2K25 update 1.16 – 1.21 (23.07.2025) [Elamigos Update]",
      "uris": [
        "https://gofile.io/d/fpztRf",
        "https://vikingfile.com/f/vSEUFRr6KT",
        "https://pixeldrain.com/u/srWufKgL"
      ],
      "uploadDate": "2025-07-20T10:00:00.000Z",
      "fileSize": "1.24 GB",
      "Gamedrive_Link": "https://gamedrive.org/wwe-2k25-update-1-16-1-21-23-07-2025-elamigos-update/"
    },
    {
      "title": "The Riftbreaker update 21.06.2024 – 20.03.2025 [Elamigos Update]",
      "uris": [
        "https://vikingfile.com/f/lGqnTEX6GM",
        "https://datanodes.to/t4ba5gm7aq75/y6578ug678.EU-GameDrive.Org.rar",
        "https://pixeldrain.com/u/6ymrC3mB"
      ],
      "uploadDate": "2025-07-20T10:00:00.000Z",
      "fileSize": "430.0 MB",
      "Gamedrive_Link": "https://gamedrive.org/the-riftbreaker-update-21-06-2024-20-03-2025-elamigos-update/"
    },
    {
      "title": "Saint Seiya Soldiers Soul update 1 (07.12.2015) [Elamigos Update]",
      "uris": [
        "https://vikingfile.com/f/gDEKMUhz67",
        "https://datanodes.to/37syztuvuuvv/021404538.EU-GameDrive.Org.rar",
        "https://pixeldrain.com/u/ziB7Bd2w"
      ],
      "uploadDate": "2025-07-20T10:00:00.000Z",
      "fileSize": "7.22 MB",
      "Gamedrive_Link": "https://gamedrive.org/saint-seiya-soldiers-soul-update-1-07-12-2015-elamigos-update/"
    },
    {
      "title": "Park Beyond update 16.07.2024 – 28.08.2024 (v4.0.1) [Elamigos Update]",
      "uris": [
        "https://vikingfile.com/f/4ZMisI3mLQ",
        "https://datanodes.to/ukpmgx5x511e/074587278.EU-GameDrive.Org.rar",
        "https://pixeldrain.com/u/mTDwMMu6"
      ],
      "uploadDate": "2025-07-20T10:00:00.000Z",
      "fileSize": "16.8 MB",
      "Gamedrive_Link": "https://gamedrive.org/park-beyond-update-16-07-2024-28-08-2024-v4-0-1-elamigos-update/"
    },
    {
      "title": "Old World update 1.0.74622 – 1.0.78527 (25.06.2025) [Elamigos Update]",
      "uris": [
        "https://vikingfile.com/f/3ZjIlGgwL8",
        "https://datanodes.to/g858k2rjfvuv/54y54700g678.EU-GameDrive.Org.rar",
        "https://pixeldrain.com/u/UYnay7LD"
      ],
      "uploadDate": "2025-07-20T10:00:00.000Z",
      "fileSize": "378.8 MB",
      "Gamedrive_Link": "https://gamedrive.org/old-world-update-1-0-74622-1-0-78527-25-06-2025-elamigos-update/"
    },
    {
      "title": "Earth Defense Force 6 update 22.01.2025 [Elamigos Update]",
      "uris": [
        "https://vikingfile.com/f/ihRMtgrlBy",
        "https://datanodes.to/rb80td3b4jnk/hfgh678.EU-GameDrive.Org.rar",
        "https://pixeldrain.com/u/K2SbQ73c"
      ],
      "uploadDate": "2025-07-20T10:00:00.000Z",
      "fileSize": "7.05 MB",
      "Gamedrive_Link": "https://gamedrive.org/earth-defense-force-6-update-22-01-2025-elamigos-update/"
    },
    {
      "title": "Destroyer The U-Boat Hunter update 01.03.2024 (v1.0.8) [Elamigos Update]",
      "uris": [
        "https://vikingfile.com/f/vy8z8hEzsa",
        "https://datanodes.to/83slv2gu2ybc/rgerty678.EU-GameDrive.Org.rar",
        "https://pixeldrain.com/u/73bdUUBz"
      ],
      "uploadDate": "2025-07-20T10:00:00.000Z",
      "fileSize": "15.0 MB",
      "Gamedrive_Link": "https://gamedrive.org/destroyer-the-u-boat-hunter-update-01-03-2024-v1-0-8-elamigos-update/"
    },
    {
      "title": "Dragon Ball Z Kakarot update 2.12 – 2.20 [XDelta/Elamigos Update]",
      "uris": [
        "https://vikingfile.com/f/leoHGvHpWh#DBZK.2.12-2.20.GameDrive.org.rar",
        "https://pixeldrain.com/u/o4evjXNG"
      ],
      "uploadDate": "2025-07-20T10:00:00.000Z",
      "fileSize": "6.57 GB",
      "Gamedrive_Link": "https://gamedrive.org/dragon-ball-z-kakarot-update-2-12-2-20-xdelta-elamigos-update/"
    },
    {
      "title": "Shadow Gambit The Cursed Crew update 1.2.122 – 1.2.133 (19.12.2023) [Elamigos Update]",
      "uris": [
        "https://vikingfile.com/f/08foSGPH88",
        "https://datanodes.to/e6cqofjmovdm/475078.EU-GameDrive.Org.rar",
        "https://pixeldrain.com/u/ajeWjLkd"
      ],
      "uploadDate": "2025-07-20T10:00:00.000Z",
      "fileSize": "1.29 GB",
      "Gamedrive_Link": "https://gamedrive.org/shadow-gambit-the-cursed-crew-update-1-2-122-1-2-133-19-12-2023-elamigos-update/"
    },
    {
      "title": "The Long Dark update 2.39 – 2.43 (28.05.2025) [Elamigos Update]",
      "uris": [
        "https://vikingfile.com/f/PW22YytDdM",
        "https://datanodes.to/easvvy7dtnk4/400gg678.EU-GameDrive.Org.rar",
        "https://pixeldrain.com/u/BcCikWr3"
      ],
      "uploadDate": "2025-07-20T10:00:00.000Z",
      "fileSize": "718.36 MB",
      "Gamedrive_Link": "https://gamedrive.org/the-long-dark-update-2-39-2-43-28-05-2025-elamigos-update/"
    },
    {
      "title": "Still Wakes the Deep update 1.5 – 1.6 [Elamigos Update]",
      "uris": [
        "https://vikingfile.com/f/JPIaZFEzbS",
        "https://datanodes.to/tn54x4uhdspf/sdf56.EU-GameDrive.Org.rar",
        "https://pixeldrain.com/u/9rQVsq1J"
      ],
      "uploadDate": "2025-07-20T10:00:00.000Z",
      "fileSize": "309.80 MB",
      "Gamedrive_Link": "https://gamedrive.org/still-wakes-the-deep-update-1-5-1-6-elamigos-update/"
    },
    {
      "title": "Trepang2 update 2471 – 2484 [Elamigos Update]",
      "uris": [
        "https://vikingfile.com/f/raq8r6Ojtg",
        "https://datanodes.to/4lm0a93al5w2/0gg678.EU-GameDrive.Org.rar",
        "https://pixeldrain.com/u/dngqMrSU"
      ],
      "uploadDate": "2025-07-20T10:00:00.000Z",
      "fileSize": "24.24 MB",
      "Gamedrive_Link": "https://gamedrive.org/trepang2-update-2471-2484-elamigos-update/"
    },
    {
      "title": "Outcast A New Beginning update 1.0.3.1 – 1.0.5.0 [Elamigos Update]",
      "uris": [
        "https://vikingfile.com/f/z3WmfrNJFo",
        "https://pixeldrain.com/u/5Sqhgk1f"
      ],
      "uploadDate": "2025-07-20T10:00:00.000Z",
      "fileSize": "5.41 GB",
      "Gamedrive_Link": "https://gamedrive.org/outcast-a-new-beginning-update-1-0-3-1-1-0-5-0-elamigos-update/"
    },
    {
      "title": "The Callisto Protocol update 26.03.2024 – 30.07.2024 [Elamigos Update]",
      "uris": [
        "https://vikingfile.com/f/p4pKJj8wCF",
        "https://pixeldrain.com/u/Ur6VMu2C"
      ],
      "uploadDate": "2025-07-20T10:00:00.000Z",
      "fileSize": "1.72 GB",
      "Gamedrive_Link": "https://gamedrive.org/the-callisto-protocol-update-26-03-2024-30-07-2024-elamigos-update/"
    },
    {
      "title": "Contra Operation Galuga update 09.05.2024 [Elamigos Update]",
      "uris": [
        "https://vikingfile.com/f/VJYrmuP2vI",
        "https://pixeldrain.com/u/gxJH3ZK1"
      ],
      "uploadDate": "2025-07-20T10:00:00.000Z",
      "fileSize": "8.81 MB",
      "Gamedrive_Link": "https://gamedrive.org/contra-operation-galuga-update-09-05-2024-elamigos-update/"
    },
    {
      "title": "Aliens Fireteam Elite update 114925 – 114949 (26.04.2024) [Elamigos Update]",
      "uris": [
        "https://vikingfile.com/f/DKqkK4wB9T",
        "https://pixeldrain.com/u/Kdg9Tscr"
      ],
      "uploadDate": "2025-07-20T10:00:00.000Z",
      "fileSize": "248.81 MB",
      "Gamedrive_Link": "https://gamedrive.org/aliens-fireteam-elite-update-114925-114949-26-04-2024-elamigos-update/"
    },
    {
      "title": "System Shock 2023 Remake update 1.2.18830 – 1.2.18898 (21.05.2024) [Elamigos Update]",
      "uris": [
        "https://vikingfile.com/f/LvUDWBSzgY",
        "https://pixeldrain.com/u/nrywMZBC"
      ],
      "uploadDate": "2025-07-20T10:00:00.000Z",
      "fileSize": "47.57 MB",
      "Gamedrive_Link": "https://gamedrive.org/system-shock-2023-remake-update-1-2-18830-1-2-18898-21-05-2024-elamigos-update/"
    },
    {
      "title": "Indika update 21.10.2024 [Elamigos Update]",
      "uris": [
        "https://vikingfile.com/f/tPhMwNTIRn",
        "https://pixeldrain.com/u/XxKu6qQG"
      ],
      "uploadDate": "2025-07-20T10:00:00.000Z",
      "fileSize": "341.30 MB",
      "Gamedrive_Link": "https://gamedrive.org/indika-update-21-10-2024-elamigos-update/"
    },
    {
      "title": "SubwaySim 2 update v18839168 – v19159089 [GameDrive Update]",
      "uris": [
        "https://vikingfile.com/f/Z9PPAEv4ch",
        "https://datanodes.to/959qhekz110h/SS2.v19159089.GU-GameDrive.Org.rar",
        "https://pixeldrain.com/u/XDUxt2qW"
      ],
      "uploadDate": "2025-07-20T00:00:00.000Z",
      "fileSize": "139.22 MB",
      "Gamedrive_Link": "https://gamedrive.org/subwaysim-2-update-v18839168-v19159089-gamedrive-update/"
    },
    {
      "title": "Tomb Raider I-III Remastered Starring Lara Croft update 06.06.2024 – 04.11.2024 [Elamigos Update]",
      "uris": [
        "https://vikingfile.com/f/GCGgPDRZhN",
        "https://pixeldrain.com/u/yFTZoMvo"
      ],
      "uploadDate": "2024-06-06T00:00:00.000Z",
      "fileSize": "160.29 MB",
      "Gamedrive_Link": "https://gamedrive.org/tomb-raider-i-iii-remastered-starring-lara-croft-update-06-06-2024-04-11-2024-elamigos-update/"
    },
    {
      "title": "Rise of the Tomb Raider update 1.0.1026.0 – 1.0.1027.0 (07.12.2021) [Elamigos Update]",
      "uris": [
        "https://vikingfile.com/f/SywxAv5vPK",
        "https://pixeldrain.com/u/VryAHB8q"
      ],
      "uploadDate": "2021-12-07T00:00:00.000Z",
      "fileSize": "12.67 MB",
      "Gamedrive_Link": "https://gamedrive.org/rise-of-the-tomb-raider-update-1-0-1026-0-1-0-1027-0-07-12-2021-elamigos-update/"
    },
    {
      "title": "Mr Prepper update 1.32c – 1.34e (02.08.2024) [Elamigos Update]",
      "uris": [
        "https://vikingfile.com/f/uUdOZQCRRD",
        "https://pixeldrain.com/u/XZEbKHvr"
      ],
      "uploadDate": "2024-08-02T00:00:00.000Z",
      "fileSize": "",
      "Gamedrive_Link": "https://gamedrive.org/mr-prepper-update-1-32c-1-34e-02-08-2024-elamigos-update/"
    },
    {
      "title": "Cricket 24 Update v0.2.5328 – v0.2.5362 [GameDrive]",
      "uris": [
        "https://datanodes.to/tkwc8bkxmceq/C24.v0.2.5328%E2%80%93v0.2.5362-GameDrive.Org.rar",
        "https://vikingfile.com/f/ST543YNanm",
        "https://pixeldrain.com/u/S9csSR3q"
      ],
      "uploadDate": "2025-07-20T00:00:00.000Z",
      "fileSize": "234.95 MB",
      "Gamedrive_Link": "https://gamedrive.org/cricket-24-update-v0-2-5328-v0-2-5362-gamedrive/"
    },
    {
      "title": "Dying Light 2 Stay Human update 1.22.0 – 1.23.0 (26.06.2025) [Elamigos Update]",
      "uris": [
        "https://vikingfile.com/f/xniMVTqsVp"
      ],
      "uploadDate": "2025-06-26T00:00:00.000Z",
      "fileSize": "1.42 GB",
      "Gamedrive_Link": "https://gamedrive.org/dying-light-2-stay-human-update-1-22-0-1-23-0-26-06-2025-elamigos-update/"
    },
    {
      "title": "Dying Light 2 Stay Human update 1.21.4 – 1.22.0 (17.04.2025) [Elamigos Update]",
      "uris": [
        "https://vikingfile.com/f/w6GNs3I1Oc"
      ],
      "uploadDate": "2025-04-17T00:00:00.000Z",
      "fileSize": "1.08 GB",
      "Gamedrive_Link": "https://gamedrive.org/dying-light-2-stay-human-update-1-21-4-1-22-0-17-04-2025-elamigos-update/"
    },
    {
      "title": "Dying Light 2 Stay Human update 1.21.0 – 1.21.4 (11.03.2025) [Elamigos Update]",
      "uris": [
        "https://vikingfile.com/f/cqdPxuxO3c",
        "https://pixeldrain.com/u/rDQ7K7TX"
      ],
      "uploadDate": "2025-03-11T00:00:00.000Z",
      "fileSize": "947.65 MB",
      "Gamedrive_Link": "https://gamedrive.org/dying-light-2-stay-human-update-1-21-0-1-21-4-11-03-2025-elamigos-update/"
    },
    {
      "title": "Lords of the Fallen 2023 update 2.0.9 – 2.0.35 (30.06.2025) [Elamigos Update]",
      "uris": [
        "https://vikingfile.com/f/KCBoRAGMF2",
        "https://pixeldrain.com/u/9kc8trCe"
      ],
      "uploadDate": "2025-06-30T00:00:00.000Z",
      "fileSize": "685.15 MB",
      "Gamedrive_Link": "https://gamedrive.org/lords-of-the-fallen-2023-update-2-0-9-2-0-35-30-06-2025-elamigos-update/"
    },
    {
      "title": "Last Epoch update 1.2.3.2 – 1.2.6.2 (30.06.2025) [Elamigos Update]",
      "uris": [
        "https://vikingfile.com/f/5uE5VsMwX0",
        "https://pixeldrain.com/u/FpLBom6j"
      ],
      "uploadDate": "2025-06-30T00:00:00.000Z",
      "fileSize": "653.23 MB",
      "Gamedrive_Link": "https://gamedrive.org/last-epoch-update-1-2-3-2-1-2-6-2-30-06-2025-elamigos-update/"
    },
    {
      "title": "Last Epoch Update 1.2.0.0 – 1.2.3.2 [Elamigos Update]",
      "uris": [
        "https://vikingfile.com/f/yufeMWVjH8",
        "https://pixeldrain.com/u/xTN2pWnf"
      ],
      "uploadDate": "2025-07-20T00:00:00.000Z",
      "fileSize": "437.90 MB",
      "Gamedrive_Link": "https://gamedrive.org/last-epoch-update-1-2-0-0-1-2-3-2-elamigos-update/"
    },
    {
      "title": "Forever skies Update 1.0.0.39 – 1.0.2.40 [Elamigos Update]",
      "uris": [
        "https://vikingfile.com/f/1HqYyW5Q3D",
        "https://pixeldrain.com/u/DNBMxNwa"
      ],
      "uploadDate": "2025-06-20T00:00:00.000Z",
      "fileSize": "327.67 MB",
      "Gamedrive_Link": "https://gamedrive.org/forever-skies-update-1-0-0-39-1-0-2-40-elamigos-update/"
    },
    {
      "title": "Farmers Life update 1.0.26 – 1.0.30 [Elamigos Update]",
      "uris": [
        "https://vikingfile.com/f/hIQqMEnLLt",
        "https://pixeldrain.com/u/M5jhPTxb"
      ],
      "uploadDate": "2025-06-20T00:00:00.000Z",
      "fileSize": "",
      "Gamedrive_Link": "https://gamedrive.org/farmers-life-update-1-0-26-1-0-30-elamigos-update/"
    },
    {
      "title": "WWE 2K25 update 1.14 – 1.16 [Elamigos Update]",
      "uris": [
        "https://datanodes.to/k0hwzh6z92hz",
        "https://vikingfile.com/f/cXkOaW7e9l",
        "https://pixeldrain.com/u/VP8pEV1E"
      ],
      "uploadDate": "2025-06-20T00:00:00.000Z",
      "fileSize": "1.6 GB",
      "Gamedrive_Link": "https://gamedrive.org/wwe-2k25-update-1-14-1-16-elamigos-update/"
    },
    {
      "title": "Darkest Dungeon II update 73217 – 74218 (20.02.2025) [Elamigos Update]",
      "uris": [
        "https://vikingfile.com/f/GvATXfE70B",
        "https://pixeldrain.com/u/7HEJww8U"
      ],
      "uploadDate": "2025-02-20T00:00:00.000Z",
      "fileSize": "198.91 MB",
      "Gamedrive_Link": "https://gamedrive.org/darkest-dungeon-ii-update-73217-74218-20-02-2025-elamigos-update/"
    },
    {
      "title": "Expeditions A MudRunner Game update 27.02.2025 – 02.04.2025 [Elamigos Update]",
      "uris": [
        "https://vikingfile.com/f/XEup1v9ADm",
        "https://pixeldrain.com/u/7iLpuZwT"
      ],
      "uploadDate": "2025-02-27T00:00:00.000Z",
      "fileSize": "110.39 MB",
      "Gamedrive_Link": "https://gamedrive.org/expeditions-a-mudrunner-game-update-27-02-2025-02-04-2025-elamigos-update/"
    },
    {
      "title": "Dungeons of Sundaria update 53570 – 53803 (20.08.2024) [Elamigos Update]",
      "uris": [
        "https://vikingfile.com/f/UhwpSEMrBy"
      ],
      "uploadDate": "2024-08-20T00:00:00.000Z",
      "fileSize": "",
      "Gamedrive_Link": "https://gamedrive.org/dungeons-of-sundaria-update-53570-53803-20-08-2024-elamigos-update/"
    },
    {
      "title": "Classified France 44 update 2108 – 2321 (v1.03; 07.06.2024) [Elamigos Update]",
      "uris": [
        "https://vikingfile.com/f/cVUvgLTInW",
        "https://pixeldrain.com/u/L9srxYxK"
      ],
      "uploadDate": "2024-06-07T00:00:00.000Z",
      "fileSize": "463 MB",
      "Gamedrive_Link": "https://gamedrive.org/classified-france-44-update-2108-2321-v1-03-07-06-2024-elamigos-update/"
    },
    {
      "title": "Arizona Sunshine 2 VR update 30.04.2024 – 21.11.2024 [Elamigos Update]",
      "uris": [
        "https://pixeldrain.com/u/MLRuXdFe"
      ],
      "uploadDate": "2024-04-30T00:00:00.000Z",
      "fileSize": "319.3 MB",
      "Gamedrive_Link": "https://gamedrive.org/arizona-sunshine-2-vr-update-30-04-2024-21-11-2024-elamigos-update/"
    },
    {
      "title": "WWE 2K24 update 1.23 – 1.25 [Elamigos Update]",
      "uris": [
        "https://vikingfile.com/f/PrJcclevTQ",
        "https://pixeldrain.com/u/X1YhEBRf"
      ],
      "uploadDate": "2025-06-20T00:00:00.000Z",
      "fileSize": "867.96 MB",
      "Gamedrive_Link": "https://gamedrive.org/wwe-2k24-update-1-23-1-25-elamigos-update/"
    },
    {
      "title": "WWE 2K24 update 1.19 – 1.23 [Elamigos Update]",
      "uris": [
        "https://vikingfile.com/f/AifrD3AZvv",
        "https://pixeldrain.com/u/4nCVXk67"
      ],
      "uploadDate": "2025-06-20T00:00:00.000Z",
      "fileSize": "904.17 MB",
      "Gamedrive_Link": "https://gamedrive.org/wwe-2k24-update-1-19-1-23-elamigos-update/"
    },
    {
      "title": "WWE 2K24 update 1.13 – 1.19 [Elamigos Update]",
      "uris": [
        "https://vikingfile.com/f/YhaDZ2yPzj",
        "https://pixeldrain.com/u/QaRQsQFD"
      ],
      "uploadDate": "2025-06-20T00:00:00.000Z",
      "fileSize": "1.62 GB",
      "Gamedrive_Link": "https://gamedrive.org/wwe-2k24-update-1-13-1-19-elamigos-update/"
    },
    {
      "title": "Welcome to ParadiZe update 28.10.2024 [Elamigos Update]",
      "uris": [
        "https://vikingfile.com/f/sblY4hlHTk",
        "https://pixeldrain.com/u/WjaYez6m"
      ],
      "uploadDate": "2024-10-28T00:00:00.000Z",
      "fileSize": "982.7 MB",
      "Gamedrive_Link": "https://gamedrive.org/welcome-to-paradize-update-28-10-2024-elamigos-update/"
    },
    {
      "title": "Tormented Souls update 24.03.2022 – 27.10.2023 [Elamigos Update]",
      "uris": [
        "https://vikingfile.com/f/lgfOvHfDjx",
        "https://pixeldrain.com/u/8fBcdoTS"
      ],
      "uploadDate": "2022-03-24T00:00:00.000Z",
      "fileSize": "179.87 MB",
      "Gamedrive_Link": "https://gamedrive.org/tormented-souls-update-24-03-2022-27-10-2023-elamigos-update/"
    },
    {
      "title": "The Invincible update 16.02.2024 – 09.06.2025 [Elamigos Update]",
      "uris": [
        "https://vikingfile.com/f/UdkmcbkVzK",
        "https://pixeldrain.com/u/pJ3ucmpe"
      ],
      "uploadDate": "2024-02-16T00:00:00.000Z",
      "fileSize": "251.24 MB",
      "Gamedrive_Link": "https://gamedrive.org/the-invincible-update-16-02-2024-09-06-2025-elamigos-update/"
    },
    {
      "title": "Jusant update 1.06 – 1.07 [Elamigos Update]",
      "uris": [
        "https://vikingfile.com/f/GX9d40QRRC",
        "https://pixeldrain.com/u/fLGpUxAF"
      ],
      "uploadDate": "2025-06-20T00:00:00.000Z",
      "fileSize": "37.21 MB",
      "Gamedrive_Link": "https://gamedrive.org/jusant-update-1-06-1-07-elamigos-update/"
    },
    {
      "title": "Terminator Dark Fate Defiance update 1.05.1083 – 1.06.1107 [Elamigos Update]",
      "uris": [
        "https://vikingfile.com/f/uIvebLOKDz",
        "https://pixeldrain.com/u/zut87xWk"
      ],
      "uploadDate": "2025-06-20T00:00:00.000Z",
      "fileSize": "1.41 GB",
      "Gamedrive_Link": "https://gamedrive.org/terminator-dark-fate-defiance-update-1-05-1083-1-06-1107-elamigos-update/"
    },
    {
      "title": "Session Skate Sim update 1.0.5.33 – 1.0.6.23 [Elamigos Update]",
      "uris": [
        "https://vikingfile.com/f/MRqOdSD4r6",
        "https://pixeldrain.com/u/j87P6nxk"
      ],
      "uploadDate": "2025-06-20T00:00:00.000Z",
      "fileSize": "144.58 MB",
      "Gamedrive_Link": "https://gamedrive.org/session-skate-sim-update-1-0-5-33-1-0-6-23-elamigos-update/"
    },
    {
      "title": "Poppy Playtime update 30.01.2025 – 05.02.2025 [Elamigos Update]",
      "uris": [
        "https://vikingfile.com/f/M3utDu7PNE",
        "https://pixeldrain.com/u/pxbKcsvS"
      ],
      "uploadDate": "2025-01-30T00:00:00.000Z",
      "fileSize": "2.18 GB",
      "Gamedrive_Link": "https://gamedrive.org/poppy-playtime-update-30-01-2025-05-02-2025-elamigos-update/"
    },
    {
      "title": "Poppy Playtime update 05.02.2025 – 06.03.2025 [Elamigos Update]",
      "uris": [
        "https://vikingfile.com/f/kAdug8KLd5"
      ],
      "uploadDate": "2025-02-05T00:00:00.000Z",
      "fileSize": "3.30 GB",
      "Gamedrive_Link": "https://gamedrive.org/poppy-playtime-update-05-02-2025-06-03-2025-elamigos-update/"
    },
    {
      "title": "Panzer Corps 2 update 1.14.3 – 1.15.1 [Elamigos Update]",
      "uris": [
        "https://vikingfile.com/f/n9wePaJPHS",
        "https://pixeldrain.com/u/yVEoBrPW"
      ],
      "uploadDate": "2025-06-20T00:00:00.000Z",
      "fileSize": "78.6 MB",
      "Gamedrive_Link": "https://gamedrive.org/panzer-corps-2-update-1-14-3-1-15-1-elamigos-update/"
    },
    {
      "title": "Dragon Ball Z Kakarot update 2.10 – 2.12 [Elamigos Update]",
      "uris": [
        "https://vikingfile.com/f/JiMaRJGwW7",
        "https://pixeldrain.com/u/uqypFMBE"
      ],
      "uploadDate": "2025-06-20T00:00:00.000Z",
      "fileSize": "421.99 MB",
      "Gamedrive_Link": "https://gamedrive.org/dragon-ball-z-kakarot-update-2-10-2-12-elamigos-update/"
    },
    {
      "title": "Coral Island update 1.1.1232 – 1.1.1237 (11.03.2025) [Elamigos Update]",
      "uris": [
        "https://vikingfile.com/f/uYodPBaSz1",
        "https://pixeldrain.com/u/5EAEQ4QE"
      ],
      "uploadDate": "2025-03-11T00:00:00.000Z",
      "fileSize": "323.34 MB",
      "Gamedrive_Link": "https://gamedrive.org/coral-island-update-1-1-1232-1-1-1237-11-03-2025-elamigos-update/"
    },
    {
      "title": "Armored Core VI Fires of Rubicon update 1.06.1 – 1.09.1 [Elamigos Update]",
      "uris": [
        "https://vikingfile.com/f/8OMlbbajr2",
        "https://pixeldrain.com/u/Nq1ninm1"
      ],
      "uploadDate": "2025-06-20T00:00:00.000Z",
      "fileSize": "120.27 MB",
      "Gamedrive_Link": "https://gamedrive.org/armored-core-vi-fires-of-rubicon-update-1-06-1-1-09-1-elamigos-update/"
    },
    {
      "title": "AEW Fight Forever update 1.09 – 1.10 [Elamigos Update]",
      "uris": [
        "https://vikingfile.com/f/zYjUlR3leB",
        "https://pixeldrain.com/u/xMGv87Wu"
      ],
      "uploadDate": "2025-06-20T00:00:00.000Z",
      "fileSize": "1.73 GB",
      "Gamedrive_Link": "https://gamedrive.org/aew-fight-forever-update-1-09-1-10-elamigos-update/"
    },
    {
      "title": "TEKKEN 8 update 2.00.01 – 2.01.00 (13.05.2025) [Elamigos Update]",
      "uris": [
        "https://vikingfile.com/f/RfpvofiDyV",
        "https://pixeldrain.com/u/XxvtkiEX"
      ],
      "uploadDate": "2025-05-13T00:00:00.000Z",
      "fileSize": "2.37 GB",
      "Gamedrive_Link": "https://gamedrive.org/tekken-8-update-2-00-01-2-01-00-13-05-2025-elamigos-update/"
    },
    {
      "title": "TEKKEN 8 update 1.12.01 – 2.00.01 (31.03.2025) [Elamigos Update]",
      "uris": [
        "https://vikingfile.com/f/ftvzBJf2D8",
        "https://pixeldrain.com/u/VVyxMvMp"
      ],
      "uploadDate": "2025-03-31T00:00:00.000Z",
      "fileSize": "4.37 GB",
      "Gamedrive_Link": "https://gamedrive.org/tekken-8-update-1-12-01-2-00-01-31-03-2025-elamigos-update/"
    },
    {
      "title": "TEKKEN 8 update 1.10.01 – 1.12.01 [Elamigos Update]",
      "uris": [
        "https://vikingfile.com/f/4KFcZrLiKN",
        "https://pixeldrain.com/u/5za6585c"
      ],
      "uploadDate": "2025-06-20T00:00:00.000Z",
      "fileSize": "3.92 GB",
      "Gamedrive_Link": "https://gamedrive.org/tekken-8-update-1-10-01-1-12-01-elamigos-update/"
    },
    {
      "title": "RIDE 5 update 24.01.2024 – 21.02.2024 [Elamigos Update]",
      "uris": [
        "https://vikingfile.com/f/ZNNOhpUu00",
        "https://pixeldrain.com/u/ENQ3SUGq"
      ],
      "uploadDate": "2024-01-24T00:00:00.000Z",
      "fileSize": "836.63 MB",
      "Gamedrive_Link": "https://gamedrive.org/ride-5-update-24-01-2024-21-02-2024-elamigos-update/"
    },
    {
      "title": "Street Fighter 30th Anniversary Collection update 1 (29.06.2018) [Elamigos Update]",
      "uris": [
        "https://vikingfile.com/f/iADeiSh2U1",
        "https://pixeldrain.com/u/1JNGuksn"
      ],
      "uploadDate": "2018-06-29T00:00:00.000Z",
      "fileSize": "363.86 MB",
      "Gamedrive_Link": "https://gamedrive.org/street-fighter-30th-anniversary-collection-update-1-29-06-2018-elamigos-update/"
    },
    {
      "title": "Metal Gear Solid Master Collection Vol.1 update 25.09.2024 – 04.12.2024 [Elamigos Update]",
      "uris": [
        "https://vikingfile.com/f/UtO8sBfS3v",
        "https://pixeldrain.com/u/39Uoi1mz"
      ],
      "uploadDate": "2024-09-25T00:00:00.000Z",
      "fileSize": "440.53 MB",
      "Gamedrive_Link": "https://gamedrive.org/metal-gear-solid-master-collection-vol-1-update-25-09-2024-04-12-2024-elamigos-update/"
    },
    {
      "title": "Last Train Home update 01.02.2024 – 06.03.2024 [Elamigos Update]",
      "uris": [
        "https://vikingfile.com/f/SgiTAuLMZ1",
        "https://pixeldrain.com/u/GTcqgYDW"
      ],
      "uploadDate": "2024-02-01T00:00:00.000Z",
      "fileSize": "803 MB",
      "Gamedrive_Link": "https://gamedrive.org/last-train-home-update-01-02-2024-06-03-2024-elamigos-update/"
    },
    {
      "title": "High On Life update 03.10.2023 – 01.11.2023 [Elamigos Update]",
      "uris": [
        "https://vikingfile.com/f/tEJvjZ3lEf",
        "https://pixeldrain.com/u/qsVzSpRw"
      ],
      "uploadDate": "2023-10-03T00:00:00.000Z",
      "fileSize": "216.81 MB",
      "Gamedrive_Link": "https://gamedrive.org/high-on-life-update-03-10-2023-01-11-2023-elamigos-update/"
    },
    {
      "title": "Galactic Civilizations IV Supernova update 2.92 – 2.95 (27.02.2025) [Elamigos Update]",
      "uris": [
        "https://vikingfile.com/f/if3qSOr8wN",
        "https://pixeldrain.com/u/Sa3kmdK9"
      ],
      "uploadDate": "2025-02-27T00:00:00.000Z",
      "fileSize": "614.14 MB",
      "Gamedrive_Link": "https://gamedrive.org/galactic-civilizations-iv-supernova-update-2-92-2-95-27-02-2025-elamigos-update/"
    },
    {
      "title": "Dead or Alive 5 Last Round update 1.10B – 1.10C (12.12.2017) [Elamigos Update]",
      "uris": [
        "https://vikingfile.com/f/kWCxJJ32g6",
        "https://pixeldrain.com/u/diHRnuEf"
      ],
      "uploadDate": "2017-12-12T00:00:00.000Z",
      "fileSize": "188.00 MB",
      "Gamedrive_Link": "https://gamedrive.org/dead-or-alive-5-last-round-update-1-10b-1-10c-12-12-2017-elamigos-update/"
    },
    {
      "title": "World War Z update 24.09.2024 – 05.12.2024 [Elamigos Update]",
      "uris": [
        "https://vikingfile.com/f/fixPzVbAzb",
        "https://pixeldrain.com/u/KKRx2XXB"
      ],
      "uploadDate": "2024-09-24T00:00:00.000Z",
      "fileSize": "4.94 GB",
      "Gamedrive_Link": "https://gamedrive.org/world-war-z-update-24-09-2024-05-12-2024-elamigos-update/"
    },
    {
      "title": "World War Z update 05.12.2024 – 29.04.2025 [Elamigos Update]",
      "uris": [
        "https://vikingfile.com/f/H7nl1VcAFm",
        "https://pixeldrain.com/u/dhyKM8Cb"
      ],
      "uploadDate": "2024-12-05T00:00:00.000Z",
      "fileSize": "3.61 GB",
      "Gamedrive_Link": "https://gamedrive.org/world-war-z-update-05-12-2024-29-04-2025-elamigos-update/"
    },
    {
      "title": "The King of Fighters XV update 2.20 – 2.41 (12.12.2024) [Elamigos Update]",
      "uris": [
        "https://vikingfile.com/f/noHOnTbAhn",
        "https://pixeldrain.com/u/x6YRWBzH"
      ],
      "uploadDate": "2024-12-12T00:00:00.000Z",
      "fileSize": "1.06 GB",
      "Gamedrive_Link": "https://gamedrive.org/the-king-of-fighters-xv-update-2-20-2-41-12-12-2024-elamigos-update/"
    },
    {
      "title": "The Elder Scrolls V Skyrim Special Edition update 1.6.1130 – 1.6.1170 (17.01.2024) [Elamigos Update]",
      "uris": [
        "https://vikingfile.com/f/7fNrQZX7J1",
        "https://pixeldrain.com/u/CJL1EHgk"
      ],
      "uploadDate": "2024-01-17T00:00:00.000Z",
      "fileSize": "48.77 MB",
      "Gamedrive_Link": "https://gamedrive.org/the-elder-scrolls-v-skyrim-special-edition-update-1-6-1130-1-6-1170-17-01-2024-elamigos-update/"
    },
    {
      "title": "Super Seducer How to Talk to Girls update 4 – 10 (10.08.2018) [Elamigos Update]",
      "uris": [
        "https://vikingfile.com/f/Z8yXZB4jLd",
        "https://pixeldrain.com/u/6GmSs8X7"
      ],
      "uploadDate": "2018-08-10T00:00:00.000Z",
      "fileSize": "82.40 MB",
      "Gamedrive_Link": "https://gamedrive.org/super-seducer-how-to-talk-to-girls-update-4-10-10-08-2018-elamigos-update/"
    },
    {
      "title": "OVERKILLs The Walking Dead update 1.3.1 – 1.3.2 (13.02.2019) [Elamigos Update]",
      "uris": [
        "https://vikingfile.com/f/XaRy5xi787",
        "https://pixeldrain.com/u/Hm7KLSSY"
      ],
      "uploadDate": "2019-02-13T00:00:00.000Z",
      "fileSize": "26.72 MB",
      "Gamedrive_Link": "https://gamedrive.org/overkills-the-walking-dead-update-1-3-1-1-3-2-13-02-2019-elamigos-update/"
    },
    {
      "title": "Gangs of Sherwood update 255679 (30.11.2023) [Elamigos Update]",
      "uris": [
        "https://vikingfile.com/f/yfs1ts3eoi",
        "https://pixeldrain.com/u/TJmqzhUU"
      ],
      "uploadDate": "2023-11-30T00:00:00.000Z",
      "fileSize": "57.92 MB",
      "Gamedrive_Link": "https://gamedrive.org/gangs-of-sherwood-update-255679-30-11-2023-elamigos-update/"
    },
    {
      "title": "Divinity Original Sin 2 Definitive Edition update 3.6.58.1306 – 3.6.117.3735 H1 [Elamigos Update]",
      "uris": [
        "https://vikingfile.com/f/lfkugxknGi",
        "https://pixeldrain.com/u/MEiJHXtg"
      ],
      "uploadDate": "2025-06-20T00:00:00.000Z",
      "fileSize": "574.08 MB",
      "Gamedrive_Link": "https://gamedrive.org/divinity-original-sin-2-definitive-edition-update-3-6-58-1306-3-6-117-3735-h1-elamigos-update/"
    },
    {
      "title": "The Midnight Walk update 03.06.2025 [Elamigos Update]",
      "uris": [
        "https://vikingfile.com/f/AnIS538s1u",
        "https://pixeldrain.com/u/bzfdtgZ2"
      ],
      "uploadDate": "2025-06-03T00:00:00.000Z",
      "fileSize": "97.77 MB",
      "Gamedrive_Link": "https://gamedrive.org/the-midnight-walk-update-03-06-2025-elamigos-update/"
    },
    {
      "title": "Clair Obscur Expedition 33 update 56180 – 56442 (09.05.2025) [Elamigos Update]",
      "uris": [
        "https://vikingfile.com/f/DcMWlc8Lzt",
        "https://pixeldrain.com/u/74LkYKRP"
      ],
      "uploadDate": "2025-05-09T00:00:00.000Z",
      "fileSize": "634.64 MB",
      "Gamedrive_Link": "https://gamedrive.org/clair-obscur-expedition-33-update-56180-56442-09-05-2025-elamigos-update/"
    },
    {
      "title": "One Piece Burning Blood update 2 (22.12.2016; version 1.09) [Elamigos Update]",
      "uris": [
        "https://vikingfile.com/f/n7frSkRQGh",
        "https://pixeldrain.com/u/fVJSXgXR"
      ],
      "uploadDate": "2016-12-22T00:00:00.000Z",
      "fileSize": "801.49 MB",
      "Gamedrive_Link": "https://gamedrive.org/one-piece-burning-blood-update-2-22-12-2016-version-1-09-elamigos-update/"
    },
    {
      "title": "Octopath Traveler 2 update 09.08.2023 – 05.06.2024 [Elamigos Update]",
      "uris": [
        "https://vikingfile.com/f/Gemw8JK1xm",
        "https://pixeldrain.com/u/aBp3gZmj"
      ],
      "uploadDate": "2023-08-09T00:00:00.000Z",
      "fileSize": "487.59 MB",
      "Gamedrive_Link": "https://gamedrive.org/octopath-traveler-2-update-09-08-2023-05-06-2024-elamigos-update/"
    },
    {
      "title": "Baldurs Gate 3 update 6758295 – 6848561 (20.05.2025) [Elamigos Update]",
      "uris": [
        "https://vikingfile.com/f/R5AMX8YjJe"
      ],
      "uploadDate": "2025-05-20T00:00:00.000Z",
      "fileSize": "260.71 MB",
      "Gamedrive_Link": "https://gamedrive.org/baldurs-gate-3-update-6758295-6848561-20-05-2025-elamigos-update/"
    },
    {
      "title": "Imagine Earth (2021) 1.19 (08.04.2025) [Elamigos Repack]",
      "uris": [
        "https://vikingfile.com/f/f1nZvk7Bwd",
        "https://pixeldrain.com/u/MeydF416"
      ],
      "uploadDate": "2025-04-08T00:00:00.000Z",
      "fileSize": "",
      "Gamedrive_Link": "https://gamedrive.org/imagine-earth-2021-1-19-08-04-2025-elamigos-repack/"
    },
    {
      "title": "I am Setsuna update 2 [Elamigos Update]",
      "uris": [
        "https://vikingfile.com/f/6F69JwUigI",
        "https://pixeldrain.com/u/45TuURo9"
      ],
      "uploadDate": "2025-06-20T00:00:00.000Z",
      "fileSize": "178.77 MB",
      "Gamedrive_Link": "https://gamedrive.org/i-am-setsuna-update-2-elamigos-update/"
    },
    {
      "title": "Hypercharge Unboxed update 15.01.2022 – 08.07.2022 [Elamigos Update]",
      "uris": [
        "https://vikingfile.com/f/25TlCzH9V7",
        "https://pixeldrain.com/u/eAkvergM"
      ],
      "uploadDate": "2022-01-15T00:00:00.000Z",
      "fileSize": "324.71 MB",
      "Gamedrive_Link": "https://gamedrive.org/hypercharge-unboxed-update-15-01-2022-08-07-2022-elamigos-update/"
    },
    {
      "title": "How to Survive 2 update 8 – 10 [Elamigos Update]",
      "uris": [
        "https://vikingfile.com/f/luKLckvnFf",
        "https://pixeldrain.com/u/442uJeWY"
      ],
      "uploadDate": "2025-06-20T00:00:00.000Z",
      "fileSize": "20.08 MB",
      "Gamedrive_Link": "https://gamedrive.org/how-to-survive-2-update-8-10-elamigos-update/"
    },
    {
      "title": "Grim Dawn Definitive Edition update 1.2.1.4 – 1.2.1.5 [Elamigos Update]",
      "uris": [
        "https://vikingfile.com/f/lehxzD7SFY",
        "https://pixeldrain.com/u/GQMHXR4Z"
      ],
      "uploadDate": "2025-06-20T00:00:00.000Z",
      "fileSize": "19.40 MB",
      "Gamedrive_Link": "https://gamedrive.org/grim-dawn-definitive-edition-update-1-2-1-4-1-2-1-5-elamigos-update/"
    },
    {
      "title": "Forspoken update 1.21 – 1.23 (10.11.2023) [Elamigos Update]",
      "uris": [
        "https://vikingfile.com/f/LNZp11Pydk",
        "https://pixeldrain.com/u/cJAxkSDt"
      ],
      "uploadDate": "2023-11-10T00:00:00.000Z",
      "fileSize": "68.84 MB",
      "Gamedrive_Link": "https://gamedrive.org/forspoken-update-1-21-1-23-10-11-2023-elamigos-update/"
    },
    {
      "title": "Kona II Brume update 23.02.2024 [Elamigos Update]",
      "uris": [
        "https://vikingfile.com/f/CdomNm2bMe",
        "https://pixeldrain.com/u/3kNtid5A"
      ],
      "uploadDate": "2024-02-23T00:00:00.000Z",
      "fileSize": "620.12 MB",
      "Gamedrive_Link": "https://gamedrive.org/kona-ii-brume-update-23-02-2024-elamigos-update/"
    },
    {
      "title": "IXION update 1.0.4.7 – 1.0.7.0 (02.07.2024) [Elamigos Update]",
      "uris": [
        "https://vikingfile.com/f/jmEhUXHKPu",
        "https://pixeldrain.com/u/FW31TpS2"
      ],
      "uploadDate": "2024-07-02T00:00:00.000Z",
      "fileSize": "88.7 MB",
      "Gamedrive_Link": "https://gamedrive.org/ixion-update-1-0-4-7-1-0-7-0-02-07-2024-elamigos-update/"
    },
    {
      "title": "SubwaySim 2 update v18458851 – v18839168 [GameDrive Update]",
      "uris": [
        "https://vikingfile.com/f/zVYp7re3RX",
        "https://pixeldrain.com/u/gaJYxBSD"
      ],
      "uploadDate": "2025-06-20T00:00:00.000Z",
      "fileSize": "587.85 MB",
      "Gamedrive_Link": "https://gamedrive.org/subwaysim-2-update-v18458851-v18839168-gamedrive-update/"
    },
    {
      "title": "MindsEye update v18756131 – v18844520 (13.06.25) [GameDrive Update]",
      "uris": [
        "https://vikingfile.com/f/EEN7Dqj30E",
        "https://pixeldrain.com/u/dJSHJLL8"
      ],
      "uploadDate": "2025-06-20T00:00:00.000Z",
      "fileSize": "463.38 MB",
      "Gamedrive_Link": "https://gamedrive.org/mindseye-update-v18756131-v18844520-13-06-25-gamedrive-update/"
    },
    {
      "title": "Assetto Corsa EVO update v0.2.1 – v0.2.2 [GameDrive Update]",
      "uris": [
        "https://vikingfile.com/f/p8oDJ8jlUG",
        "https://pixeldrain.com/u/jauXtmse"
      ],
      "uploadDate": "2025-06-20T00:00:00.000Z",
      "fileSize": "8.26 MB",
      "Gamedrive_Link": "https://gamedrive.org/assetto-corsa-evo-update-v0-2-1-v0-2-2-gamedrive/"
    },
    {
      "title": "Hotel Renovator update 1.0.6.6 – 1.0.6.6.285 [Elamigos Update]",
      "uris": [
        "https://vikingfile.com/f/Q2YgDrbOt4",
        "https://pixeldrain.com/u/TsbkWBBD"
      ],
      "uploadDate": "2025-06-20T00:00:00.000Z",
      "fileSize": "527.42 MB",
      "Gamedrive_Link": "https://gamedrive.org/hotel-renovator-update-1-0-6-6-1-0-6-6-285-elamigos-update/"
    },
    {
      "title": "Hearts of Iron IV update 1.16.4 – 1.16.6 [Elamigos Update]",
      "uris": [
        "https://vikingfile.com/f/Knb1DTj2g7",
        "https://pixeldrain.com/u/nGQkp3vQ"
      ],
      "uploadDate": "2025-06-20T00:00:00.000Z",
      "fileSize": "128.87 MB",
      "Gamedrive_Link": "https://gamedrive.org/hearts-of-iron-iv-update-1-16-4-1-16-6-elamigos-update/"
    },
    {
      "title": "Knights of Honor II Sovereign update 31667 – 31768 (v1.7.0; 16.01.2024) [Elamigos Update]",
      "uris": [
        "https://vikingfile.com/f/j9y2VBpagb",
        "https://pixeldrain.com/u/BiGwAb5Y"
      ],
      "uploadDate": "2024-01-16T00:00:00.000Z",
      "fileSize": "57.67 MB",
      "Gamedrive_Link": "https://gamedrive.org/knights-of-honor-ii-sovereign-update-31667-31768-v1-7-0-16-01-2024-elamigos-update/"
    },
    {
      "title": "Jump Force Ultimate Edition update 3.00 – 3.02 (25.08.2022) [Elamigos Update]",
      "uris": [
        "https://vikingfile.com/f/z6qUmVzvsE",
        "https://pixeldrain.com/u/cSrBNwEa"
      ],
      "uploadDate": "2022-08-25T00:00:00.000Z",
      "fileSize": "412.56 MB",
      "Gamedrive_Link": "https://gamedrive.org/jump-force-ultimate-edition-update-3-00-3-02-25-08-2022-elamigos-update/"
    },
    {
      "title": "In Sound Mind update 1.06 [Elamigos Update]",
      "uris": [
        "https://vikingfile.com/f/nveMRtiHAK",
        "https://pixeldrain.com/u/zoWaDYMg"
      ],
      "uploadDate": "2025-06-20T00:00:00.000Z",
      "fileSize": "122.79 MB",
      "Gamedrive_Link": "https://gamedrive.org/in-sound-mind-update-1-06-elamigos-update/"
    },
    {
      "title": "Hunt Down The Freeman update 2 (09.03.2018) [Elamigos Update]",
      "uris": [
        "https://vikingfile.com/f/G6Nb442jB6",
        "https://pixeldrain.com/u/fSkYPQP1"
      ],
      "uploadDate": "2018-03-09T00:00:00.000Z",
      "fileSize": "1.96 GB",
      "Gamedrive_Link": "https://gamedrive.org/hunt-down-the-freeman-update-2-09-03-2018-elamigos-update/"
    },
    {
      "title": "Humankind update 1.0.26.4449 – 1.0.28.4612 [Elamigos Update]",
      "uris": [
        "https://vikingfile.com/f/TkCRYXDhnX",
        "https://pixeldrain.com/u/zgsRDzPe"
      ],
      "uploadDate": "2025-06-20T00:00:00.000Z",
      "fileSize": "43.33 MB",
      "Gamedrive_Link": "https://gamedrive.org/humankind-update-1-0-26-4449-1-0-28-4612-elamigos-update/"
    },
    {
      "title": "The Legend of Heroes Trails of Cold Steel IV update 1.2 (17.04.2021) [Elamigos Update]",
      "uris": [
        "https://vikingfile.com/f/9obFbMsH81",
        "https://pixeldrain.com/u/GJqfAREV"
      ],
      "uploadDate": "2021-04-17T00:00:00.000Z",
      "fileSize": "69.76 MB",
      "Gamedrive_Link": "https://gamedrive.org/the-legend-of-heroes-trails-of-cold-steel-iv-update-1-2-17-04-2021-elamigos-update/"
    },
    {
      "title": "The Legend of Heroes Trails of Cold Steel III update 1.05 + 57 DLC (24.03.2020) [Elamigos Update]",
      "uris": [
        "https://vikingfile.com/f/TWILvS6WG4",
        "https://pixeldrain.com/u/FNrsf3ST"
      ],
      "uploadDate": "2020-03-24T00:00:00.000Z",
      "fileSize": "131.25 MB",
      "Gamedrive_Link": "https://gamedrive.org/the-legend-of-heroes-trails-of-cold-steel-iii-update-1-05-57-dlc-24-03-2020-elamigos-update/"
    },
    {
      "title": "The Legend of Heroes Trails of Cold Steel II update 1.4.1 (31.01.2019) [Elamigos Update]",
      "uris": [
        "https://vikingfile.com/f/bXgzZ4zZLm",
        "https://pixeldrain.com/u/MYvAKdqK"
      ],
      "uploadDate": "2019-01-31T00:00:00.000Z",
      "fileSize": "3.52 MB",
      "Gamedrive_Link": "https://gamedrive.org/the-legend-of-heroes-trails-of-cold-steel-ii-update-1-4-1-31-01-2019-elamigos-update/"
    },
    {
      "title": "MechWarrior 5 Mercenaries update 1.1.354 – 1.1.361 (01.05.2024) [Elamigos Update]",
      "uris": [
        "https://vikingfile.com/f/ANHyB339ea",
        "https://pixeldrain.com/u/neCJ2dSw"
      ],
      "uploadDate": "2024-05-01T00:00:00.000Z",
      "fileSize": "145.12 MB",
      "Gamedrive_Link": "https://gamedrive.org/mechwarrior-5-mercenaries-update-1-1-354-1-1-361-01-05-2024-elamigos-update/"
    },
    {
      "title": "MechWarrior 5 Clans update 1.0.102 – 1.0.108 (14.05.2025) [Elamigos Update]",
      "uris": [
        "https://pixeldrain.com/u/LxCbpTiv"
      ],
      "uploadDate": "2025-05-14T00:00:00.000Z",
      "fileSize": "651 MB",
      "Gamedrive_Link": "https://gamedrive.org/mechwarrior-5-clans-update-1-0-102-1-0-108-14-05-2025-elamigos-update/"
    },
    {
      "title": "Mark of the Ninja Remastered update 3 (19.02.2019) [Elamigos Update]",
      "uris": [
        "https://vikingfile.com/f/fIPb1jwLPB",
        "https://pixeldrain.com/u/dL8CPS8k"
      ],
      "uploadDate": "2019-02-19T00:00:00.000Z",
      "fileSize": "37.33 MB",
      "Gamedrive_Link": "https://gamedrive.org/mark-of-the-ninja-remastered-update-3-19-02-2019-elamigos-update/"
    },
    {
      "title": "Little Witch Academia Chamber of Time update 1 (12.07.2018) [Elamigos Update]",
      "uris": [
        "https://vikingfile.com/f/7xRBgGNjhZ",
        "https://pixeldrain.com/u/Dmjtiofr"
      ],
      "uploadDate": "2018-07-12T00:00:00.000Z",
      "fileSize": "",
      "Gamedrive_Link": "https://gamedrive.org/little-witch-academia-chamber-of-time-update-1-12-07-2018-elamigos-update/"
    },
    {
      "title": "Little Nightmares II update 21.10.2021 – 14.12.2021 [Elamigos Update]",
      "uris": [
        "https://vikingfile.com/f/ASnbLl0i9M",
        "https://pixeldrain.com/u/G9w9oTDm"
      ],
      "uploadDate": "2021-10-21T00:00:00.000Z",
      "fileSize": "25.00 MB",
      "Gamedrive_Link": "https://gamedrive.org/little-nightmares-ii-update-21-10-2021-14-12-2021-elamigos-update/"
    },
    {
      "title": "MotoGP 20 update 28.12.2020 – 18.03.2021 [Elamigos Update]",
      "uris": [
        "https://vikingfile.com/f/vEQp3xnM35",
        "https://pixeldrain.com/u/FzPnZXnJ"
      ],
      "uploadDate": "2020-12-28T00:00:00.000Z",
      "fileSize": "61.15 MB",
      "Gamedrive_Link": "https://gamedrive.org/motogp-20-update-28-12-2020-18-03-2021-elamigos-update/"
    },
    {
      "title": "MotoGP 19 update 26.09.2019 [Elamigos Update]",
      "uris": [
        "https://vikingfile.com/f/mYpWS6OSs6",
        "https://pixeldrain.com/u/h4SWce3Q"
      ],
      "uploadDate": "2019-09-26T00:00:00.000Z",
      "fileSize": "1.13 GB",
      "Gamedrive_Link": "https://gamedrive.org/motogp-19-update-26-09-2019-elamigos-update/"
    },
    {
      "title": "MotoGP 15 – GP de Portugal Circuito Estoril DLC [Elamigos Update]",
      "uris": [
        "https://vikingfile.com/f/fCzlQ8HS3g",
        "https://pixeldrain.com/u/NNgiHRcD"
      ],
      "uploadDate": "2025-06-20T00:00:00.000Z",
      "fileSize": "281.80 MB",
      "Gamedrive_Link": "https://gamedrive.org/motogp-15-gp-de-portugal-circuito-estoril-dlc-elamigos-update/"
    },
    {
      "title": "MADiSON update 1.1.5 (25.10.2022) [Elamigos Update]",
      "uris": [
        "https://vikingfile.com/f/ViKQobpg6Y",
        "https://pixeldrain.com/u/R952EZJp"
      ],
      "uploadDate": "2022-10-25T00:00:00.000Z",
      "fileSize": "62.63 MB",
      "Gamedrive_Link": "https://gamedrive.org/madison-update-1-1-5-25-10-2022-elamigos-update/"
    },
    {
      "title": "Dead Island Definitive Collection update 2 (23.05.2017) [Elamigos Update]",
      "uris": [
        "https://vikingfile.com/f/oMtfw1L4Ur",
        "https://pixeldrain.com/u/k2hrAY1e"
      ],
      "uploadDate": "2017-05-23T00:00:00.000Z",
      "fileSize": "12.37 MB",
      "Gamedrive_Link": "https://gamedrive.org/dead-island-definitive-collection-update-2-23-05-2017-elamigos-update/"
    },
    {
      "title": "Oxenfree II Lost Signals update 1.4.8 [Elamigos Update]",
      "uris": [
        "https://vikingfile.com/f/yh1s0uwpWA",
        "https://pixeldrain.com/u/vMSAK3XY"
      ],
      "uploadDate": "2025-06-20T00:00:00.000Z",
      "fileSize": "81.82 MB",
      "Gamedrive_Link": "https://gamedrive.org/oxenfree-ii-lost-signals-update-1-4-8-elamigos-update/"
    },
    {
      "title": "MotoGP 24 update 01.08.2024 – 06.02.2025 [Elamigos Update]",
      "uris": [
        "https://vikingfile.com/f/8Xzog6anGf",
        "https://pixeldrain.com/u/VSwyNgHf"
      ],
      "uploadDate": "2024-08-01T00:00:00.000Z",
      "fileSize": "23.48 MB",
      "Gamedrive_Link": "https://gamedrive.org/motogp-24-update-01-08-2024-06-02-2025-elamigos-update/"
    },
    {
      "title": "MotoGP 22 update 20.09.2022 – 08.05.2023 [Elamigos Update]",
      "uris": [
        "https://vikingfile.com/f/tXHbTrdUOa",
        "https://pixeldrain.com/u/23NRvs7z"
      ],
      "uploadDate": "2022-09-20T00:00:00.000Z",
      "fileSize": "125.27 MB",
      "Gamedrive_Link": "https://gamedrive.org/motogp-22-update-20-09-2022-08-05-2023-elamigos-update/"
    },
    {
      "title": "GRID 2019 update 15.04.2020 – 12.08.2020 [Elamigos Update]",
      "uris": [
        "https://vikingfile.com/f/nOeDY7UfbL",
        "https://pixeldrain.com/u/bMB1c9jp"
      ],
      "uploadDate": "2020-04-15T00:00:00.000Z",
      "fileSize": "619.02 MB",
      "Gamedrive_Link": "https://gamedrive.org/grid-2019-update-15-04-2020-12-08-2020-elamigos-update/"
    },
    {
      "title": "DOOM Eternal update 05.09.2023 – 08.08.2024 [Elamigos Update]",
      "uris": [
        "https://vikingfile.com/f/duW2ZfN18w"
      ],
      "uploadDate": "2023-09-05T00:00:00.000Z",
      "fileSize": "273.33 MB",
      "Gamedrive_Link": "https://gamedrive.org/doom-eternal-update-05-09-2023-08-08-2024-elamigos-update/"
    },
    {
      "title": "Cricket 24 Update v0.2.5301 – v0.2.5328 [GameDrive]",
      "uris": [
        "https://vikingfile.com/f/42T4EgqdNV",
        "https://pixeldrain.com/u/V5VhtHS2"
      ],
      "uploadDate": "2025-06-20T00:00:00.000Z",
      "fileSize": "274.57 MB",
      "Gamedrive_Link": "https://gamedrive.org/cricket-24-update-v0-2-5301-v0-2-5328-gamedrive/"
    },
    {
      "title": "SubwaySim 2 update v18345614 – v18458851 [GameDrive]",
      "uris": [
        "https://vikingfile.com/f/RAfbJoSiPQ",
        "https://pixeldrain.com/u/CsrT23WW"
      ],
      "uploadDate": "2025-06-20T00:00:00.000Z",
      "fileSize": "249 MB",
      "Gamedrive_Link": "https://gamedrive.org/subwaysim-2-update-v18345614-v18458851-gamedrive/"
    },
    {
      "title": "Cricket 24 Update v0.2.5270 – v0.2.5301 [GameDrive]",
      "uris": [
        "https://vikingfile.com/f/CDuw7gUoXY",
        "https://pixeldrain.com/u/s3BEfF8t"
      ],
      "uploadDate": "2025-06-20T00:00:00.000Z",
      "fileSize": "39.32 MB",
      "Gamedrive_Link": "https://gamedrive.org/cricket-24-update-v0-2-5270-v0-2-5301-gamedrive/"
    },
    {
      "title": "Cricket 24 Update v0.2.5256 – v0.2.5270 [GameDrive]",
      "uris": [
        "https://pixeldrain.com/u/n4u8ZPmy"
      ],
      "uploadDate": "2025-05-21T00:00:00.000Z",
      "fileSize": "207 MB",
      "Gamedrive_Link": "https://gamedrive.org/cricket-24-update-v0-2-5256-v0-2-5270-gamedrive/"
    },
    {
      "title": "Cricket 24 Update v0.2.5214 – v0.2.5256 [GameDrive]",
      "uris": [
        "https://pixeldrain.com/u/pE4PHKFv",
        "https://vikingfile.com/f/0GQnjOLSy3"
      ],
      "uploadDate": "2025-05-21T00:00:00.000Z",
      "fileSize": "271 MB",
      "Gamedrive_Link": "https://gamedrive.org/cricket-24-update-v0-2-5214-v0-2-5256-gamedrive/"
    },
    {
      "title": "Cricket 24 Update v0.2.5183 – v0.2.5214 [GameDrive]",
      "uris": [
        "https://pixeldrain.com/u/yEbSQeCP",
        "https://vikingfile.com/f/jXbQvT1PGd"
      ],
      "uploadDate": "2025-05-21T00:00:00.000Z",
      "fileSize": "38.9 MB",
      "Gamedrive_Link": "https://gamedrive.org/cricket-24-update-v0-2-5183-v0-2-5214-gamedrive/"
    },
    {
      "title": "Cricket 24 Update v0.2.5047 – v0.2.5183 [GameDrive]",
      "uris": [
        "https://pixeldrain.com/u/qw3iaVqX",
        "https://vikingfile.com/f/Et8n1JT0VX"
      ],
      "uploadDate": "2025-05-21T00:00:00.000Z",
      "fileSize": "181 MB",
      "Gamedrive_Link": "https://gamedrive.org/cricket-24-update-v0-2-5047-v0-2-5183-gamedrive/"
    },
    {
      "title": "Assetto Corsa EVO update v0.2.0 – v0.2.1 [GameDrive Update]",
      "uris": [
        "https://vikingfile.com/f/mWf97PxjdE",
        "https://pixeldrain.com/u/snpZZtQN"
      ],
      "uploadDate": "2025-05-21T00:00:00.000Z",
      "fileSize": "14.18 MB",
      "Gamedrive_Link": "https://gamedrive.org/assetto-corsa-evo-update-v0-2-0-v0-2-1-gamedrive-update/"
    },
    {
      "title": "Marvels Spider-Man 2 update v1.408.0.0 – v1.508.0.0 [GameDrive]",
      "uris": [
        "https://vikingfile.com/f/5SXVTQCS2d"
      ],
      "uploadDate": "2025-05-21T00:00:00.000Z",
      "fileSize": "44.43 MB",
      "Gamedrive_Link": "https://gamedrive.org/marvels-spider-man-2-update-v1-408-0-0-v1-508-0-0-gamedrive/"
    },
    {
      "title": "Nioh Complete Edition update 1.21.04 – 1.24.07 (15.12.2021) [Elamigos Update]",
      "uris": [
        "https://vikingfile.com/f/FAQvOg4IqD",
        "https://pixeldrain.com/u/uUeuV3L6"
      ],
      "uploadDate": "2021-12-15T00:00:00.000Z",
      "fileSize": "69.89 MB",
      "Gamedrive_Link": "https://gamedrive.org/nioh-complete-edition-update-1-21-04-1-24-07-15-12-2021-elamigos-update/"
    },
    {
      "title": "Nioh 2 The Complete Edition update 1.28.03 – 1.28.08 [Elamigos Update]",
      "uris": [
        "https://vikingfile.com/f/xe6DKhNi1P",
        "https://pixeldrain.com/u/CBR6s6pG"
      ],
      "uploadDate": "2025-05-21T00:00:00.000Z",
      "fileSize": "44.08 MB",
      "Gamedrive_Link": "https://gamedrive.org/nioh-2-the-complete-edition-update-1-28-03-1-28-08-elamigos-update/"
    },
    {
      "title": "Nights of Azure 2 update 3 (20.12.2017) [Elamigos Update]",
      "uris": [
        "https://vikingfile.com/f/krR3ZfVPMD",
        "https://pixeldrain.com/u/amQL6whv"
      ],
      "uploadDate": "2017-12-20T00:00:00.000Z",
      "fileSize": "891.06 MB",
      "Gamedrive_Link": "https://gamedrive.org/nights-of-azure-2-update-3-20-12-2017-elamigos-update/"
    },
    {
      "title": "Necromunda Hired Gun update 1.61865 – 1.62662 [Elamigos Update]",
      "uris": [
        "https://vikingfile.com/f/BcAlQbGNki",
        "https://pixeldrain.com/u/EdffbyNC"
      ],
      "uploadDate": "2025-05-21T00:00:00.000Z",
      "fileSize": "29.20 MB",
      "Gamedrive_Link": "https://gamedrive.org/necromunda-hired-gun-update-1-61865-1-62662-elamigos-update/"
    },
    {
      "title": "SubwaySim 2 update v18289498 – v18345614 [GameDrive]",
      "uris": [
        "https://vikingfile.com/f/ql0GXdRpy1",
        "https://pixeldrain.com/u/NhyUe4zo"
      ],
      "uploadDate": "2025-05-21T00:00:00.000Z",
      "fileSize": "103.27 MB",
      "Gamedrive_Link": "https://gamedrive.org/subwaysim-2-update-v18289498-v18345614-gamedrive/"
    },
    {
      "title": "NASCAR Heat Evolution update 2 [Elamigos Update]",
      "uris": [
        "https://vikingfile.com/f/yJEtmvpt2S",
        "https://pixeldrain.com/u/EKVwaevY"
      ],
      "uploadDate": "2025-05-21T00:00:00.000Z",
      "fileSize": "280.97 MB",
      "Gamedrive_Link": "https://gamedrive.org/nascar-heat-evolution-update-2-elamigos-update/"
    },
    {
      "title": "NASCAR Heat 2 update 2 – 5 [Elamigos Update]",
      "uris": [
        "https://vikingfile.com/f/O9rPC0j1fO"
      ],
      "uploadDate": "2025-05-21T00:00:00.000Z",
      "fileSize": "843.67 MB",
      "Gamedrive_Link": "https://gamedrive.org/nascar-heat-2-update-2-5-elamigos-update/"
    },
    {
      "title": "Myst 2021 Remake update 20.03.2025 – 18.04.2025 [Elamigos Update]",
      "uris": [
        "https://vikingfile.com/f/jEP7Cljsmf"
      ],
      "uploadDate": "2025-03-20T00:00:00.000Z",
      "fileSize": "1.01 GB",
      "Gamedrive_Link": "https://gamedrive.org/myst-2021-remake-update-20-03-2025-18-04-2025-elamigos-update/"
    },
    {
      "title": "Assetto Corsa EVO update v0.1.6 – v0.2.0 [GameDrive Update]",
      "uris": [
        "https://vikingfile.com/f/q44ilop8Mg"
      ],
      "uploadDate": "2025-05-21T00:00:00.000Z",
      "fileSize": "2.10 GB",
      "Gamedrive_Link": "https://gamedrive.org/assetto-corsa-evo-update-v0-1-6-v0-2-0-gamedrive-update/"
    },
    {
      "title": "Dark Souls Remastered update 1.03 [Elamigos Update]",
      "uris": [
        "https://vikingfile.com/f/fwgSaj2EWH",
        "https://pixeldrain.com/u/LsXaZ2J7"
      ],
      "uploadDate": "2025-05-21T00:00:00.000Z",
      "fileSize": "21.31 MB",
      "Gamedrive_Link": "https://gamedrive.org/dark-souls-remastered-update-1-03-elamigos-update/"
    },
    {
      "title": "Dark Souls III update 1.15 – 1.15.2 [Elamigos Update]",
      "uris": [
        "https://vikingfile.com/f/xRd67zJERC",
        "https://pixeldrain.com/u/K7CGvyb8"
      ],
      "uploadDate": "2025-05-21T00:00:00.000Z",
      "fileSize": "25.72 MB",
      "Gamedrive_Link": "https://gamedrive.org/dark-souls-iii-update-1-15-1-15-2-elamigos-update/"
    },
    {
      "title": "Crysis Remastered update 17.09.2021 – 08.02.2022 [Elamigos Update]",
      "uris": [
        "https://pixeldrain.com/u/Eo2f4Cjd"
      ],
      "uploadDate": "2021-09-17T00:00:00.000Z",
      "fileSize": "162 MB",
      "Gamedrive_Link": "https://gamedrive.org/crysis-remastered-update-17-09-2021-08-02-2022-elamigos-update/"
    },
    {
      "title": "Way of the Samurai 4 update 1.05 – 1.06H (08.10.2015) [Elamigos Update]",
      "uris": [
        "https://vikingfile.com/f/orcRUjIAnS",
        "https://pixeldrain.com/u/QR3FAxcX"
      ],
      "uploadDate": "2015-10-08T00:00:00.000Z",
      "fileSize": "3.19 MB",
      "Gamedrive_Link": "https://gamedrive.org/way-of-the-samurai-4-update-1-05-1-06h-08-10-2015-elamigos-update/"
    },
    {
      "title": "SpongeBob SquarePants The Cosmic Shake update 1.0.5.0 – 1.0.6.0 [Elamigos Update]",
      "uris": [
        "https://vikingfile.com/f/BujUaIq381",
        "https://pixeldrain.com/u/YP8QwD7P"
      ],
      "uploadDate": "2025-05-21T00:00:00.000Z",
      "fileSize": "409.83 MB",
      "Gamedrive_Link": "https://gamedrive.org/spongebob-squarepants-the-cosmic-shake-update-1-0-5-0-1-0-6-0-elamigos-update/"
    },
    {
      "title": "Halo Wars Definitive Edition update 5 (05.06.2017) [Elamigos Update]",
      "uris": [
        "https://vikingfile.com/f/7nFZ6Fevcj",
        "https://pixeldrain.com/u/LveaVuK9"
      ],
      "uploadDate": "2017-06-05T00:00:00.000Z",
      "fileSize": "140.47 MB",
      "Gamedrive_Link": "https://gamedrive.org/halo-wars-definitive-edition-update-5-05-06-2017-elamigos-update/"
    },
    {
      "title": "WWE 2K25 update v1.08 – v1.09 [GameDrive]",
      "uris": [
        "https://vikingfile.com/f/9ZM79vIIzE",
        "https://pixeldrain.com/u/23Fu8iCR"
      ],
      "uploadDate": "2025-05-21T00:00:00.000Z",
      "fileSize": "2.47 GB",
      "Gamedrive_Link": "https://gamedrive.org/wwe-2k25-update-v1-08-v1-09-gamedrive/"
    },
    {
      "title": "Cricket 24 Update v0.2.5008 – v0.2.5047 [GameDrive]",
      "uris": [
        "https://pixeldrain.com/u/jtm75iVr",
        "https://vikingfile.com/f/obzN1EdeL8"
      ],
      "uploadDate": "2025-05-21T00:00:00.000Z",
      "fileSize": "38.9 MB",
      "Gamedrive_Link": "https://gamedrive.org/cricket-24-update-v0-2-5008-v0-2-5047-gamedrive/"
    },
    {
      "title": "F1 2015 update 11 – 12 [Elamigos Update]",
      "uris": [
        "https://vikingfile.com/f/HEYvVGbBkh",
        "https://pixeldrain.com/u/K4oE941p"
      ],
      "uploadDate": "2025-04-21T00:00:00.000Z",
      "fileSize": "92.92 MB",
      "Gamedrive_Link": "https://gamedrive.org/f1-2015-update-11-12-elamigos-update/"
    },
    {
      "title": "F1 2013 update 6 [Elamigos Update]",
      "uris": [
        "https://vikingfile.com/f/ClwoOiQUrf",
        "https://pixeldrain.com/u/8zqDnMTh"
      ],
      "uploadDate": "2025-04-21T00:00:00.000Z",
      "fileSize": "301.21 MB",
      "Gamedrive_Link": "https://gamedrive.org/f1-2013-update-6-elamigos-update/"
    },
    {
      "title": "Europa Universalis IV update 1.37.0 – 1.37.5 (17.10.2024) [Elamigos Update]",
      "uris": [
        "https://vikingfile.com/f/ENQ4d6azoU",
        "https://pixeldrain.com/u/c5xLeZEx"
      ],
      "uploadDate": "2024-10-17T00:00:00.000Z",
      "fileSize": "196.89 MB",
      "Gamedrive_Link": "https://gamedrive.org/europa-universalis-iv-update-1-37-0-1-37-5-17-10-2024-elamigos-update/"
    },
    {
      "title": "Batman Arkham Knight update 1.7 – 1.999 [Elamigos Update]",
      "uris": [
        "https://vikingfile.com/f/GNaBneaLNi",
        "https://pixeldrain.com/u/pBzbdLqv"
      ],
      "uploadDate": "2025-04-21T00:00:00.000Z",
      "fileSize": "326.43 MB",
      "Gamedrive_Link": "https://gamedrive.org/batman-arkham-knight-update-1-7-1-999-elamigos-update/"
    },
    {
      "title": "SubwaySim 2 update v18274224 – v18289498 [GameDrive]",
      "uris": [
        "https://vikingfile.com/f/7dA8lJVeR7",
        "https://pixeldrain.com/u/zkj84UjC"
      ],
      "uploadDate": "2025-04-21T00:00:00.000Z",
      "fileSize": "168.94 MB",
      "Gamedrive_Link": "https://gamedrive.org/subwaysim-2-update-v18274224-v18289498-gamedrive/"
    },
    {
      "title": "inZOI update v18188069 – v18265403 [GameDrive]",
      "uris": [
        "https://vikingfile.com/f/NQs4vNTqrQ",
        "https://pixeldrain.com/u/G7f5N86d"
      ],
      "uploadDate": "2025-04-21T00:00:00.000Z",
      "fileSize": "525.77 MB",
      "Gamedrive_Link": "https://gamedrive.org/inzoi-update-v18188069-v18265403-gamedrive/"
    },
    {
      "title": "GYLT update 25.09.2023 [Elamigos Update]",
      "uris": [
        "https://vikingfile.com/f/90xT52eK6O",
        "https://pixeldrain.com/u/PmCT7kk1"
      ],
      "uploadDate": "2023-09-25T00:00:00.000Z",
      "fileSize": "28.14 MB",
      "Gamedrive_Link": "https://gamedrive.org/gylt-update-25-09-2023-elamigos-update/"
    },
    {
      "title": "inZOI update v18099680 – v18188069 [GameDrive]",
      "uris": [
        "https://vikingfile.com/f/wQdAEZQmVY",
        "https://pixeldrain.com/u/fFJKLWXi"
      ],
      "uploadDate": "2025-04-21T00:00:00.000Z",
      "fileSize": "77.34 MB",
      "Gamedrive_Link": "https://gamedrive.org/inzoi-update-v18099680-v18188069-gamedrive/"
    },
    {
      "title": "Cricket 24 Update v0.2.4949 – v0.2.5008 [GameDrive]",
      "uris": [
        "https://pixeldrain.com/u/uEnvbdoV",
        "https://vikingfile.com/f/dMZsA5y0VY"
      ],
      "uploadDate": "2025-04-21T00:00:00.000Z",
      "fileSize": "70.5 MB",
      "Gamedrive_Link": "https://gamedrive.org/cricket-24-update-v0-2-4949-v0-2-5008-gamedrive/"
    },
    {
      "title": "Cricket 24 Update v0.2.4910 – v0.2.4949 [GameDrive]",
      "uris": [
        "https://pixeldrain.com/u/Lr17NLc3",
        "https://vikingfile.com/f/XTfMPyKWIm"
      ],
      "uploadDate": "2025-04-21T00:00:00.000Z",
      "fileSize": "129 MB",
      "Gamedrive_Link": "https://gamedrive.org/cricket-24-update-v0-2-4910-v0-2-4949-gamedrive/"
    },
    {
      "title": "Serious Sam Siberian Mayhem update 628492 [Elamigos Update]",
      "uris": [
        "https://vikingfile.com/f/0RPNaIe5e0"
      ],
      "uploadDate": "2025-04-21T00:00:00.000Z",
      "fileSize": "2.57 GB",
      "Gamedrive_Link": "https://gamedrive.org/serious-sam-siberian-mayhem-update-628492-elamigos-update/"
    },
    {
      "title": "Sid Meiers Civilization Beyond Earth update 1.1.2.4035 (20.12.2015) [Elamigos Update]",
      "uris": [
        "https://vikingfile.com/f/NSldulvTcA"
      ],
      "uploadDate": "2015-12-20T00:00:00.000Z",
      "fileSize": "310.35 MB",
      "Gamedrive_Link": "https://gamedrive.org/sid-meiers-civilization-beyond-earth-update-1-1-2-4035-20-12-2015-elamigos-update/"
    },
    {
      "title": "Samurai Warriors 5 update 1.0.0.2 + 26 DLC (19.08.2021) [Elamigos Update]",
      "uris": [
        "https://vikingfile.com/f/6HweyxtI3A"
      ],
      "uploadDate": "2021-08-19T00:00:00.000Z",
      "fileSize": "22.88 MB",
      "Gamedrive_Link": "https://gamedrive.org/samurai-warriors-5-update-1-0-0-2-26-dlc-19-08-2021-elamigos-update/"
    },
    {
      "title": "WWE 2K25 update v1.07 – v1.08 [GameDrive]",
      "uris": [
        "https://vikingfile.com/f/u5z3aJwWC0",
        "https://pixeldrain.com/u/CKfADvkB"
      ],
      "uploadDate": "2025-04-21T00:00:00.000Z",
      "fileSize": "1.24 GB",
      "Gamedrive_Link": "https://gamedrive.org/wwe-2k25-update-v1-07-v1-08-gamedrive/"
    },
    {
      "title": "Samurai Shodown update 2.32 – 2.43 [Elamigos Update]",
      "uris": [
        "https://vikingfile.com/f/P2MWrmlJHm"
      ],
      "uploadDate": "2025-04-21T00:00:00.000Z",
      "fileSize": "770.22 MB",
      "Gamedrive_Link": "https://gamedrive.org/samurai-shodown-update-2-32-2-43-elamigos-update/"
    },
    {
      "title": "Cricket 24 Update v0.2.4847 – v0.2.4910 [GameDrive]",
      "uris": [
        "https://pixeldrain.com/u/7BjDKQyB",
        "https://vikingfile.com/f/KmA2oxHUuS"
      ],
      "uploadDate": "2025-04-21T00:00:00.000Z",
      "fileSize": "170 MB",
      "Gamedrive_Link": "https://gamedrive.org/cricket-24-update-v0-2-4847-v0-2-4910-gamedrive/"
    },
    {
      "title": "Nebuchadnezzar update 1.4.0 – 1.4.11 [Elamigos Update]",
      "uris": [
        "https://vikingfile.com/f/SxGEG9aVId"
      ],
      "uploadDate": "2025-04-21T00:00:00.000Z",
      "fileSize": "9.02 MB",
      "Gamedrive_Link": "https://gamedrive.org/nebuchadnezzar-update-1-4-0-1-4-11-elamigos-update/"
    },
    {
      "title": "Cricket 24 Update v0.2.4818 – v0.2.4847 [GameDrive]",
      "uris": [
        "https://pixeldrain.com/u/SbVsAMxa",
        "https://vikingfile.com/f/BQgcz71UKj"
      ],
      "uploadDate": "2025-04-21T00:00:00.000Z",
      "fileSize": "281 MB",
      "Gamedrive_Link": "https://gamedrive.org/cricket-24-update-v0-2-4818-v0-2-4847-gamedrive/"
    },
    {
      "title": "inZOI update v17977960 – v18099680 [GameDrive]",
      "uris": [
        "https://vikingfile.com/f/XSddfJ1DGa",
        "https://pixeldrain.com/u/NgwKxNJL"
      ],
      "uploadDate": "2025-04-21T00:00:00.000Z",
      "fileSize": "121.84 MB",
      "Gamedrive_Link": "https://gamedrive.org/inzoi-update-v17977960-v18099680-gamedrive/"
    },
    {
      "title": "JoJos Bizarre Adventure All-Star Battle R update 16.10.2023 – 09.02.2024 [Elamigos Update]",
      "uris": [
        "https://vikingfile.com/f/qr6jWg1T8P",
        "https://pixeldrain.com/u/irEjP8h8"
      ],
      "uploadDate": "2023-10-16T00:00:00.000Z",
      "fileSize": "89.07 MB",
      "Gamedrive_Link": "https://gamedrive.org/jojos-bizarre-adventure-all-star-battle-r-update-16-10-2023-09-02-2024-elamigos-update/"
    },
    {
      "title": "Stray Blade update 15.11.2023 [Elamigos Update]",
      "uris": [
        "https://vikingfile.com/f/YqvJb0mVOe",
        "https://pixeldrain.com/u/MdWm5dWu"
      ],
      "uploadDate": "2023-11-15T00:00:00.000Z",
      "fileSize": "",
      "Gamedrive_Link": "https://gamedrive.org/stray-blade-update-15-11-2023-elamigos-update/"
    },
    {
      "title": "Command and Conquer Remastered update 16.09.2020 – 24.09.2020 [Elamigos Update]",
      "uris": [
        "https://vikingfile.com/f/TGoZQdtPiq",
        "https://pixeldrain.com/u/DruYufBn"
      ],
      "uploadDate": "2020-09-16T00:00:00.000Z",
      "fileSize": "26.46 MB",
      "Gamedrive_Link": "https://gamedrive.org/command-and-conquer-remastered-update-16-09-2020-24-09-2020-elamigos-update/"
    },
    {
      "title": "Blood Bowl 3 update 21.09.2023 – 11.07.2024 [Elamigos Update]",
      "uris": [
        "https://vikingfile.com/f/xLOLnET0rs",
        "https://pixeldrain.com/u/16ZBC4z7"
      ],
      "uploadDate": "2023-09-21T00:00:00.000Z",
      "fileSize": "",
      "Gamedrive_Link": "https://gamedrive.org/blood-bowl-3-update-21-09-2023-11-07-2024-elamigos-update/"
    },
    {
      "title": "Shadow Warrior 2 Deluxe Edition update 1.1.13.0 – 1.1.14.0 [Elamigos Update]",
      "uris": [
        "https://vikingfile.com/f/onjuRd1Aqn"
      ],
      "uploadDate": "2025-04-21T00:00:00.000Z",
      "fileSize": "51 MB",
      "Gamedrive_Link": "https://gamedrive.org/shadow-warrior-2-deluxe-edition-update-1-1-13-0-1-1-14-0-elamigos-update/"
    },
    {
      "title": "Portal 2 update 24.02.2022 – 17.01.2023 [Elamigos Update]",
      "uris": [
        "https://vikingfile.com/f/9oyXtCp8l7"
      ],
      "uploadDate": "2022-02-24T00:00:00.000Z",
      "fileSize": "15.92 MB",
      "Gamedrive_Link": "https://gamedrive.org/portal-2-update-24-02-2022-17-01-2023-elamigos-update/"
    },
    {
      "title": "Cricket 24 Update v0.2.4784 – v0.2.4818 [GameDrive]",
      "uris": [
        "https://pixeldrain.com/u/LyNTkxck",
        "https://vikingfile.com/f/YylKGFIuZD"
      ],
      "uploadDate": "2025-04-21T00:00:00.000Z",
      "fileSize": "254 MB",
      "Gamedrive_Link": "https://gamedrive.org/cricket-24-update-v0-2-4784-v0-2-4818-gamedrive/"
    },
    {
      "title": "Rise of the Ronin update v1.09.0.0 – v1.09.0.3 [GameDrive]",
      "uris": [
        "https://vikingfile.com/f/bHRTHkWd6t"
      ],
      "uploadDate": "2025-04-21T00:00:00.000Z",
      "fileSize": "848.94 MB",
      "Gamedrive_Link": "https://gamedrive.org/rise-of-the-ronin-update-v1-09-0-0-v1-09-0-3-gamedrive/"
    },
    {
      "title": "Marvels Spider-Man 2 update v1.401.1.0 – v1.408.0.0 [GameDrive]",
      "uris": [
        "https://vikingfile.com/f/dkSz2tiKtg"
      ],
      "uploadDate": "2025-04-21T00:00:00.000Z",
      "fileSize": "157.55 MB",
      "Gamedrive_Link": "https://gamedrive.org/marvels-spider-man-2-update-v1-401-1-0-v1-408-0-0-gamedrive/"
    },
    {
      "title": "WWE 2K25 update v1.06 – v1.07 [GameDrive]",
      "uris": [
        "https://vikingfile.com/f/UROhUXLChz",
        "https://pixeldrain.com/u/y3ySyz6n"
      ],
      "uploadDate": "2025-04-21T00:00:00.000Z",
      "fileSize": "25.15 GB",
      "Gamedrive_Link": "https://gamedrive.org/wwe-2k25-update-v1-06-v1-07-gamedrive/"
    },
    {
      "title": "Life is Strange Remastered update 24.05.2022 – 01.05.2023 [Elamigos Update]",
      "uris": [
        "https://vikingfile.com/f/OgFJNxb84T"
      ],
      "uploadDate": "2022-05-24T00:00:00.000Z",
      "fileSize": "644.27 MB",
      "Gamedrive_Link": "https://gamedrive.org/life-is-strange-remastered-update-24-05-2022-01-05-2023-elamigos-update/"
    },
    {
      "title": "Kingdom Hearts HD 1.5 and 2.5 ReMIX update 19.06.2024 – 26.08.2024 [Elamigos Update]",
      "uris": [
        "https://vikingfile.com/f/oKe25KSc6v"
      ],
      "uploadDate": "2024-06-19T00:00:00.000Z",
      "fileSize": "",
      "Gamedrive_Link": "https://gamedrive.org/kingdom-hearts-hd-1-5-and-2-5-remix-update-19-06-2024-26-08-2024-elamigos-update/"
    },
    {
      "title": "Aerofly FS 2 Flight Simulator update 2.04.09.15 (30.01.2020) [Elamigos Update]",
      "uris": [
        "https://vikingfile.com/f/ZtXj5e1lHB"
      ],
      "uploadDate": "2020-01-30T00:00:00.000Z",
      "fileSize": "1.25 GB",
      "Gamedrive_Link": "https://gamedrive.org/aerofly-fs-2-flight-simulator-update-2-04-09-15-30-01-2020-elamigos-update/"
    },
    {
      "title": "Cricket 24 Update v0.2.3891 – v0.2.4784 [GameDrive]",
      "uris": [
        "https://gofile.io/d/6kaHlY",
        "https://pixeldrain.com/u/LHQpf3ng",
        "https://vikingfile.com/f/U40rXTuE5y"
      ],
      "uploadDate": "2025-04-21T00:00:00.000Z",
      "fileSize": "21.8 GB",
      "Gamedrive_Link": "https://gamedrive.org/cricket-24-update-v0-2-3891-v0-2-4784-gamedrive/"
    },
    {
      "title": "Call of Duty Advanced Warfare update 1.18 – 1.21 [Elamigos Update]",
      "uris": [
        "https://vikingfile.com/f/R7W0BXf3yM"
      ],
      "uploadDate": "2025-04-21T00:00:00.000Z",
      "fileSize": "2.16 GB",
      "Gamedrive_Link": "https://gamedrive.org/call-of-duty-advanced-warfare-update-1-18-1-21-elamigos-update/"
    },
    {
      "title": "Kingdoms of Amalur Re-Reckoning update 13779 – 15032 [Elamigos Update]",
      "uris": [
        "https://vikingfile.com/f/X6IozKwpoX"
      ],
      "uploadDate": "2025-04-21T00:00:00.000Z",
      "fileSize": "845.05 MB",
      "Gamedrive_Link": "https://gamedrive.org/kingdoms-of-amalur-re-reckoning-update-13779-15032-elamigos-update/"
    },
    {
      "title": "GreedFall update 30.06.2021 – 29.07.2021 [Elamigos Update]",
      "uris": [
        "https://vikingfile.com/f/z1BIiMNWPr"
      ],
      "uploadDate": "2021-06-30T00:00:00.000Z",
      "fileSize": "28.39 MB",
      "Gamedrive_Link": "https://gamedrive.org/greedfall-update-30-06-2021-29-07-2021-elamigos-update/"
    },
    {
      "title": "Cooking Simulator update 6.0.1 – 6.0.14 (23.12.2024) [Elamigos Update]",
      "uris": [
        "https://vikingfile.com/f/RE5YFGfeKj"
      ],
      "uploadDate": "2024-12-23T00:00:00.000Z",
      "fileSize": "499.41 MB",
      "Gamedrive_Link": "https://gamedrive.org/cooking-simulator-update-6-0-1-6-0-14-23-12-2024-elamigos-update/"
    },
    {
      "title": "Detroit Become Human update 18.06.2020 – 17.11.2021 [Elamigos Update]",
      "uris": [
        "https://vikingfile.com/f/VX7D45LkQl"
      ],
      "uploadDate": "2020-06-18T00:00:00.000Z",
      "fileSize": "687.69 MB",
      "Gamedrive_Link": "https://gamedrive.org/detroit-become-human-update-18-06-2020-17-11-2021-elamigos-update/"
    },
    {
      "title": "Marvels Spider-Man 2 update v1.318.1.0 – v1.401.1.0 [GameDrive]",
      "uris": [
        "https://vikingfile.com/f/vwl1FRXZsx"
      ],
      "uploadDate": "2025-04-21T00:00:00.000Z",
      "fileSize": "208.24 MB",
      "Gamedrive_Link": "https://gamedrive.org/marvels-spider-man-2-update-v1-318-1-0-v1-401-1-0-gamedrive/"
    },
    {
      "title": "inZOI update v17939586 – v17977960 [GameDrive]",
      "uris": [
        "https://vikingfile.com/f/ULk7Ljd21H",
        "https://pixeldrain.com/u/oLz8jFpU"
      ],
      "uploadDate": "2025-04-21T00:00:00.000Z",
      "fileSize": "100.45 MB",
      "Gamedrive_Link": "https://gamedrive.org/inzoi-update-v17939586-v17977960-gamedrive/"
    },
    {
      "title": "inZOI update v17914301 – v17939586 [GameDrive]",
      "uris": [
        "https://vikingfile.com/f/NdwADGVc9W",
        "https://pixeldrain.com/u/H5qxVr6R"
      ],
      "uploadDate": "2025-03-22T00:00:00.000Z",
      "fileSize": "94.74 MB",
      "Gamedrive_Link": "https://gamedrive.org/inzoi-update-v17914301-v17939586-gamedrive/"
    },
    {
      "title": "King Arthur Legion IX update 1.0.0c [Elamigos Update]",
      "uris": [
        "https://vikingfile.com/f/C8GHpupXyF"
      ],
      "uploadDate": "2025-03-22T00:00:00.000Z",
      "fileSize": "102.04 MB",
      "Gamedrive_Link": "https://gamedrive.org/king-arthur-legion-ix-update-1-0-0c-elamigos-update/"
    },
    {
      "title": "inZOI update v17903911 – v17914301 [GameDrive]",
      "uris": [
        "https://vikingfile.com/f/6ftQdtdm9h"
      ],
      "uploadDate": "2025-03-22T00:00:00.000Z",
      "fileSize": "93.56 MB",
      "Gamedrive_Link": "https://gamedrive.org/inzoi-update-v17903911-v17914301-gamedrive/"
    },
    {
      "title": "inZOI update v17883557 – v17903911 [GameDrive]",
      "uris": [
        "https://vikingfile.com/f/KN269qypgK"
      ],
      "uploadDate": "2025-03-22T00:00:00.000Z",
      "fileSize": "77.75 MB",
      "Gamedrive_Link": "https://gamedrive.org/inzoi-update-v17883557-v17903911-gamedrive/"
    },
    {
      "title": "Outer Wilds update 1.1.13 – 1.1.15 (11.06.2024) [Elamigos Update]",
      "uris": [
        "https://vikingfile.com/f/4dblJV52MW"
      ],
      "uploadDate": "2024-06-11T00:00:00.000Z",
      "fileSize": "47.13 MB",
      "Gamedrive_Link": "https://gamedrive.org/outer-wilds-update-1-1-13-1-1-15-11-06-2024-elamigos-update/"
    },
    {
      "title": "Open Country update 1.0.0.2703 (18.08.2021) [Elamigos Update]",
      "uris": [
        "https://vikingfile.com/f/7KOEtCrbLh"
      ],
      "uploadDate": "2021-08-18T00:00:00.000Z",
      "fileSize": "192.27 MB",
      "Gamedrive_Link": "https://gamedrive.org/open-country-update-1-0-0-2703-18-08-2021-elamigos-update/"
    },
    {
      "title": "NBA 2K20 Legend Edition update 1.00 – 1.09 [Elamigos Update]",
      "uris": [
        "https://vikingfile.com/f/JdjfjdMpu4"
      ],
      "uploadDate": "2025-03-22T00:00:00.000Z",
      "fileSize": "6.87 GB",
      "Gamedrive_Link": "https://gamedrive.org/nba-2k20-legend-edition-update-1-00-1-09-elamigos-update/"
    },
    {
      "title": "LEGO Star Wars The Skywalker Saga update 28.10.2022 – 04.05.2023 [Elamigos Update]",
      "uris": [
        "https://vikingfile.com/f/FKVyeADAKX"
      ],
      "uploadDate": "2022-10-28T00:00:00.000Z",
      "fileSize": "121.66 MB",
      "Gamedrive_Link": "https://gamedrive.org/lego-star-wars-the-skywalker-saga-update-28-10-2022-04-05-2023-elamigos-update/"
    },
    {
      "title": "LEGO Horizon Adventures update 06.02.2025 (v1.04) [Elamigos Update]",
      "uris": [
        "https://vikingfile.com/f/pD8672l5yl"
      ],
      "uploadDate": "2025-02-06T00:00:00.000Z",
      "fileSize": "333.63 MB",
      "Gamedrive_Link": "https://gamedrive.org/lego-horizon-adventures-update-06-02-2025-v1-04-elamigos-update/"
    },
    {
      "title": "NBA 2K23 update 06.02.2023 [Elamigos Update]",
      "uris": [
        "https://vikingfile.com/f/75CSxdgdpB"
      ],
      "uploadDate": "2023-02-06T00:00:00.000Z",
      "fileSize": "4.69 GB",
      "Gamedrive_Link": "https://gamedrive.org/nba-2k23-update-06-02-2023-elamigos-update/"
    },
    {
      "title": "Wreckfest 2 update v17797557 – v17820352 [GameDrive]",
      "uris": [
        "https://vikingfile.com/f/LZF2QVWRtr"
      ],
      "uploadDate": "2025-03-22T00:00:00.000Z",
      "fileSize": "145.56 MB",
      "Gamedrive_Link": "https://gamedrive.org/wreckfest-2-update-v17797557-v17820352-gamedrive/"
    },
    {
      "title": "WWE 2K25 update v1.05 – v1.06 [GameDrive]",
      "uris": [
        "https://vikingfile.com/f/bt5WqamL4F"
      ],
      "uploadDate": "2025-03-22T00:00:00.000Z",
      "fileSize": "340.06 MB",
      "Gamedrive_Link": "https://gamedrive.org/wwe-2k25-update-v1-05-v1-06-gamedrive/"
    },
    {
      "title": "Marvels Spider-Man 2 update v1.312.0.0 – v1.318.1.0 [GameDrive]",
      "uris": [
        "https://vikingfile.com/f/Na2VYYfWlB"
      ],
      "uploadDate": "2025-03-22T00:00:00.000Z",
      "fileSize": "114.47 MB",
      "Gamedrive_Link": "https://gamedrive.org/marvels-spider-man-2-update-v1-312-0-0-v1-318-1-0-gamedrive/"
    },
    {
      "title": "Gear Club Unlimited 2 Ultimate Edition update 24.02.2022 [Elamigos Update]",
      "uris": [
        "https://vikingfile.com/f/yozh7boWsz"
      ],
      "uploadDate": "2022-02-24T00:00:00.000Z",
      "fileSize": "31.73 MB",
      "Gamedrive_Link": "https://gamedrive.org/gear-club-unlimited-2-ultimate-edition-update-24-02-2022-elamigos-update/"
    },
    {
      "title": "Hellblade Senuas Sacrifice update 16.11.2021 – 07.12.2021 [Elamigos Update]",
      "uris": [
        "https://vikingfile.com/f/uFXyGyg4Ye"
      ],
      "uploadDate": "2021-11-16T00:00:00.000Z",
      "fileSize": "75.48 MB",
      "Gamedrive_Link": "https://gamedrive.org/hellblade-senuas-sacrifice-update-16-11-2021-07-12-2021-elamigos-update/"
    },
    {
      "title": "MotoGP 23 update 18.09.2023 – 14.03.2024 [Elamigos Update]",
      "uris": [
        "https://vikingfile.com/f/rwh11JBp4x"
      ],
      "uploadDate": "2023-09-18T00:00:00.000Z",
      "fileSize": "48.21 MB",
      "Gamedrive_Link": "https://gamedrive.org/motogp-23-update-18-09-2023-14-03-2024-elamigos-update/"
    },
    {
      "title": "WWE 2K25 update 1.03 – 1.05 [GameDrive]",
      "uris": [
        "https://vikingfile.com/f/r3aVHVkHBS"
      ],
      "uploadDate": "2025-03-22T00:00:00.000Z",
      "fileSize": "32.69 GB",
      "Gamedrive_Link": "https://gamedrive.org/wwe-2k25-update-1-03-1-05-gamedrive/"
    },
    {
      "title": "Marvels Spider-Man 2 update v1.305.0.0/v1.307.0.0 – v1.312.0.0 [GameDrive]",
      "uris": [
        "https://vikingfile.com/f/5c4EHU7d4Q"
      ],
      "uploadDate": "2025-03-22T00:00:00.000Z",
      "fileSize": "111.97 MB",
      "Gamedrive_Link": "https://gamedrive.org/marvels-spider-man-2-update-v1-305-0-0-v1-307-0-0-v1-312-0-0-gamedrive/"
    },
    {
      "title": "Marvels Spider-Man 2 Update v1.305.0.0 – v1.307.0.0 [Update Only]",
      "uris": [
        "https://vikingfile.com/f/2lxbpRrm7Y"
      ],
      "uploadDate": "2025-03-22T00:00:00.000Z",
      "fileSize": "81.67 MB",
      "Gamedrive_Link": "https://gamedrive.org/marvels-spider-man-2-update-v1-305-0-0-v1-307-0-0-update-only/"
    },
    {
      "title": "After Us update 1.24.12 – 1.27.3 (13.07.2023) [Elamigos Update]",
      "uris": [
        "https://vikingfile.com/f/nsx5xGwSXn"
      ],
      "uploadDate": "2023-07-13T00:00:00.000Z",
      "fileSize": "1.1 GB",
      "Gamedrive_Link": "https://gamedrive.org/after-us-update-1-24-12-1-27-3-13-07-2023-elamigos-update/"
    },
    {
      "title": "Amnesia The Bunker update 08.01.2024 [Elamigos Update]",
      "uris": [
        "https://vikingfile.com/f/j7WtqoxSky"
      ],
      "uploadDate": "2024-01-08T00:00:00.000Z",
      "fileSize": "232.46 MB",
      "Gamedrive_Link": "https://gamedrive.org/amnesia-the-bunker-update-08-01-2024-elamigos-update/"
    },
    {
      "title": "Crossfire Legion update 03.03.2023 [Elamigos Update]",
      "uris": [
        "https://vikingfile.com/f/4DIpDdgCLy"
      ],
      "uploadDate": "2023-03-03T00:00:00.000Z",
      "fileSize": "9.35 MB",
      "Gamedrive_Link": "https://gamedrive.org/crossfire-legion-update-03-03-2023-elamigos-update/"
    },
    {
      "title": "Final Fantasy I – VI Pixel Remaster update 30.01.2024 – 26.02.2024 [Elamigos Update]",
      "uris": [
        "https://vikingfile.com/f/4ukPPKbNni"
      ],
      "uploadDate": "2024-01-30T00:00:00.000Z",
      "fileSize": "30.43 MB",
      "Gamedrive_Link": "https://gamedrive.org/final-fantasy-i-vi-pixel-remaster-update-30-01-2024-26-02-2024-elamigos-update/"
    },
    {
      "title": "Kingdom Hearts III and Re-Mind update 13.06.2024 – 04.07.2024 [Elamigos Update]",
      "uris": [
        "https://vikingfile.com/f/Qo3cwWGH2p"
      ],
      "uploadDate": "2024-06-13T00:00:00.000Z",
      "fileSize": "585.27 MB",
      "Gamedrive_Link": "https://gamedrive.org/kingdom-hearts-iii-and-re-mind-update-13-06-2024-04-07-2024-elamigos-update/"
    },
    {
      "title": "Miasma Chronicles update 12.07.2023 [Elamigos Update]",
      "uris": [
        "https://vikingfile.com/f/GFWSH3qJfK"
      ],
      "uploadDate": "2023-07-12T00:00:00.000Z",
      "fileSize": "309.27 MB",
      "Gamedrive_Link": "https://gamedrive.org/miasma-chronicles-update-12-07-2023-elamigos-update/"
    },
    {
      "title": "Solasta Crown of the Magister update 1.5.74 – 1.5.97 (06.03.2024) [Elamigos Update]",
      "uris": [
        "https://vikingfile.com/f/eOjorGZAez"
      ],
      "uploadDate": "2024-03-06T00:00:00.000Z",
      "fileSize": "904.61 MB",
      "Gamedrive_Link": "https://gamedrive.org/solasta-crown-of-the-magister-update-1-5-74-1-5-97-06-03-2024-elamigos-update/"
    },
    {
      "title": "Marvels Spider-Man 2 Update v1.218.0.0 – v1.305.0.0 [Update Only]",
      "uris": [
        "https://vikingfile.com/f/i1equ3TZmq",
        "https://www.mediafire.com/file/l3vg07pbmljaumy/SM2.v1.218.0.0-v1.305.0.0-GameDrive.Org.rar/file"
      ],
      "uploadDate": "2025-03-22T00:00:00.000Z",
      "fileSize": "8.41 GB",
      "Gamedrive_Link": "https://gamedrive.org/marvels-spider-man-2-update-v1-218-0-0-v1-305-0-0-update-only/"
    },
    {
      "title": "LEGO The Incredibles update 2 [Elamigos Update]",
      "uris": [
        "https://vikingfile.com/f/o4WA09nqAm"
      ],
      "uploadDate": "2025-02-20T00:00:00.000Z",
      "fileSize": "48.00 MB",
      "Gamedrive_Link": "https://gamedrive.org/lego-the-incredibles-update-2-elamigos-update/"
    },
    {
      "title": "Fallout 4 update 1.10.980 – 1.10.984 [Elamigos Update]",
      "uris": [
        "https://vikingfile.com/f/4cfy6w6e5M"
      ],
      "uploadDate": "2025-02-20T00:00:00.000Z",
      "fileSize": "48.63 MB",
      "Gamedrive_Link": "https://gamedrive.org/fallout-4-update-1-10-980-1-10-984-elamigos-update/"
    },
    {
      "title": "The House of the Dead Remake update 14.07.2022 [Elamigos Update]",
      "uris": [
        "https://vikingfile.com/f/UZmIH1rdNl"
      ],
      "uploadDate": "2022-07-14T00:00:00.000Z",
      "fileSize": "236.77 MB",
      "Gamedrive_Link": "https://gamedrive.org/the-house-of-the-dead-remake-update-14-07-2022-elamigos-update/"
    },
    {
      "title": "SD Gundam G Generation Cross Rays update 1.62 – 1.63 (18.11.2020) [Elamigos Update]",
      "uris": [
        "https://vikingfile.com/f/Zevl8fGM12"
      ],
      "uploadDate": "2020-11-18T00:00:00.000Z",
      "fileSize": "4.72 MB",
      "Gamedrive_Link": "https://gamedrive.org/sd-gundam-g-generation-cross-rays-update-1-62-1-63-18-11-2020-elamigos-update/"
    },
    {
      "title": "Sherlock Holmes The Awakened 2023 update 05.05.2023 [Elamigos Update]",
      "uris": [
        "https://vikingfile.com/f/SGPbemm75q"
      ],
      "uploadDate": "2023-05-05T00:00:00.000Z",
      "fileSize": "90.77 MB",
      "Gamedrive_Link": "https://gamedrive.org/sherlock-holmes-the-awakened-2023-update-05-05-2023-elamigos-update/"
    },
    {
      "title": "Harvestella update 1.0.2 (07.02.2023) [Elamigos Update]",
      "uris": [
        "https://vikingfile.com/f/FRqwqvMPZL"
      ],
      "uploadDate": "2023-02-07T00:00:00.000Z",
      "fileSize": "40.29 MB",
      "Gamedrive_Link": "https://gamedrive.org/harvestella-update-1-0-2-07-02-2023-elamigos-update/"
    },
    {
      "title": "Darksiders III update 16.07.2019 – 31.10.2019 [Elamigos Update]",
      "uris": [
        "https://vikingfile.com/f/TnSqr4tsGg"
      ],
      "uploadDate": "2019-07-16T00:00:00.000Z",
      "fileSize": "68.45 MB",
      "Gamedrive_Link": "https://gamedrive.org/darksiders-iii-update-16-07-2019-31-10-2019-elamigos-update/"
    },
    {
      "title": "TT Isle of Man Ride on the Edge 3 update 09.11.2023 – 22.01.2025 [Elamigos Update]",
      "uris": [
        "https://vikingfile.com/f/D9cDzRXcFG"
      ],
      "uploadDate": "2023-11-09T00:00:00.000Z",
      "fileSize": "20.3 MB",
      "Gamedrive_Link": "https://gamedrive.org/tt-isle-of-man-ride-on-the-edge-3-update-09-11-2023-22-01-2025-elamigos-update/"
    },
    {
      "title": "Attack on Titan 2 update 05.07.2019 – 19.11.2019 [Elamigos Update]",
      "uris": [
        "https://vikingfile.com/f/MwX0dbUGE7"
      ],
      "uploadDate": "2019-07-05T00:00:00.000Z",
      "fileSize": "532.62 MB",
      "Gamedrive_Link": "https://gamedrive.org/attack-on-titan-2-update-05-07-2019-19-11-2019-elamigos-update/"
    },
    {
      "title": "Atelier Sophie 2 update 1.06 – 1.08 (15.02.2023) [Elamigos Update]",
      "uris": [
        "https://vikingfile.com/f/J60RHW8gBd"
      ],
      "uploadDate": "2023-02-15T00:00:00.000Z",
      "fileSize": "23.58 MB",
      "Gamedrive_Link": "https://gamedrive.org/atelier-sophie-2-update-1-06-1-08-15-02-2023-elamigos-update/"
    },
    {
      "title": "Batman The Telltale Series Complete Season 17.12.2019 – 10.01.2020 [Elamigos Update]",
      "uris": [
        "https://vikingfile.com/f/Tiu35IH4Fx",
        "https://gofile.io/d/LNah8i"
      ],
      "uploadDate": "2019-12-17T00:00:00.000Z",
      "fileSize": "1.07 MB",
      "Gamedrive_Link": "https://gamedrive.org/batman-the-telltale-series-complete-season-17-12-2019-10-01-2020-elamigos-update/"
    },
    {
      "title": "Devil May Cry 5 update 24.04.2023 [Elamigos Update]",
      "uris": [
        "https://vikingfile.com/f/Hi0updGg8i"
      ],
      "uploadDate": "2023-04-24T00:00:00.000Z",
      "fileSize": "2.54 GB",
      "Gamedrive_Link": "https://gamedrive.org/devil-may-cry-5-update-24-04-2023-elamigos-update/"
    },
    {
      "title": "Alan Wake Remastered update 34885 (10.01.2022) [Elamigos Update]",
      "uris": [
        "https://vikingfile.com/f/WJKT2zr7Wn"
      ],
      "uploadDate": "2022-01-10T00:00:00.000Z",
      "fileSize": "864.82 MB",
      "Gamedrive_Link": "https://gamedrive.org/alan-wake-remastered-update-34885-10-01-2022-elamigos-update/"
    },
    {
      "title": "A Plague Tale Requiem update 1.5.1.0 – 1.6.0.0 (29.06.2023) [Elamigos Update]",
      "uris": [
        "https://vikingfile.com/f/QXwFDNmbOT"
      ],
      "uploadDate": "2023-06-29T00:00:00.000Z",
      "fileSize": "79.17 MB",
      "Gamedrive_Link": "https://gamedrive.org/a-plague-tale-requiem-update-1-5-1-0-1-6-0-0-29-06-2023-elamigos-update/"
    },
    {
      "title": "Warriors Orochi 3 update 1.0.0.1 (05.09.2022) [Elamigos Update]",
      "uris": [
        "https://vikingfile.com/f/4i0IaOQVTC"
      ],
      "uploadDate": "2022-09-05T00:00:00.000Z",
      "fileSize": "12.94 MB",
      "Gamedrive_Link": "https://gamedrive.org/warriors-orochi-3-update-1-0-0-1-05-09-2022-elamigos-update/"
    },
    {
      "title": "Marvels Spider-Man 2 update v1.212.1.0 – v1.218.0.0 [Update Only]",
      "uris": [
        "https://vikingfile.com/f/FSUdclGjdJ"
      ],
      "uploadDate": "2025-02-20T00:00:00.000Z",
      "fileSize": "179.3 MB",
      "Gamedrive_Link": "https://gamedrive.org/marvels-spider-man-2-update-v1-212-1-0-v1-218-0-0-update-only/"
    },
    {
      "title": "Assetto Corsa EVO update v0.1.5.1 – v0.1.6 [GameDrive Update]",
      "uris": [
        "https://vikingfile.com/f/4R0mtuTpWU"
      ],
      "uploadDate": "2025-02-20T00:00:00.000Z",
      "fileSize": "1.01 GB",
      "Gamedrive_Link": "https://gamedrive.org/assetto-corsa-evo-update-v0-1-5-1-v0-1-6-gamedrive-update/"
    },
    {
      "title": "Max Payne 3 update 1.0.0.216 – 1.0.0.272 (30.01.2024) [Elamigos Update]",
      "uris": [
        "https://vikingfile.com/f/bBDVbVU2Pi"
      ],
      "uploadDate": "2024-01-30T00:00:00.000Z",
      "fileSize": "11.91 MB",
      "Gamedrive_Link": "https://gamedrive.org/max-payne-3-update-1-0-0-216-1-0-0-272-elamigos-update/"
    },
    {
      "title": "Marvels Spider-Man 2 Update v1.205.0.0 – v1.212.1.0 [Update Only]",
      "uris": [
        "https://vikingfile.com/f/w8aZB6JO6u"
      ],
      "uploadDate": "2025-02-20T00:00:00.000Z",
      "fileSize": "13.11 GB",
      "Gamedrive_Link": "https://gamedrive.org/marvels-spider-man-2-update-v1-205-0-0-v1-212-1-0-update-only/"
    },
    {
      "title": "Marvels Spider-Man 2 Update v1.202.0.0 – v1.205.0.0 [Update Only]",
      "uris": [
        "https://vikingfile.com/f/JYlZzvAWXX"
      ],
      "uploadDate": "2025-02-06T00:00:00.000Z",
      "fileSize": "4.45 GB",
      "Gamedrive_Link": "https://gamedrive.org/marvels-spider-man-2-update-v1-202-0-0-v1-205-0-0-update-only/"
    },
    {
      "title": "Star Trek Resurgence update 23.05.2024 – 26.06.2024 [Elamigos Update]",
      "uris": [
        "https://vikingfile.com/f/8jntAy66Pf",
        "https://pixeldrain.com/u/8J95dpZV"
      ],
      "uploadDate": "2024-05-23T00:00:00.000Z",
      "fileSize": "",
      "Gamedrive_Link": "https://gamedrive.org/star-trek-resurgence-update-23-05-2024-26-06-2024-elamigos-update/"
    },
    {
      "title": "TEKKEN 8 update 1.08.01 – 1.10.01 (16.12.2024) [Elamigos Update]",
      "uris": [
        "https://vikingfile.com/f/Bo0oeKasCB",
        "https://pixeldrain.com/u/gkSzm1sS"
      ],
      "uploadDate": "2024-12-16T00:00:00.000Z",
      "fileSize": "6.52 GB",
      "Gamedrive_Link": "https://gamedrive.org/tekken-8-update-1-08-01-1-10-01-16-12-2024-elamigos-update/"
    },
    {
      "title": "Tennis World Tour Legends Edition update 1.13-1.14 H1 (23.05.2019) [Elamigos Update]",
      "uris": [
        "https://vikingfile.com/f/3NjbJN5AKo"
      ],
      "uploadDate": "2019-05-23T00:00:00.000Z",
      "fileSize": "37.41 MB",
      "Gamedrive_Link": "https://gamedrive.org/tennis-world-tour-legends-edition-update-1-13-1-14-h1-23-05-2019-elamigos-update/"
    },
    {
      "title": "Assetto Corsa EVO update v0.1 – v0.1.1 [GameDrive Update]",
      "uris": [
        "https://pixeldrain.com/u/16Fawkov"
      ],
      "uploadDate": "2025-01-17T00:00:00.000Z",
      "fileSize": "10.24 MB",
      "Gamedrive_Link": "https://gamedrive.org/assetto-corsa-evo-update-v0-1-v0-1-1-gamedrive-update/"
    },
    {
      "title": "WWE 2K24 update 1.24 – 1.25 [GameDrive Update]",
      "uris": [
        "https://pixeldrain.com/u/saUNv7NK"
      ],
      "uploadDate": "2024-12-26T00:00:00.000Z",
      "fileSize": "",
      "Gamedrive_Link": "https://gamedrive.org/wwe-2k24-update-1-24-1-25-gamedrive-update/"
    },
    {
      "title": "S.T.A.L.K.E.R. 2 Heart of Chornobyl (2024) b16454264 to b16474540",
      "uris": [
        "https://pixeldrain.com/u/44DyJ7zf"
      ],
      "uploadDate": "2024-11-21T00:00:00.000Z",
      "fileSize": "",
      "Gamedrive_Link": "https://gamedrive.org/s-t-a-l-k-e-r-2-heart-of-chornobyl-2024-b16454264-to-b16474540/"
    },
    {
      "title": "The Sims 4 update 1.108.329 – 1.109.185 (19.09.2024) [Elamigos Update]",
      "uris": [
        "https://pixeldrain.com/u/xeVpJMNN",
        "https://buzzheavier.com/f/Gbd2icfpAAA"
      ],
      "uploadDate": "2024-09-19T00:00:00.000Z",
      "fileSize": "752 MB",
      "Gamedrive_Link": "https://gamedrive.org/the-sims-4-update-1-108-329-1-109-185-19-09-2024-elamigos-update/"
    },
    {
      "title": "Ghostrunner 2 update 08.02.2024 – 30.10.2024 [Elamigos Update]",
      "uris": [
        "https://pixeldrain.com/u/pE2btN3o",
        "https://buzzheavier.com/f/GbdwmaFFcAA"
      ],
      "uploadDate": "2024-02-08T00:00:00.000Z",
      "fileSize": "527.15 MB",
      "Gamedrive_Link": "https://gamedrive.org/ghostrunner-2-update-08-02-2024-30-10-2024-elamigos-update/"
    },
    {
      "title": "Armored Core VI Fires of Rubicon update 1.06.1 – 1.07.2 (29.10.2024) [Elamigos Update]",
      "uris": [
        "https://pixeldrain.com/u/HW8VyNhq",
        "https://buzzheavier.com/f/GbdcAHMFcAA"
      ],
      "uploadDate": "2024-10-29T00:00:00.000Z",
      "fileSize": "75.65 MB",
      "Gamedrive_Link": "https://gamedrive.org/armored-core-vi-fires-of-rubicon-update-1-06-1-1-07-2-29-10-2024-elamigos-update/"
    },
    {
      "title": "Funko Fusion update 137492 – 139555 (30.10.2024) [Elamigos Update]",
      "uris": [
        "https://pixeldrain.com/u/HsVfsymm",
        "https://buzzheavier.com/f/GbdtWEtFcAA"
      ],
      "uploadDate": "2024-10-30T00:00:00.000Z",
      "fileSize": "139.17 MB",
      "Gamedrive_Link": "https://gamedrive.org/funko-fusion-update-137492-139555-30-10-2024-elamigos-update/"
    },
    {
      "title": "Ara History Untold update 1.0.0.316 – 1.0.6.204 (30.10.2024) [Elamigos Update]",
      "uris": [
        "https://pixeldrain.com/u/oC5KrWS7",
        "https://buzzheavier.com/f/GbdbglUFcAA"
      ],
      "uploadDate": "2024-10-30T00:00:00.000Z",
      "fileSize": "213.06 MB",
      "Gamedrive_Link": "https://gamedrive.org/ara-history-untold-update-1-0-0-316-1-0-6-204-30-10-2024-elamigos-update/"
    },
    {
      "title": "Alan Wake 2 update 1.2.2 – 1.2.3 (28.10.2024) [Elamigos Update]",
      "uris": [
        "https://pixeldrain.com/u/EHoZShuL",
        "https://buzzheavier.com/f/GbdQLZzFcAA"
      ],
      "uploadDate": "2024-10-28T00:00:00.000Z",
      "fileSize": "",
      "Gamedrive_Link": "https://gamedrive.org/alan-wake-2-update-1-2-2-1-2-3-28-10-2024-elamigos-update/"
    },
    {
      "title": "Horizon Zero Dawn Remastered update 1.0.37 – 1.0.38 (01.11.2024) [Elamigos Update]",
      "uris": [
        "https://pixeldrain.com/u/kEmCtqvW",
        "https://buzzheavier.com/f/Gbb2aAgFcAA"
      ],
      "uploadDate": "2024-11-01T00:00:00.000Z",
      "fileSize": "46.58 MB",
      "Gamedrive_Link": "https://gamedrive.org/horizon-zero-dawn-remastered-update-1-0-37-1-0-38-01-11-2024-elamigos-update/"
    },
    {
      "title": "God of War Ragnarok v1.3 – v1.4 [Elamigos Update]",
      "uris": [
        "https://buzzheavier.com/f/GY24gBxf0AA"
      ],
      "uploadDate": "2024-10-02T00:00:00.000Z",
      "fileSize": "19.5 MB",
      "Gamedrive_Link": "https://gamedrive.org/god-of-war-ragnarok-v1-3-v1-4-elamigos-update/"
    },
    {
      "title": "Cyberpunk 2077 update 2.12 – 2.13 (12.09.2024) [Elamigos Update]",
      "uris": [
        "https://pixeldrain.com/u/LQ4GyV3k",
        "https://buzzheavier.com/f/GYpbztHf0AA"
      ],
      "uploadDate": "2024-09-12T00:00:00.000Z",
      "fileSize": "1.06 GB",
      "Gamedrive_Link": "https://gamedrive.org/cyberpunk-2077-update-2-12-2-13-12-09-2024-elamigos-update/"
    },
    {
      "title": "God of War Ragnarok v1.2 – Hot Fix v3.1 (35MB) [GameDrive Update]",
      "uris": [
        "https://buzzheavier.com/f/GYh3edTpAAA"
      ],
      "uploadDate": "2024-09-28T00:00:00.000Z",
      "fileSize": "34.54 MB",
      "Gamedrive_Link": "https://gamedrive.org/god-of-war-ragnarok-v1-2-hot-fix-v3-1-35mb-gamedrive-update/"
    },
    {
      "title": "God of War Ragnarok v1.1 – v1.2 (255MB) [GameDrive Update]",
      "uris": [
        "https://gofile.io/d/HjFokp"
      ],
      "uploadDate": "2024-09-22T00:00:00.000Z",
      "fileSize": "256.19 MB",
      "Gamedrive_Link": "https://gamedrive.org/god-of-war-ragnarok-v1-1-v1-2-255mb-gamedrive-update/"
    },
    {
      "title": "WWE 2K24 update 1.16 – 1.17 [GameDrive Update]",
      "uris": [
        "https://www.mediafire.com/folder/sqv7cfu5okluc/WWE+2K24+update+1.16+%E2%80%93+1.17+[GameDrive+Update]"
      ],
      "uploadDate": "2024-09-20T00:00:00.000Z",
      "fileSize": "",
      "Gamedrive_Link": "https://gamedrive.org/wwe-2k24-update-1-16-1-17-gamedrive-update/"
    },
    {
      "title": "God of War Ragnarok v1.1 – v1.1.1 (11MB) [GameDrive Update]",
      "uris": [
        "https://buzzheavier.com/f/GX6BS_mf0AA"
      ],
      "uploadDate": "2024-09-20T00:00:00.000Z",
      "fileSize": "11.36 MB",
      "Gamedrive_Link": "https://gamedrive.org/god-of-war-ragnarok-v1-1-v1-1-1-gamedrive-update/"
    },
    {
      "title": "Xuan-Yuan Sword The Gate of Firmament update 3 (26.03.2016) [Elamigos Update]",
      "uris": [
        "https://gofile.io/d/dCwZg4",
        "https://www.rootz.so/d/1Nxhmy",
        "https://vikingfile.com/f/TXQ0LsDk2Z",
        "https://pixeldrain.com/u/2vVyjBjG"
      ],
      "uploadDate": "2016-03-26T00:00:00.000Z",
      "fileSize": "87.49 MB",
      "Gamedrive_Link": "https://gamedrive.org/xuan-yuan-sword-the-gate-of-firmament-update-3-26-03-2016-elamigos-update/"
    },
    {
      "title": "Yakuza 6 The Song of Life update 21.04.2021 [Elamigos Update]",
      "uris": [
        "https://vikingfile.com/f/I9pmuMUpyK",
        "https://datanodes.to/r3oidlh87y1r/gth570gg.EU-GameDrive.Org.rar",
        "https://pixeldrain.com/u/YAEWYaBD"
      ],
      "uploadDate": "2021-04-21T00:00:00.000Z",
      "fileSize": "721.80 MB",
      "Gamedrive_Link": "https://gamedrive.org/yakuza-6-the-song-of-life-update-21-04-2021-elamigos-update/"
    },
    {
      "title": "Xuan-Yuan Sword VII update 1.21.0 – 1.26.0 (30.09.2021) [Elamigos Update]",
      "uris": [
        "https://vikingfile.com/f/rN5QFpf2gm",
        "https://datanodes.to/hwijh9vi7shu/trggg165.EU-GameDrive.Org.rar",
        "https://pixeldrain.com/u/jjxdSMgY"
      ],
      "uploadDate": "2021-09-30T00:00:00.000Z",
      "fileSize": "121.65 MB",
      "Gamedrive_Link": "https://gamedrive.org/xuan-yuan-sword-vii-update-1-21-0-1-26-0-30-09-2021-elamigos-update/"
    },
    {
      "title": "XIII 2020 Remake update 13.09.2022 – 30.01.2023 [Elamigos Update]",
      "uris": [
        "https://gofile.io/d/tPu6ya",
        "https://www.rootz.so/d/3DlIW",
        "https://vikingfile.com/f/KAKm1zziAn",
        "https://pixeldrain.com/u/52yGo831"
      ],
      "uploadDate": "2022-09-13T00:00:00.000Z",
      "fileSize": "21.53 MB",
      "Gamedrive_Link": "https://gamedrive.org/xiii-2020-remake-update-13-09-2022-30-01-2023-elamigos-update/"
    },
    {
      "title": "Ys VIII Lacrimosa of Dana update 17.01.2020 – 07.11.2022 [Elamigos Update]",
      "uris": [
        "https://vikingfile.com/f/mQeASWz08w",
        "https://datanodes.to/nl37xphfh4g7/trg54ggg65.EU-GameDrive.Org.rar",
        "https://pixeldrain.com/u/4BG3FBVo"
      ],
      "uploadDate": "2020-01-17T00:00:00.000Z",
      "fileSize": "11.48 MB",
      "Gamedrive_Link": "https://gamedrive.org/ys-viii-lacrimosa-of-dana-update-17-01-2020-07-11-2022-elamigos-update/"
    },
    {
      "title": "XCOM Chimera Squad update 1.0.0.46049 (21.05.2020) [Elamigos Update]",
      "uris": [
        "https://vikingfile.com/f/0pux5uLM5d",
        "https://datanodes.to/q1hmy0oelz7f/040g65.EU-GameDrive.Org.rar",
        "https://pixeldrain.com/u/59Dmg2DU"
      ],
      "uploadDate": "2020-05-21T00:00:00.000Z",
      "fileSize": "301.31 MB",
      "Gamedrive_Link": "https://gamedrive.org/xcom-chimera-squad-update-1-0-0-46049-21-05-2020-elamigos-update/"
    },
    {
      "title": "Sand Land update 1.0.3 – 1.0.7 (20.08.2024) [Elamigos Update]",
      "uris": [
        "https://vikingfile.com/f/RxifaqSjSc",
        "https://datanodes.to/zpzxkwv3gkvr/7498.EU-GameDrive.Org.rar",
        "https://pixeldrain.com/u/X7mGeQwt"
      ],
      "uploadDate": "2024-08-20T00:00:00.000Z",
      "fileSize": "179.82 MB",
      "Gamedrive_Link": "https://gamedrive.org/sand-land-update-1-0-3-1-0-7-20-08-2024-elamigos-update/"
    },
    {
      "title": "Two Point Hospital update 1.29.36 – 1.29.52 (28.06.2022) [Elamigos Update]",
      "uris": [
        "https://buzzheavier.com/f/GXN5q9bf0AA"
      ],
      "uploadDate": "2022-06-28T00:00:00.000Z",
      "fileSize": "7.58 MB",
      "Gamedrive_Link": "https://gamedrive.org/two-point-hospital-update-1-29-36-1-29-52-28-06-2022-elamigos-update/"
    },
    {
      "title": "Tour de France 2022 update 1.03.04 (27.06.2022) [Elamigos Update]",
      "uris": [
        "https://buzzheavier.com/f/GXNsCrppAAA"
      ],
      "uploadDate": "2022-06-27T00:00:00.000Z",
      "fileSize": "187.74 MB",
      "Gamedrive_Link": "https://gamedrive.org/tour-de-france-2022-update-1-03-04-27-06-2022-elamigos-update/"
    },
    {
      "title": "Transport Fever 2 update 35230 – 35732 (11.01.2024) [Elamigos Update]",
      "uris": [
        "https://buzzheavier.com/f/GXNx4Qqf0AA"
      ],
      "uploadDate": "2024-01-11T00:00:00.000Z",
      "fileSize": "142.37 MB",
      "Gamedrive_Link": "https://gamedrive.org/transport-fever-2-update-35230-35732-11-01-2024-elamigos-update/"
    },
    {
      "title": "TT Isle of Man Ride on the Edge 2 update 1.15.1 (20.05.2020) [Elamigos Update]",
      "uris": [
        "https://buzzheavier.com/f/GXN35BUf0AA"
      ],
      "uploadDate": "2020-05-20T00:00:00.000Z",
      "fileSize": "8.29 MB",
      "Gamedrive_Link": "https://gamedrive.org/tt-isle-of-man-ride-on-the-edge-2-update-1-15-1-20-05-2020-elamigos-update/"
    },
    {
      "title": "Total War ROME Remastered update 2.0.2 – 2.0.5 (25.01.2022) [Elamigos Update]",
      "uris": [
        "https://buzzheavier.com/f/GXNlohFf0AA"
      ],
      "uploadDate": "2022-01-25T00:00:00.000Z",
      "fileSize": "221.20 MB",
      "Gamedrive_Link": "https://gamedrive.org/total-war-rome-remastered-update-2-0-2-2-0-5-25-01-2022-elamigos-update/"
    },
    {
      "title": "Trine 5 A Clockwork Conspiracy update 1.0.2 – 1.0.4 (16.11.2023) [Elamigos Update]",
      "uris": [
        "https://vikingfile.com/f/9n4HYKvqhI",
        "https://datanodes.to/ron5t1xqchxw/548gg678.EU-GameDrive.Org.rar",
        "https://pixeldrain.com/u/cGgjES2x"
      ],
      "uploadDate": "2023-11-16T00:00:00.000Z",
      "fileSize": "187.62 MB",
      "Gamedrive_Link": "https://gamedrive.org/trine-5-a-clockwork-conspiracy-update-1-0-2-1-0-4-16-11-2023-elamigos-update/"
    },
    {
      "title": "Triangle Strategy update 06.04.2023 – 13.06.2023 [Elamigos Update]",
      "uris": [
        "https://buzzheavier.com/f/GXNzOz3f0AA"
      ],
      "uploadDate": "2023-04-06T00:00:00.000Z",
      "fileSize": "492.70 MB",
      "Gamedrive_Link": "https://gamedrive.org/triangle-strategy-update-06-04-2023-13-06-2023-elamigos-update/"
    },
    {
      "title": "Trials of Mana update 04.11.2020 (v1.1.1) [Elamigos Update]",
      "uris": [
        "https://buzzheavier.com/f/GXNyjimf0AA"
      ],
      "uploadDate": "2020-11-04T00:00:00.000Z",
      "fileSize": "108.32 MB",
      "Gamedrive_Link": "https://gamedrive.org/trials-of-mana-update-04-11-2020-v1-1-1-elamigos-update/"
    },
    {
      "title": "WWE 2K17 Digital Deluxe Edition update 4 (29.03.2017) [Elamigos Update]",
      "uris": [
        "https://vikingfile.com/f/vxWbJopHkx",
        "https://datanodes.to/nmstr90cy0dv/04040575vbv.EU-GameDrive.Org.rar",
        "https://pixeldrain.com/u/KfvUnhsP"
      ],
      "uploadDate": "2017-03-29T00:00:00.000Z",
      "fileSize": "3.70 GB",
      "Gamedrive_Link": "https://gamedrive.org/wwe-2k17-digital-deluxe-edition-update-4-29-03-2017-elamigos-update/"
    },
    {
      "title": "WWE 2K18 Digital Deluxe Edition update 1.07 (24.01.2018) [Elamigos Update]",
      "uris": [
        "https://vikingfile.com/f/AS1LCoWLTT",
        "https://datanodes.to/2oznqcvn7z1a/8978575vbv.EU-GameDrive.Org.rar",
        "https://pixeldrain.com/u/VUGKdXph"
      ],
      "uploadDate": "2018-01-24T00:00:00.000Z",
      "fileSize": "2.79 GB",
      "Gamedrive_Link": "https://gamedrive.org/wwe-2k18-digital-deluxe-edition-update-1-07-24-01-2018-elamigos-update/"
    },
    {
      "title": "Yakuza Kiwami update 5 (26.03.2019) [Elamigos Update]",
      "uris": [
        "https://vikingfile.com/f/uOJzWiIUpp",
        "https://gofile.io/d/KHBLwc"
      ],
      "uploadDate": "2019-03-26T00:00:00.000Z",
      "fileSize": "7.53 MB",
      "Gamedrive_Link": "https://gamedrive.org/yakuza-kiwami-update-5-26-03-2019-elamigos-update/"
    },
    {
      "title": "Yakuza 0 update 4 (27.03.2019) [Elamigos Update]",
      "uris": [
        "https://pixeldrain.com/u/71mTgiu8"
      ],
      "uploadDate": "2019-03-27T00:00:00.000Z",
      "fileSize": "273 MB",
      "Gamedrive_Link": "https://gamedrive.org/yakuza-0-update-4-27-03-2019-elamigos-update/"
    },
    {
      "title": "Ultimate Marvel vs. Capcom 3 update 1 (22.04.2017) [Elamigos Update]",
      "uris": [
        "https://buzzheavier.com/f/GXGERkgf0AA"
      ],
      "uploadDate": "2017-04-22T00:00:00.000Z",
      "fileSize": "5.09 MB",
      "Gamedrive_Link": "https://gamedrive.org/ultimate-marvel-vs-capcom-3-update-1-22-04-2017-elamigos-update/"
    },
    {
      "title": "Ultimate Admiral Age of Sail update 1.0.0 – 1.1.7 (16.09.2021) [Elamigos Update]",
      "uris": [
        "https://buzzheavier.com/f/GXGCf3Wf0AA"
      ],
      "uploadDate": "2021-09-16T00:00:00.000Z",
      "fileSize": "22.28 MB",
      "Gamedrive_Link": "https://gamedrive.org/ultimate-admiral-age-of-sail-update-1-0-0-1-1-7-16-09-2021-elamigos-update/"
    },
    {
      "title": "Uncharted 4 Legacy of Thieves Collection update 1.3.20900 – 1.4.21058 (06.07.2023) [Elamigos Update]",
      "uris": [
        "https://buzzheavier.com/f/GXGF9hEf0AA"
      ],
      "uploadDate": "2023-07-06T00:00:00.000Z",
      "fileSize": "104.88 MB",
      "Gamedrive_Link": "https://gamedrive.org/uncharted-4-legacy-of-thieves-collection-update-1-3-20900-1-4-21058-06-07-2023-elamigos-update/"
    },
    {
      "title": "Warhammer 40000 Battlesector update 1.4.72 – 1.4.82 (06.06.2024) [Elamigos Update]",
      "uris": [
        "https://buzzheavier.com/f/GW-ko_Qf0AA"
      ],
      "uploadDate": "2024-06-06T00:00:00.000Z",
      "fileSize": "",
      "Gamedrive_Link": "https://gamedrive.org/warhammer-40000-battlesector-update-1-4-72-1-4-82-06-06-2024-elamigos-update/"
    },
    {
      "title": "Valkyria Chronicles 4 – DLC pack (28.01.2019) [Elamigos Update]",
      "uris": [
        "https://vikingfile.com/f/FXJPwOh95H",
        "https://pixeldrain.com/u/HtFVnN8m"
      ],
      "uploadDate": "2019-01-28T00:00:00.000Z",
      "fileSize": "681.96 MB",
      "Gamedrive_Link": "https://gamedrive.org/valkyria-chronicles-4-dlc-pack-28-01-2019-elamigos-update/"
    },
    {
      "title": "Valkyrie Drive BHIKKHUNI Complete Edition update 1.03 (14.07.2017) [Elamigos Update]",
      "uris": [
        "https://buzzheavier.com/f/GW-U4UqpAAA"
      ],
      "uploadDate": "2017-07-14T00:00:00.000Z",
      "fileSize": "6.30 MB",
      "Gamedrive_Link": "https://gamedrive.org/valkyrie-drive-bhikkhuni-complete-edition-update-1-03-14-07-2017-elamigos-update/"
    },
    {
      "title": "Wanted Dead update 09.04.2024 (v1.13) [Elamigos Update]",
      "uris": [
        "https://buzzheavier.com/f/GW-cA6xf0AA"
      ],
      "uploadDate": "2024-04-09T00:00:00.000Z",
      "fileSize": "639.64 MB",
      "Gamedrive_Link": "https://gamedrive.org/wanted-dead-update-09-04-2024-v1-13-elamigos-update/"
    },
    {
      "title": "Viewfinder update 1.0.6 (31.07.2023) [Elamigos Update]",
      "uris": [
        "https://buzzheavier.com/f/GW-XGncf0AA"
      ],
      "uploadDate": "2023-07-31T00:00:00.000Z",
      "fileSize": "97.89 MB",
      "Gamedrive_Link": "https://gamedrive.org/viewfinder-update-1-0-6-31-07-2023-elamigos-update/"
    },
    {
      "title": "Wreckfest update 1.295540 – 1.308438 (22.03.2024) [Elamigos Update]",
      "uris": [
        "https://vikingfile.com/f/cZhhCFdUuj",
        "https://datanodes.to/bg04hn6h6f06/fdgth6565.EU-GameDrive.Org.rar",
        "https://pixeldrain.com/u/TCKhCZNx"
      ],
      "uploadDate": "2024-03-22T00:00:00.000Z",
      "fileSize": "335.30 MB",
      "Gamedrive_Link": "https://gamedrive.org/wreckfest-update-1-295540-1-308438-22-03-2024-elamigos-update/"
    },
    {
      "title": "Ghost of Tsushima update 1053.0718 – 1053.0809 (13.08.2024) [Elamigos Update]",
      "uris": [
        "https://vikingfile.com/f/PzCY8QAzrT",
        "https://datanodes.to/e3o7kkigy9ej/bdfb65gg6565.EU-GameDrive.Org.rar",
        "https://pixeldrain.com/u/zcTgXW3F"
      ],
      "uploadDate": "2024-08-13T00:00:00.000Z",
      "fileSize": "36.68 MB",
      "Gamedrive_Link": "https://gamedrive.org/ghost-of-tsushima-update-1053-0718-1053-0809-13-08-2024-elamigos-update/"
    },
    {
      "title": "Warhammer 40000 Gladius Relics of War update 1.11.1 – 1.13.0 (30.11.2023) [Elamigos Update]",
      "uris": [
        "https://buzzheavier.com/f/GW-kwLrf0AA"
      ],
      "uploadDate": "2023-11-30T00:00:00.000Z",
      "fileSize": "201.36 MB",
      "Gamedrive_Link": "https://gamedrive.org/warhammer-40000-gladius-relics-of-war-update-1-11-1-1-13-0-30-11-2023-elamigos-update/"
    },
    {
      "title": "Wolcen Lords of Mayhem update 1.1.7.0 – 1.1.7.16 (20.07.2023) [Elamigos Update]",
      "uris": [
        "https://buzzheavier.com/f/GW-lZe_pAAA"
      ],
      "uploadDate": "2023-07-20T00:00:00.000Z",
      "fileSize": "259.47 MB",
      "Gamedrive_Link": "https://gamedrive.org/wolcen-lords-of-mayhem-update-1-1-7-0-1-1-7-16-20-07-2023-elamigos-update/"
    },
    {
      "title": "V-Rally 4 update 1.08 (05.03.2019) [Elamigos Update]",
      "uris": [
        "https://gofile.io/d/eVJZgs",
        "https://vikingfile.com/f/3A56duoJPW",
        "https://pixeldrain.com/u/TKPspdnp"
      ],
      "uploadDate": "2019-03-05T00:00:00.000Z",
      "fileSize": "461.06 MB",
      "Gamedrive_Link": "https://gamedrive.org/v-rally-4-update-1-08-05-03-2019-elamigos-update/"
    },
    {
      "title": "Victoria 3 update 1.7.0 – 1.7.6 (28.08.2024) [Elamigos Update]",
      "uris": [
        "https://buzzheavier.com/f/GW-WEmLf0AA"
      ],
      "uploadDate": "2024-08-28T00:00:00.000Z",
      "fileSize": "44.10 MB",
      "Gamedrive_Link": "https://gamedrive.org/victoria-3-update-1-7-0-1-7-6-28-08-2024-elamigos-update/"
    },
    {
      "title": "Warriors All-Stars update 1 (04.10.2017) [Elamigos Update]",
      "uris": [
        "https://vikingfile.com/f/eObkHfS8Dx",
        "https://datanodes.to/lr9cj5v350ez/sd50.EU-GameDrive.Org.rar",
        "https://pixeldrain.com/u/ha4HWtCu"
      ],
      "uploadDate": "2017-10-04T00:00:00.000Z",
      "fileSize": "59.2 MB",
      "Gamedrive_Link": "https://gamedrive.org/warriors-all-stars-update-1-04-10-2017-elamigos-update/"
    },
    {
      "title": "Brothers A Tale of Two Sons Remake update 29.07.2024 [Elamigos Update]x",
      "uris": [
        "https://buzzheavier.com/f/GXDWBc2f0AA"
      ],
      "uploadDate": "2024-07-29T00:00:00.000Z",
      "fileSize": "170.63 MB",
      "Gamedrive_Link": "https://gamedrive.org/brothers-a-tale-of-two-sons-remake-update-29-07-2024-elamigos-updatex/"
    },
    {
      "title": "Blacktail update 1.5 (14.02.2023) [Elamigos Update]",
      "uris": [
        "https://vikingfile.com/f/FrWxtWP4Wn",
        "https://datanodes.to/2ki3dxq8anb1/65u67570gg.EU-GameDrive.Org.rar",
        "https://pixeldrain.com/u/zwFUBtEr"
      ],
      "uploadDate": "2023-02-14T00:00:00.000Z",
      "fileSize": "190.9 MB",
      "Gamedrive_Link": "https://gamedrive.org/blacktail-update-1-5-14-02-2023-elamigos-update/"
    },
    {
      "title": "Still Wakes the Deep update 1.2 – 1.3 (16.07.2024) [Elamigos Update]",
      "uris": [
        "https://buzzheavier.com/f/GXD9XDYf0AA"
      ],
      "uploadDate": "2024-07-16T00:00:00.000Z",
      "fileSize": "99.04 MB",
      "Gamedrive_Link": "https://gamedrive.org/still-wakes-the-deep-update-1-2-1-3-16-07-2024-elamigos-update-2/"
    },
    {
      "title": "Riven 2024 Remake update 15.07.2024 [Elamigos Update]",
      "uris": [
        "https://buzzheavier.com/f/GXD9BeEf0AA"
      ],
      "uploadDate": "2024-07-15T00:00:00.000Z",
      "fileSize": "1.25 GB",
      "Gamedrive_Link": "https://gamedrive.org/riven-2024-remake-update-15-07-2024-elamigos-update/"
    },
    {
      "title": "Riven 2024 Remake update 01.08.2024 [Elamigos Update]",
      "uris": [
        "https://buzzheavier.com/f/GXD813hf0AA"
      ],
      "uploadDate": "2024-08-01T00:00:00.000Z",
      "fileSize": "1.47 GB",
      "Gamedrive_Link": "https://gamedrive.org/riven-2024-remake-update-01-08-2024-elamigos-update/"
    },
    {
      "title": "WRC Generations update 1.5.26.0 + 5 DLC (17.01.2023) [Elamigos Update]",
      "uris": [
        "https://vikingfile.com/f/pbVCEnlGZg",
        "https://datanodes.to/geqttvb4teop/sdf5450.EU-GameDrive.Org.rar",
        "https://pixeldrain.com/u/RyGCwEBX"
      ],
      "uploadDate": "2023-01-17T00:00:00.000Z",
      "fileSize": "98.59 MB",
      "Gamedrive_Link": "https://gamedrive.org/wrc-generations-update-1-5-26-0-5-dlc-17-01-2023-elamigos-update/"
    },
    {
      "title": "Blair Witch update 28.10.2019 – 03.12.2019 [Elamigos Update]",
      "uris": [
        "https://vikingfile.com/f/LDwLi4OATD",
        "https://datanodes.to/jdq5ovxvgjnp/y56u657570gg.EU-GameDrive.Org.rar",
        "https://pixeldrain.com/u/eGbqFv7m"
      ],
      "uploadDate": "2019-10-28T00:00:00.000Z",
      "fileSize": "77.11 MB",
      "Gamedrive_Link": "https://gamedrive.org/blair-witch-update-28-10-2019-03-12-2019-elamigos-update/"
    },
    {
      "title": "Yakuza Remastered Collection update 26.03.2021 [Elamigos Update]",
      "uris": [
        "https://vikingfile.com/f/FqkGy0QRti",
        "https://gofile.io/d/gCX3Jr"
      ],
      "uploadDate": "2021-03-26T00:00:00.000Z",
      "fileSize": "93.43 MB",
      "Gamedrive_Link": "https://gamedrive.org/yakuza-remastered-collection-update-26-03-2021-elamigos-update/"
    },
    {
      "title": "Wolfenstein II The New Colossus update 7-10 (19.11.2018) [Elamigos Update]",
      "uris": [
        "https://gofile.io/d/KkVmdc",
        "https://vikingfile.com/f/buvRQZ0AUN",
        "https://pixeldrain.com/u/C5ot6mK9"
      ],
      "uploadDate": "2018-11-19T00:00:00.000Z",
      "fileSize": "82.09 MB",
      "Gamedrive_Link": "https://gamedrive.org/wolfenstein-ii-the-new-colossus-update-7-10-19-11-2018-elamigos-update/"
    },
    {
      "title": "Wo Long Fallen Dynasty update 1.300 – 1.304 (06.02.2024) [Elamigos Update]",
      "uris": [
        "https://vikingfile.com/f/qAOROgzN3A",
        "https://pixeldrain.com/u/DzChrTBm"
      ],
      "uploadDate": "2024-02-06T00:00:00.000Z",
      "fileSize": "155.96 MB",
      "Gamedrive_Link": "https://gamedrive.org/wo-long-fallen-dynasty-update-1-300-1-304-06-02-2024-elamigos-update/"
    },
    {
      "title": "Werewolf The Apocalypse Earthblood update 49104 (25.02.2021) [Elamigos Update]",
      "uris": [
        "https://vikingfile.com/f/oP3NgjU6UV",
        "https://datanodes.to/jls9ik1q1vjr/6758g65.EU-GameDrive.Org.rar",
        "https://pixeldrain.com/u/N7iBEUvY"
      ],
      "uploadDate": "2021-02-25T00:00:00.000Z",
      "fileSize": "150.99 MB",
      "Gamedrive_Link": "https://gamedrive.org/werewolf-the-apocalypse-earthblood-update-49104-25-02-2021-elamigos-update/"
    },
    {
      "title": "Weird West update 1.03.75036 – 1.05.78819 (02.03.2023) [Elamigos Update]",
      "uris": [
        "https://gofile.io/d/72zXzp",
        "https://vikingfile.com/f/cqyZGuzEnD",
        "https://pixeldrain.com/u/kBNccC1V"
      ],
      "uploadDate": "2023-03-02T00:00:00.000Z",
      "fileSize": "280.01 MB",
      "Gamedrive_Link": "https://gamedrive.org/weird-west-update-1-03-75036-1-05-78819-02-03-2023-elamigos-update/"
    },
    {
      "title": "Wolfenstein Youngblood update 08.03.2022 – 04.05.2023 [Elamigos Update]",
      "uris": [
        "https://vikingfile.com/f/OXC80z0JXE",
        "https://datanodes.to/1awn2tdx1th5/040740tr5.EU-GameDrive.Org.rar",
        "https://pixeldrain.com/u/YHbUknoA"
      ],
      "uploadDate": "2022-03-08T00:00:00.000Z",
      "fileSize": "177.96 MB",
      "Gamedrive_Link": "https://gamedrive.org/wolfenstein-youngblood-update-08-03-2022-04-05-2023-elamigos-update/"
    },
    {
      "title": "WARNO update 125318 – 130173 (27.08.2024) [Elamigos Update]",
      "uris": [
        "https://buzzheavier.com/f/GW-k65Of0AA"
      ],
      "uploadDate": "2024-08-27T00:00:00.000Z",
      "fileSize": "1.79 GB",
      "Gamedrive_Link": "https://gamedrive.org/warno-update-125318-130173-27-08-2024-elamigos-update/"
    },
    {
      "title": "WARNO update 122779 – 125318 (01.07.2024) [Elamigos Update]",
      "uris": [
        "https://buzzheavier.com/f/GW-k0Y8f0AA"
      ],
      "uploadDate": "2024-07-01T00:00:00.000Z",
      "fileSize": "2.36 GB",
      "Gamedrive_Link": "https://gamedrive.org/warno-update-122779-125318-01-07-2024-elamigos-update/"
    },
    {
      "title": "South Park Snow Day update 27.06.2024 – 22.08.2024 [Elamigos Update]",
      "uris": [
        "https://pixeldrain.com/u/YCHBeFkt"
      ],
      "uploadDate": "2024-06-27T00:00:00.000Z",
      "fileSize": "331.63 MB",
      "Gamedrive_Link": "https://gamedrive.org/south-park-snow-day-update-27-06-2024-22-08-2024-elamigos-update/"
    },
    {
      "title": "Robin Hood Sherwood Builders update 22.08.2024 [Elamigos Update]",
      "uris": [
        "https://pixeldrain.com/u/ipD6bWEL"
      ],
      "uploadDate": "2024-08-22T00:00:00.000Z",
      "fileSize": "542 MB",
      "Gamedrive_Link": "https://gamedrive.org/robin-hood-sherwood-builders-update-22-08-2024-elamigos-update/"
    },
    {
      "title": "Starship Troopers Terran Command update 3.0.1 – 3.1.1 (19.08.2024) [Elamigos Update]",
      "uris": [
        "https://vikingfile.com/f/BZZbynHgpe",
        "https://datanodes.to/0ism167wy62l/6587570gg.EU-GameDrive.Org.rar",
        "https://pixeldrain.com/u/hcs7MXv8"
      ],
      "uploadDate": "2024-08-19T00:00:00.000Z",
      "fileSize": "254.73 MB",
      "Gamedrive_Link": "https://gamedrive.org/starship-troopers-terran-command-update-3-0-1-3-1-1-19-08-2024-elamigos-update/"
    },
    {
      "title": "Starfield update 1.12.30 – 1.13.61 (20.08.2024) [Elamigos Update]",
      "uris": [
        "https://pixeldrain.com/u/prvGHhS3"
      ],
      "uploadDate": "2024-08-20T00:00:00.000Z",
      "fileSize": "1.45 GB",
      "Gamedrive_Link": "https://gamedrive.org/starfield-update-1-12-30-1-13-61-20-08-2024-elamigos-update/"
    },
    {
      "title": "Starfield update 1.11.36 – 1.12.30 (09.06.2024) [Elamigos Update]",
      "uris": [
        "https://pixeldrain.com/u/yrwMYp5E"
      ],
      "uploadDate": "2024-06-09T00:00:00.000Z",
      "fileSize": "2.14 GB",
      "Gamedrive_Link": "https://gamedrive.org/starfield-update-1-11-36-1-12-30-09-06-2024-elamigos-update/"
    },
    {
      "title": "The Riftbreaker update 21.06.2024 – 10.07.2024 [Elamigos Update]",
      "uris": [
        "https://pixeldrain.com/u/12hDU7Nq"
      ],
      "uploadDate": "2024-06-21T00:00:00.000Z",
      "fileSize": "133.58 MB",
      "Gamedrive_Link": "https://gamedrive.org/the-riftbreaker-update-21-06-2024-10-07-2024-elamigos-update/"
    },
    {
      "title": "Trailmakers update 1.8.1 – 1.9.1 (16.08.2024) [Elamigos Update]",
      "uris": [
        "https://pixeldrain.com/u/kZUQ2N9c"
      ],
      "uploadDate": "2024-08-16T00:00:00.000Z",
      "fileSize": "243.85 MB",
      "Gamedrive_Link": "https://gamedrive.org/trailmakers-update-1-8-1-1-9-1-16-08-2024-elamigos-update/"
    },
    {
      "title": "Generation Zero update 25.06.2024 – 20.08.2024 [Elamigos Update]",
      "uris": [
        "https://pixeldrain.com/u/ACBU2rBh"
      ],
      "uploadDate": "2024-06-25T00:00:00.000Z",
      "fileSize": "289.09 MB",
      "Gamedrive_Link": "https://gamedrive.org/generation-zero-update-25-06-2024-20-08-2024-elamigos-update/"
    },
    {
      "title": "Resident Evil 2 2019 update 13.06.2022 – 14.08.2023 [Elamigos Update]",
      "uris": [
        "https://vikingfile.com/f/WB8sVEev8p",
        "https://gofile.io/d/v9u5Oi"
      ],
      "uploadDate": "2022-06-13T00:00:00.000Z",
      "fileSize": "571.67 MB",
      "Gamedrive_Link": "https://gamedrive.org/resident-evil-2-2019-update-13-06-2022-14-08-2023-elamigos-update/"
    },
    {
      "title": "WWE 2K24 update 1.11 – 1.13 (23.07.2024) [Elamigos Update]",
      "uris": [
        "https://datanodes.to/z32we7o1f2hr/2K24.u1.11-1.13.EU-GameDrive.Org.rar"
      ],
      "uploadDate": "2024-07-23T00:00:00.000Z",
      "fileSize": "",
      "Gamedrive_Link": "https://gamedrive.org/wwe-2k24-update-1-11-1-13-23-07-2024-elamigos-update/"
    },
    {
      "title": "WWE 2K24 update 1.13 – 1.14 [GameDrive Update]",
      "uris": [
        "https://datanodes.to/yoljovvs32ph/2K24.u1.13%E2%80%931.14.GU-GameDrive.Org.rar",
        "https://pixeldrain.com/u/SNDxaXB9"
      ],
      "uploadDate": "2024-08-05T00:00:00.000Z",
      "fileSize": "",
      "Gamedrive_Link": "https://gamedrive.org/wwe-2k24-update-1-13-1-14-gamedrive-update/"
    },
    {
      "title": "Marvel’s Spider-Man Remastered update 1.1122 – 3.618 (27.06.2024) [Elamigos Update]",
      "uris": [
        "https://vikingfile.com/f/O79SwTJX57"
      ],
      "uploadDate": "2024-06-27T00:00:00.000Z",
      "fileSize": "352.58 MB",
      "Gamedrive_Link": "https://gamedrive.org/marvels-spider-man-remastered-update-1-1122-0-0-3-618-elamigos-update/"
    },
    {
      "title": "Marvel’s Spider-Man Miles Morales update 1.1116 – 3.617.1 (27.06.2024) [Elamigos Update]",
      "uris": [
        "https://vikingfile.com/f/1lXpG6IDLR"
      ],
      "uploadDate": "2024-06-27T00:00:00.000Z",
      "fileSize": "249.86 MB",
      "Gamedrive_Link": "https://gamedrive.org/marvels-spider-man-miles-morales-update-1-1116-3-617-1-27-06-2024-elamigos-update/"
    },
    {
      "title": "Riven 2024 Remake update 28.06.2024 [Elamigos Update]",
      "uris": [
        "https://datanodes.to/f563dkjkj469/R24R.u28.06.2024.EU-GameDrive.Org.rar",
        "https://pixeldrain.com/u/apXdjD16"
      ],
      "uploadDate": "2024-06-28T00:00:00.000Z",
      "fileSize": "855.68 MB",
      "Gamedrive_Link": "https://gamedrive.org/riven-2024-remake-update-28-06-2024-elamigos-update/"
    },
    {
      "title": "Remnant II update 420.332 – 432.022 (18.07.2024) [Elamigos Update]",
      "uris": [
        "https://datanodes.to/zqsghv9mspei/R2.u420.332-432.022.EU-GameDrive.Org.rar",
        "https://pixeldrain.com/u/N8e4osJb"
      ],
      "uploadDate": "2024-07-18T00:00:00.000Z",
      "fileSize": "1.50 GB",
      "Gamedrive_Link": "https://gamedrive.org/remnant-ii-update-420-332-432-022-18-07-2024-elamigos-update/"
    },
    {
      "title": "Remnant II update 417.127 – 420.332 (09.05.2024) [Elamigos Update]",
      "uris": [
        "https://datanodes.to/jfaywj8kyvs7/R2.u417.127-420.332.EU-GameDrive.Org.rar",
        "https://pixeldrain.com/u/2izHzFrS"
      ],
      "uploadDate": "2024-05-09T00:00:00.000Z",
      "fileSize": "1.07 GB",
      "Gamedrive_Link": "https://gamedrive.org/remnant-ii-update-417-127-420-332-09-05-2024-elamigos-update/"
    },
    {
      "title": "Ghost of Tsushima update 1053.0612 – 1053.0709 (11.07.2024) [Elamigos Update]",
      "uris": [
        "https://datanodes.to/91o4vhywu68x/GoT.u1053.0612-1053.0709.EU-GameDrive.Org.rar",
        "https://pixeldrain.com/u/d81EYXED"
      ],
      "uploadDate": "2024-07-11T00:00:00.000Z",
      "fileSize": "95.81 MB",
      "Gamedrive_Link": "https://gamedrive.org/ghost-of-tsushima-update-1053-0612-1053-0709-11-07-2024-elamigos-update/"
    },
    {
      "title": "Elden Ring update 1.12.0 – 1.12.3 (04.07.2024) [Elamigos Update]",
      "uris": [
        "https://datanodes.to/dw1b9b52hfyy/ER.u1.12.0-1.12.3.EU-GameDrive.Org.rar",
        "https://pixeldrain.com/u/AHuMyxDR"
      ],
      "uploadDate": "2024-07-04T00:00:00.000Z",
      "fileSize": "20.48 MB",
      "Gamedrive_Link": "https://gamedrive.org/elden-ring-update-1-12-0-1-12-3-04-07-2024-elamigos-update/"
    },
    {
      "title": "Forza Horizon 5 update 1.649.948 – 1.653.463 (16.07.2024) [Elamigos Update]",
      "uris": [
        "https://datanodes.to/eio3fvprnn6r/FH5.u1.649.948-1.653.463.EU-GameDrive.Org.rar",
        "https://pixeldrain.com/u/gWCELJP3"
      ],
      "uploadDate": "2024-07-16T00:00:00.000Z",
      "fileSize": "3.43 GB",
      "Gamedrive_Link": "https://gamedrive.org/forza-horizon-5-update-1-649-948-1-653-463-16-07-2024-elamigos-update/"
    },
    {
      "title": "Daymare 1994 Sandcastle update 6410 – 6564 (26.10.2023) [Elamigos Update]",
      "uris": [
        "https://vikingfile.com/f/LAXzMvEjc2",
        "https://pixeldrain.com/u/c41XXzgD"
      ],
      "uploadDate": "2023-10-26T00:00:00.000Z",
      "fileSize": "513.70 MB",
      "Gamedrive_Link": "https://gamedrive.org/daymare-1994-sandcastle-update-6410-6564-26-10-2023-elamigos-update/"
    },
    {
      "title": "Hitman 3 update 3.150.1 – 3.190 (27.06.2024) [Elamigos Update]",
      "uris": [
        "https://buzzheavier.com/f/GReWPJXTwAA",
        "https://pixeldrain.com/u/fV6633Zp"
      ],
      "uploadDate": "2024-06-27T00:00:00.000Z",
      "fileSize": "2.41 GB",
      "Gamedrive_Link": "https://gamedrive.org/hitman-3-update-3-150-1-3-190-27-06-2024-elamigos-update/"
    },
    {
      "title": "WWE 2K24 update 1.09 – 1.11 (26.06.2024) [Elamigos Update]",
      "uris": [
        "https://buzzheavier.com/f/GReWT9niYAA",
        "https://pixeldrain.com/u/sVhDuNMx"
      ],
      "uploadDate": "2024-06-26T00:00:00.000Z",
      "fileSize": "",
      "Gamedrive_Link": "https://gamedrive.org/wwe-2k24-update-1-09-1-11-26-06-2024-elamigos-update/"
    },
    {
      "title": "Ghost of Tsushima update 1053.0604 (04.06.2024) [Elamigos Update]",
      "uris": [
        "https://buzzheavier.com/f/GPenGIv4gAA=#GoT.u1053.0604.EU-GameDrive.Org.rar",
        "https://pixeldrain.com/u/yLZDWT8g"
      ],
      "uploadDate": "2024-06-04T00:00:00.000Z",
      "fileSize": "567.65 MB",
      "Gamedrive_Link": "https://gamedrive.org/ghost-of-tsushima-update-1053-0604-04-06-2024-elamigos-update/"
    },
    {
      "title": "WWE 2K24 update 1.08 – 1.09 (05.06.2024) [Elamigos Update]",
      "uris": [
        "https://buzzheavier.com/f/GPZJ8sH4gAA=#W2K24.u1.08-1.09.EU-GameDrive.Org.rar"
      ],
      "uploadDate": "2024-06-05T00:00:00.000Z",
      "fileSize": "",
      "Gamedrive_Link": "https://gamedrive.org/wwe-2k24-update-1-08-1-09-05-06-2024-elamigos-update/"
    },
    {
      "title": "The Inquisitor update 14.03.2024 [Elamigos Update]",
      "uris": [
        "https://vikingfile.com/f/hyxHRLxBGE",
        "https://pixeldrain.com/u/cfCh73vk"
      ],
      "uploadDate": "2024-03-14T00:00:00.000Z",
      "fileSize": "94.53 MB",
      "Gamedrive_Link": "https://gamedrive.org/the-inquisitor-update-14-03-2024-elamigos-update/"
    },
    {
      "title": "Ghost of Tsushima update 1053.0522 [Elamigos Update]",
      "uris": [
        "https://www.mediafire.com/folder/yfksf0mdvn8tl/Ghost+of+Tsushima+update+1053.0522+[Elamigos+Update]",
        "https://buzzheavier.com/f/GOWNB3YqIAA=#Got.u1053.0522.EU-GameDrive.Org.rar",
        "https://pixeldrain.com/u/BHZEMbT9"
      ],
      "uploadDate": "2024-05-24T00:00:00.000Z",
      "fileSize": "17 MB",
      "Gamedrive_Link": "https://gamedrive.org/ghost-of-tsushima-update-1053-0522-elamigos-update/"
    },
    {
      "title": "Green Hell update 2.7.1 – 2.8.0 (17.04.2024) [Elamigos Update]",
      "uris": [
        "https://buzzheavier.com/f/GOMQPjMqIAA=#GH.u2.7.1-2.8.0.EU-GameDrive.Org.rar",
        "https://pixeldrain.com/u/YuLez7hz"
      ],
      "uploadDate": "2024-04-17T00:00:00.000Z",
      "fileSize": "29.15 MB",
      "Gamedrive_Link": "https://gamedrive.org/green-hell-update-2-7-1-2-8-0-17-04-2024-elamigos-update/"
    },
    {
      "title": "WWE 2K24 update 1.05 – 1.08 (14.05.2024) [Elamigos Update]",
      "uris": [
        "https://buzzheavier.com/f/GNrVgoTs4AA=#W2K24.u1.05-1.08.EU-GameDrive.Org.rar",
        "https://pixeldrain.com/u/W4MnPKk2"
      ],
      "uploadDate": "2024-05-14T00:00:00.000Z",
      "fileSize": "1.26 GB",
      "Gamedrive_Link": "https://gamedrive.org/wwe-2k24-update-1-05-1-08-14-05-2024-elamigos-update/"
    },
    {
      "title": "Yakuza Kiwami 2 update 1.4 (21.08.2019) [Elamigos Update]",
      "uris": [
        "https://vikingfile.com/f/adTDAyPXLM",
        "https://gofile.io/d/fHP0zb"
      ],
      "uploadDate": "2019-08-21T00:00:00.000Z",
      "fileSize": "50.8 MB",
      "Gamedrive_Link": "https://gamedrive.org/yakuza-kiwami-2-update-1-4-21-08-2019-elamigos-update/"
    },
    {
      "title": "Farming Simulator 22 update 1.13.1 – 1.14.0 (30.04.2024) [Elamigos Update]",
      "uris": [
        "https://pixeldrain.com/u/dXVjzuXG"
      ],
      "uploadDate": "2024-04-30T00:00:00.000Z",
      "fileSize": "1.03 GB",
      "Gamedrive_Link": "https://gamedrive.org/farming-simulator-22-update-1-13-1-1-14-0-30-04-2024-elamigos-update/"
    },
    {
      "title": "Trine 4 The Nightmare Prince update 1.0.0.8541 – 1.0.0.8681 (08.02.2021) [Elamigos Update]",
      "uris": [
        "https://vikingfile.com/f/hEIhBcB8p7",
        "https://gofile.io/d/WcziM0"
      ],
      "uploadDate": "2021-02-08T00:00:00.000Z",
      "fileSize": "55.95 MB",
      "Gamedrive_Link": "https://gamedrive.org/trine-4-the-nightmare-prince-update-1-0-0-8541-1-0-0-8681-08-02-2021-elamigos-update/"
    },
    {
      "title": "Horizon Forbidden West update 1.0.37 – 1.4.59 (02.05.2024) [Elamigos Update]",
      "uris": [
        "https://www.mediafire.com/folder/fhmdj8adzecma/Horizon+Forbidden+West+update+1.0.37+-+1.4.59+[Elamigos+Update]",
        "https://buzzheavier.com/f/GNMTcd1_IAA=#Ho.u1.0.37-1.4.59.EU-GameDrive.Org.rar",
        "https://pixeldrain.com/u/62qunsJp"
      ],
      "uploadDate": "2024-05-02T00:00:00.000Z",
      "fileSize": "387.5 MB",
      "Gamedrive_Link": "https://gamedrive.org/horizon-forbidden-west-update-1-0-37-1-4-59-02-05-2024-elamigos-update/"
    },
    {
      "title": "WWE 2K19 Digital Deluxe Edition update 1.04 (17.01.2019) [Elamigos Update]",
      "uris": [
        "https://vikingfile.com/f/1K1J6YC81C",
        "https://pixeldrain.com/u/vt7iNPHT"
      ],
      "uploadDate": "2019-01-17T00:00:00.000Z",
      "fileSize": "3.33 GB",
      "Gamedrive_Link": "https://gamedrive.org/wwe-2k19-digital-deluxe-edition-update-1-04-17-01-2019-elamigos-update/"
    },
    {
      "title": "Red Dead Redemption 2 update 1311.23 – 1491.50 (19.04.2024) [Elamigos Update]",
      "uris": [
        "https://vikingfile.com/f/OSdbPLAHUo",
        "https://datanodes.to/f3u96euxfawd/RDR2.u1311.23-1491.50.EU-GameDrive.Org.rar"
      ],
      "uploadDate": "2024-04-19T00:00:00.000Z",
      "fileSize": "5.80 GB",
      "Gamedrive_Link": "https://gamedrive.org/red-dead-redemption-2-update-1311-23-1491-50-19-04-2024-elamigos-update/"
    },
    {
      "title": "Kingdom Come Deliverance update 1.9.5-1.9.6 (16.06.2020) [Elamigos Update]",
      "uris": [
        "https://buzzheavier.com/f/GMaJEa-kAAA=#KD.u1.9.5-1.9.6.EU-GameDrive.Org.rar",
        "https://pixeldrain.com/u/xT4P2ZKT"
      ],
      "uploadDate": "2020-06-16T00:00:00.000Z",
      "fileSize": "27.75 MB",
      "Gamedrive_Link": "https://gamedrive.org/kingdom-come-deliverance-update-1-9-5-1-9-6-16-06-2020-elamigos-update/"
    },
    {
      "title": "Granblue Fantasy Relink update 1.1.4 – 1.2.1 (26.04.2024) [Elamigos Update]",
      "uris": [
        "https://buzzheavier.com/f/GMVJ1WO2sAA=#GR.u1.1.4-1.2.1.EU-GameDrive.Org.rar",
        "https://pixeldrain.com/u/ejeuH1Qh"
      ],
      "uploadDate": "2024-04-26T00:00:00.000Z",
      "fileSize": "3.53 GB",
      "Gamedrive_Link": "https://gamedrive.org/granblue-fantasy-relink-update-1-1-4-1-2-1-26-04-2024-elamigos-update/"
    },
    {
      "title": "Forza Horizon 5 update 1.640.62 – 1.642.644 (23.04.2024) [Elamigos Update]",
      "uris": [
        "https://buzzheavier.com/f/GMUpMfc2sAA=#FH5.u1.640.62-1.642.644.EU-GameDrive.Org.rar",
        "https://pixeldrain.com/u/hsq74whJ"
      ],
      "uploadDate": "2024-04-23T00:00:00.000Z",
      "fileSize": "3.22 GB",
      "Gamedrive_Link": "https://gamedrive.org/forza-horizon-5-update-1-640-62-1-642-644-23-04-2024-elamigos-update/"
    },
    {
      "title": "WWE 2K24 update 1.05 – 1.06 [GameDrive Update]",
      "uris": [
        "https://www.mediafire.com/file/6wmy84oa8t6u9y7/W2K24.v1.05%E2%80%93v1.06-GameDrive.Org.rar/file",
        "https://buzzheavier.com/f/GL2ra5PGkAA=#W2K24.v1.05%E2%80%93v1.06-GameDrive.Org.rar",
        "https://pixeldrain.com/u/Z78sRC4J"
      ],
      "uploadDate": "2024-04-23T00:00:00.000Z",
      "fileSize": "",
      "Gamedrive_Link": "https://gamedrive.org/wwe-2k24-update-1-05-1-06-gamedrive-update/"
    },
    {
      "title": "Palworld Update 0.2.1.0 to 0.2.2.0 [Kirigiri Update]",
      "uris": [
        "https://buzzheavier.com/f/GLhoH8HGkAA=#Pa.0.2.1.0-0.2.2.0.Kg-GameDrive.Org.rar",
        "https://pixeldrain.com/u/1E4mYe6q"
      ],
      "uploadDate": "2024-04-19T00:00:00.000Z",
      "fileSize": "69.98 MB",
      "Gamedrive_Link": "https://gamedrive.org/palworld-update-0-2-1-0-to-0-2-2-0-kirigiri-update/"
    },
    {
      "title": "WWE 2K23 update 1.14 – 1.18 (13.09.2023) [Elamigos Update]",
      "uris": [
        "https://vikingfile.com/f/994ie9RSEE",
        "https://datanodes.to/qsz4sr0378uo/0106575vbv.EU-GameDrive.Org.rar",
        "https://pixeldrain.com/u/SjqZWfoa"
      ],
      "uploadDate": "2023-09-13T00:00:00.000Z",
      "fileSize": "1.31 GB",
      "Gamedrive_Link": "https://gamedrive.org/wwe-2k23-update-1-14-1-18-13-09-2023-elamigos-update/"
    },
    {
      "title": "Railgrade update 6.0.56.1 (07.04.2024) [Elamigos Update]",
      "uris": [
        "https://www.mediafire.com/file/qd12u9tqk9t3y3h/Rag.u6.0.56.1.EU-GameDrive.Org.rar/file"
      ],
      "uploadDate": "2024-04-07T00:00:00.000Z",
      "fileSize": "122.65 MB",
      "Gamedrive_Link": "https://gamedrive.org/railgrade-update-6-0-56-1-07-04-2024-elamigos-update/"
    },
    {
      "title": "Cricket 24 Update v0.2.3448 – v0.2.3451 [GameDrive]",
      "uris": [
        "https://www.mediafire.com/file/2ma0s5539286c9t/C24.v0.2.3448%E2%80%93v0.2.3451-GameDrive.Org.rar/file",
        "https://gofile.io/d/rvzLEK"
      ],
      "uploadDate": "2024-04-16T00:00:00.000Z",
      "fileSize": "35.83 MB",
      "Gamedrive_Link": "https://gamedrive.org/cricket-24-update-v0-2-3448-v0-2-3451-gamedrive/"
    },
    {
      "title": "Elden Ring update 1.09.0 – 1.10.1 (11.01.2024) [Elamigos Update]",
      "uris": [
        "https://www.mediafire.com/file/edj1yf7tg5btvqf/ERi.u1.10.0-1.10.1.EU-GameDrive.Org.rar/file"
      ],
      "uploadDate": "2024-01-11T00:00:00.000Z",
      "fileSize": "75.72 MB",
      "Gamedrive_Link": "https://gamedrive.org/elden-ring-update-1-09-0-1-10-1-11-01-2024-elamigos-update-2/"
    },
    {
      "title": "Motorcycle Mechanic Simulator 2021 update 1.0.56.12 – 1.0.57.11 (03.01.2023) [Elamigos Update]",
      "uris": [
        "https://vikingfile.com/f/zjetI9lbNr"
      ],
      "uploadDate": "2023-01-03T00:00:00.000Z",
      "fileSize": "489.40 MB",
      "Gamedrive_Link": "https://gamedrive.org/motorcycle-mechanic-simulator-2021-update-1-0-56-12-1-0-57-11-03-01-2023-elamigos-update/"
    },
    {
      "title": "Icarus update 2.1.17 – 2.1.25 (05.04.2024) [Elamigos Update]",
      "uris": [
        "https://www.mediafire.com/file/0vkqhqfnaglsd6l/Ic.u2.1.17-2.1.25.EU-GameDrive.Org.rar/file"
      ],
      "uploadDate": "2024-04-05T00:00:00.000Z",
      "fileSize": "965.38 MB",
      "Gamedrive_Link": "https://gamedrive.org/icarus-update-2-1-17-2-1-25-05-04-2024-elamigos-update/"
    },
    {
      "title": "Gas Station Simulator update 21.03.2024 – 05.04.2024 [Elamigos Update]",
      "uris": [
        "https://www.mediafire.com/file/yjps5pmk1ll9f12/GS.u21.03.2024-05.04.2024.EU-GameDrive.Org.rar/file"
      ],
      "uploadDate": "2024-03-21T00:00:00.000Z",
      "fileSize": "150.18 MB",
      "Gamedrive_Link": "https://gamedrive.org/gas-station-simulator-update-21-03-2024-05-04-2024-elamigos-update/"
    },
    {
      "title": "Classified France 44 update 2108 – 2193 (28.03.2024) [Elamigos Update]",
      "uris": [
        "https://www.mediafire.com/file/mqn4erbwb4fn1p7/CFr44.u2108-2193.EU-GameDrive.Org.rar/file"
      ],
      "uploadDate": "2024-03-28T00:00:00.000Z",
      "fileSize": "6.62 MB",
      "Gamedrive_Link": "https://gamedrive.org/classified-france-44-update-2108-2193-28-03-2024-elamigos-update/"
    },
    {
      "title": "Robin Hood Sherwood Builders update 28.03.2024 [Elamigos Update]",
      "uris": [
        "https://www.mediafire.com/file/6bcml7q9q731x0b/RHSB.u28.03.2024.EU-GameDrive.Org.rar/file"
      ],
      "uploadDate": "2024-03-28T00:00:00.000Z",
      "fileSize": "69.87 MB",
      "Gamedrive_Link": "https://gamedrive.org/robin-hood-sherwood-builders-update-28-03-2024-elamigos-update/"
    },
    {
      "title": "One Piece Pirate Warriors 4 update 1.0.6.0 – 1.0.8.0 (27.03.2024) [Elamigos Update]",
      "uris": [
        "https://vikingfile.com/f/7U2QurQQxB",
        "https://pixeldrain.com/u/DeeyFRgp"
      ],
      "uploadDate": "2024-03-27T00:00:00.000Z",
      "fileSize": "417.59 MB",
      "Gamedrive_Link": "https://gamedrive.org/one-piece-pirate-warriors-4-update-1-0-6-0-1-0-8-0-27-03-2024-elamigos-update/"
    },
    {
      "title": "Alone in the Dark 2024 update 1.02 – 1.03 (28.03.2024) [Elamigos Update]",
      "uris": [
        "https://www.mediafire.com/file/xmyb6hdri7ox3xi/AitD.u1.02-1.03.EU-GameDrive.Org.rar/file"
      ],
      "uploadDate": "2024-03-28T00:00:00.000Z",
      "fileSize": "410.14 MB",
      "Gamedrive_Link": "https://gamedrive.org/alone-in-the-dark-2024-update-1-02-1-03-28-03-2024-elamigos-update/"
    },
    {
      "title": "Tribe Primitive Builder update 1.0.18 – 1.1.10 (21.11.2023) [Elamigos Update]",
      "uris": [
        "https://vikingfile.com/f/iQinh56Cxo",
        "https://pixeldrain.com/u/Jygta9ae"
      ],
      "uploadDate": "2023-11-21T00:00:00.000Z",
      "fileSize": "371.13 MB",
      "Gamedrive_Link": "https://gamedrive.org/tribe-primitive-builder-update-1-0-18-1-1-10-21-11-2023-elamigos-update/"
    },
    {
      "title": "Naruto X Boruto Ultimate Ninja Storm Connections update 1.20 (27.03.2024) [Elamigos Update]",
      "uris": [
        "https://www.mediafire.com/file/ket1kmx3s2b0o7b/NXBoU.u1.20.EU-GameDrive.Org.rar/file"
      ],
      "uploadDate": "2024-03-27T00:00:00.000Z",
      "fileSize": "464.48 MB",
      "Gamedrive_Link": "https://gamedrive.org/naruto-x-boruto-ultimate-ninja-storm-connections-update-1-20-27-03-2024-elamigos-update/"
    },
    {
      "title": "Arizona Sunshine 2 VR update 22.02.2024 – 26.03.2024 [Elamigos Update]",
      "uris": [
        "https://www.mediafire.com/file/sjri1qqe8hkkv13/A2VR.u22.02.2024-26.03.2024.EU-GameDrive.Org.rar/file"
      ],
      "uploadDate": "2024-02-22T00:00:00.000Z",
      "fileSize": "664.88 MB",
      "Gamedrive_Link": "https://gamedrive.org/arizona-sunshine-2-vr-update-22-02-2024-26-03-2024-elamigos-update/"
    },
    {
      "title": "Left 4 Dead 2 update 23.02.2022 – 29.02.2024 [Elamigos Update]",
      "uris": [
        "https://vikingfile.com/f/8HjS3BRLkv",
        "https://pixeldrain.com/u/nyuyqaCa"
      ],
      "uploadDate": "2022-02-23T00:00:00.000Z",
      "fileSize": "17.80 MB",
      "Gamedrive_Link": "https://gamedrive.org/left-4-dead-2-update-23-02-2022-29-02-2024-elamigos-update/"
    },
    {
      "title": "Sword Art Online Last Recollection update 1.15 (07.03.2024) [Elamigos Update]",
      "uris": [
        "https://www.mediafire.com/file/8ssegwm6kfjcxpr/SOLR.u1.15.EU-GameDrive.Org.rar/file"
      ],
      "uploadDate": "2024-03-07T00:00:00.000Z",
      "fileSize": "1.71 GB",
      "Gamedrive_Link": "https://gamedrive.org/sword-art-online-last-recollection-update-1-15-07-03-2024-elamigos-update/"
    },
    {
      "title": "Palworld Update 0.1.5.0 to 0.1.5.1 [Kirigiri Update]",
      "uris": [
        "https://www.mediafire.com/file/nba4fk4v9n20kiw/Pa.0.1.5.0-0.1.5.1.Kg-GameDrive.Org.rar/file"
      ],
      "uploadDate": "2024-04-07T00:00:00.000Z",
      "fileSize": "63.58 MB",
      "Gamedrive_Link": "https://gamedrive.org/palworld-update-0-1-5-0-to-0-1-5-1-kirigiri-update/"
    },
    {
      "title": "Palworld Update 0.1.5.1 to 0.2.0.6 [Kirigiri Update]",
      "uris": [
        "https://www.mediafire.com/file/xw1h4cd1yoiu6o4/Pa.0.1.5.1-0.2.0.6.Kg-GameDrive.Org.rar/file"
      ],
      "uploadDate": "2024-04-07T00:00:00.000Z",
      "fileSize": "1.87 GB",
      "Gamedrive_Link": "https://gamedrive.org/palworld-update-0-1-5-1-to-0-2-0-6-kirigiri-update/"
    },
    {
      "title": "Palworld Update 0.2.0.6 to 0.2.1.0 [Kirigiri Update]",
      "uris": [
        "https://www.mediafire.com/file/qoosysfi9zzauj7/Pa.0.2.0.6-0.2.1.0.Kg-GameDrive.Org.rar/file"
      ],
      "uploadDate": "2024-04-07T00:00:00.000Z",
      "fileSize": "43.07 MB",
      "Gamedrive_Link": "https://gamedrive.org/palworld-update-0-2-0-6-to-0-2-1-0-kirigiri-update/"
    },
    {
      "title": "Horizon Forbidden West update 1.0.37 – 1.1.47 [Elamigos Update]",
      "uris": [
        "https://www.mediafire.com/file/alx0kq6al9uxctq/HoWe.u1.0.37-1.1.47.EU-GameDrive.Org.rar/file",
        "https://pixeldrain.com/u/S4GfAnts",
        "https://gofile.io/d/nDiWik"
      ],
      "uploadDate": "2024-04-05T00:00:00.000Z",
      "fileSize": "288.97 MB",
      "Gamedrive_Link": "https://gamedrive.org/horizon-forbidden-west-update-elamigos-update/"
    },
    {
      "title": "Cricket 24 v0.2.2999 – v0.2.3046 [GameDrive]",
      "uris": [
        "https://pixeldrain.com/u/SJ8epvGN",
        "https://gofile.io/d/geyEc4"
      ],
      "uploadDate": "2024-03-27T00:00:00.000Z",
      "fileSize": "2.51 GB",
      "Gamedrive_Link": "https://gamedrive.org/cricket-24-v0-2-2999-v0-2-3046-gamedrive/"
    },
    {
      "title": "One Military Camp update 1.1.0.33 (14.03.2024) [Elamigos Update]",
      "uris": [
        "https://vikingfile.com/f/5ug1kuggD2",
        "https://pixeldrain.com/u/GTecgUTz"
      ],
      "uploadDate": "2024-03-14T00:00:00.000Z",
      "fileSize": "",
      "Gamedrive_Link": "https://gamedrive.org/one-military-camp-update-1-1-0-33-14-03-2024-elamigos-update/"
    },
    {
      "title": "F1 2017 Special Edition update 1.13 (28.03.2018) [Elamigos Update]",
      "uris": [
        "https://vikingfile.com/f/tJr0rA8w8r",
        "https://pixeldrain.com/u/jM3S2JEX"
      ],
      "uploadDate": "2018-03-28T00:00:00.000Z",
      "fileSize": "4.07 GB",
      "Gamedrive_Link": "https://gamedrive.org/f1-2017-special-edition-update-1-13-28-03-2018-elamigos-update/"
    },
    {
      "title": "Kenshi update 1.0.60 – 1.0.65 (22.02.2024) [Elamigos Update]",
      "uris": [
        "https://vikingfile.com/f/tVAlTMKlV8",
        "https://pixeldrain.com/u/1Wxf8JQM"
      ],
      "uploadDate": "2024-02-22T00:00:00.000Z",
      "fileSize": "20.88 MB",
      "Gamedrive_Link": "https://gamedrive.org/kenshi-update-1-0-60-1-0-65-22-02-2024-elamigos-update/"
    },
    {
      "title": "WWE 2K24 update 1.02 – 1.03 (08.03.2024) [Elamigos Update]",
      "uris": [
        "https://datanodes.to/vss83kwxmrwa/W2K24.u1.02-1.03.EU-GameDrive.Org.rar"
      ],
      "uploadDate": "2024-03-08T00:00:00.000Z",
      "fileSize": "",
      "Gamedrive_Link": "https://gamedrive.org/wwe-2k24-update-1-02-1-03-08-03-2024-elamigos-update/"
    },
    {
      "title": "Resident Evil Village update 10.04.2023 – 21.04.2023 [Elamigos Update]",
      "uris": [
        "https://vikingfile.com/f/Z31YTGvzTU",
        "https://pixeldrain.com/u/uyUAEG2y"
      ],
      "uploadDate": "2023-04-10T00:00:00.000Z",
      "fileSize": "47.55 MB",
      "Gamedrive_Link": "https://gamedrive.org/resident-evil-village-update-10-04-2023-21-04-2023-elamigos-update/"
    },
    {
      "title": "Halo The Master Chief Collection update 12.07.2023 – 14.02.2024 [Elamigos Update]",
      "uris": [
        "https://vikingfile.com/f/YBM33z7j7M",
        "https://pixeldrain.com/u/eTk9o6wg"
      ],
      "uploadDate": "2023-07-12T00:00:00.000Z",
      "fileSize": "26.51 MB",
      "Gamedrive_Link": "https://gamedrive.org/halo-the-master-chief-collection-update-12-07-2023-14-02-2024-elamigos-update/"
    },
    {
      "title": "Age of Mythology Extended Edition update 2.7.911 – 2.8.911 (29.06.2020) [Elamigos Update]",
      "uris": [
        "https://vikingfile.com/f/NJK0I48viv",
        "https://pixeldrain.com/u/tMhrr7sx"
      ],
      "uploadDate": "2020-06-29T00:00:00.000Z",
      "fileSize": "5.15 MB",
      "Gamedrive_Link": "https://gamedrive.org/age-of-mythology-extended-edition-update-2-7-911-2-8-911-29-06-2020-elamigos-update/"
    },
    {
      "title": "King Arthur Knights Tale update 2.0.0 – 2.0.1 (29.02.2024) [Elamigos Update]",
      "uris": [
        "https://vikingfile.com/f/ZJqCkNsQKL"
      ],
      "uploadDate": "2024-02-29T00:00:00.000Z",
      "fileSize": "1.99 GB",
      "Gamedrive_Link": "https://gamedrive.org/king-arthur-knights-tale-update-2-0-0-2-0-1-29-02-2024-elamigos-update/"
    },
    {
      "title": "NBA 2K22 update 1.10 – 1.13 (01.07.2022) [Elamigos Update]",
      "uris": [
        "https://vikingfile.com/f/34u1XkUH0y"
      ],
      "uploadDate": "2022-07-01T00:00:00.000Z",
      "fileSize": "",
      "Gamedrive_Link": "https://gamedrive.org/nba-2k22-update-1-10-1-13-01-07-2022-elamigos-update/"
    },
    {
      "title": "NBA 2K22 update 1.8 – 1.10 (25.02.2022) [Elamigos Update]",
      "uris": [
        "https://vikingfile.com/f/vx7EGekdpv"
      ],
      "uploadDate": "2022-02-25T00:00:00.000Z",
      "fileSize": "",
      "Gamedrive_Link": "https://gamedrive.org/nba-2k22-update-1-8-1-10-25-02-2022-elamigos-update/"
    },
    {
      "title": "NBA 2K22 update 1.8 (03.12.2021) [Elamigos Update]",
      "uris": [
        "https://vikingfile.com/f/BodjTQgR1u"
      ],
      "uploadDate": "2021-12-03T00:00:00.000Z",
      "fileSize": "3.84 GB",
      "Gamedrive_Link": "https://gamedrive.org/nba-2k22-update-1-8-03-12-2021-elamigos-update/"
    },
    {
      "title": "Grand Emprise Time Travel Survival update 09.08.2023 [Elamigos Update]",
      "uris": [
        "https://pixeldrain.com/u/bqsm8Tzb"
      ],
      "uploadDate": "2023-08-09T00:00:00.000Z",
      "fileSize": "1.30 GB",
      "Gamedrive_Link": "https://gamedrive.org/grand-emprise-time-travel-survival-update-09-08-2023-elamigos-update/"
    },
    {
      "title": "En Garde update 1.0.5 – 1.0.6 (27.11.2023) [Elamigos Update]",
      "uris": [
        "https://pixeldrain.com/u/UwSFDpsg"
      ],
      "uploadDate": "2023-11-27T00:00:00.000Z",
      "fileSize": "",
      "Gamedrive_Link": "https://gamedrive.org/en-garde-update-1-0-5-1-0-6-27-11-2023-elamigos-update/"
    },
    {
      "title": "The Walking Dead Destinies update 1.2.0.6 – 1.3.0.2 (12.12.2023) [Elamigos Update]",
      "uris": [
        "https://vikingfile.com/f/sMbTjJFXeo",
        "https://pixeldrain.com/u/BMRHknzY"
      ],
      "uploadDate": "2023-12-12T00:00:00.000Z",
      "fileSize": "97.25 MB",
      "Gamedrive_Link": "https://gamedrive.org/the-walking-dead-destinies-update-1-2-0-6-1-3-0-2-12-12-2023-elamigos-update/"
    },
    {
      "title": "Hades Battle out of Hell update 1.38290 – 1.38290 H1 (12.04.2023) [Elamigos Update]",
      "uris": [
        "https://vikingfile.com/f/0FtUrnbEZd",
        "https://pixeldrain.com/u/tNeWEG7w"
      ],
      "uploadDate": "2023-04-12T00:00:00.000Z",
      "fileSize": "25.94 MB",
      "Gamedrive_Link": "https://gamedrive.org/hades-battle-out-of-hell-update-1-38290-1-38290-h1-12-04-2023-elamigos-update/"
    },
    {
      "title": "Dying Light update 1.49.0 – 1.49.0 H7 (29.11.2023) [Elamigos Update]",
      "uris": [
        "https://gofile.io/d/An9msz"
      ],
      "uploadDate": "2023-11-29T00:00:00.000Z",
      "fileSize": "",
      "Gamedrive_Link": "https://gamedrive.org/dying-light-update-1-49-0-1-49-0-h7-29-11-2023-elamigos-update/"
    },
    {
      "title": "Lords of the Fallen 2023 update 1.1.348 – 1.1.362 [Elamigos Update]",
      "uris": [
        "https://gofile.io/d/lzrzh8"
      ],
      "uploadDate": "2023-12-01T00:00:00.000Z",
      "fileSize": "",
      "Gamedrive_Link": "https://gamedrive.org/lords-of-the-fallen-2023-update-1-1-348-1-1-362-elamigos-update/"
    },
    {
      "title": "Cyberpunk 2077 update 2.01 – 2.02 [Elamigos Update]",
      "uris": [
        "https://gofile.io/d/Vt8Pag"
      ],
      "uploadDate": "2023-11-25T00:00:00.000Z",
      "fileSize": "",
      "Gamedrive_Link": "https://gamedrive.org/cyberpunk-2077-update-2-01-2-02-elamigos-update/"
    },
    {
      "title": "Cyberpunk 2077 update 2.00 – 2.01 [Elamigos Update]",
      "uris": [
        "https://gofile.io/d/huMCZa"
      ],
      "uploadDate": "2023-11-25T00:00:00.000Z",
      "fileSize": "",
      "Gamedrive_Link": "https://gamedrive.org/cyberpunk-2077-update-2-00-2-01-elamigos-update/"
    },
    {
      "title": "Cricket 24 v0.2.2141 – v0.2.2225 [GameDrive]",
      "uris": [
        "https://gofile.io/d/9onJkf"
      ],
      "uploadDate": "2023-11-24T00:00:00.000Z",
      "fileSize": "",
      "Gamedrive_Link": "https://gamedrive.org/cricket-24-v0-2-2141-v0-2-2225-gamedrive/"
    },
    {
      "title": "Forza Horizon 5 update 1.619.349 – 1.624.534 (07.11.2023) [Elamigos Update]",
      "uris": [
        "https://gofile.io/d/Q7IYmZ"
      ],
      "uploadDate": "2023-11-07T00:00:00.000Z",
      "fileSize": "",
      "Gamedrive_Link": "https://gamedrive.org/forza-horizon-5-update-1-619-349-1-624-534-07-11-2023-elamigos-update/"
    },
    {
      "title": "Lords of the Fallen 2023 update 1.1.326 – 1.1.348 (21.11.2023) [Elamigos Update]",
      "uris": [
        "https://gofile.io/d/uKHEeD"
      ],
      "uploadDate": "2023-11-21T00:00:00.000Z",
      "fileSize": "",
      "Gamedrive_Link": "https://gamedrive.org/lords-of-the-fallen-2023-update-1-1-326-1-1-348-21-11-2023-elamigos-update/"
    },
    {
      "title": "Starfield update 1.7.36 – 1.8.86 (20.11.2023) [Elamigos Update]",
      "uris": [
        "https://gofile.io/d/2Ff1cJ"
      ],
      "uploadDate": "2023-11-20T00:00:00.000Z",
      "fileSize": "",
      "Gamedrive_Link": "https://gamedrive.org/starfield-update-1-7-36-1-8-86-20-11-2023-elamigos-update/"
    },
    {
      "title": "Middle Earth Shadow of War Definitive Edition update 1.20 – 1.21 [Elamigos Update]",
      "uris": [
        "https://gofile.io/d/eumxPs"
      ],
      "uploadDate": "2023-11-20T00:00:00.000Z",
      "fileSize": "",
      "Gamedrive_Link": "https://gamedrive.org/middle-earth-shadow-of-war-definitive-edition-update-1-20-1-21-elamigos-update/"
    },
    {
      "title": "RoboCop Rogue City update v1.1.1.0 (31.10.2023) – v1.3.0.0 (15.11.2023) [Elamigos Repack]",
      "uris": [
        "https://gofile.io/d/ej83KA"
      ],
      "uploadDate": "2023-10-31T00:00:00.000Z",
      "fileSize": "",
      "Gamedrive_Link": "https://gamedrive.org/robocop-rogue-city-update-v1-1-1-0-31-10-2023-v1-3-0-0-15-11-2023-elamigos-repack/"
    },
    {
      "title": "Marvel’s Spider-Man Remastered update 1.1122 – 2.1012 (18.10.2023) [Elamigos Update]",
      "uris": [
        "https://gofile.io/d/p4EQc4"
      ],
      "uploadDate": "2023-10-18T00:00:00.000Z",
      "fileSize": "",
      "Gamedrive_Link": "https://gamedrive.org/marvels-spider-man-remastered-update-1-1122-2-1012-18-10-2023-elamigos-update/"
    },
    {
      "title": "Lords of the Fallen 2023 update 1.1.282 – 1.1.326 [Elamigos Update]",
      "uris": [
        "https://gofile.io/d/E6jaVx"
      ],
      "uploadDate": "2023-11-20T00:00:00.000Z",
      "fileSize": "",
      "Gamedrive_Link": "https://gamedrive.org/lords-of-the-fallen-2023-update-1-1-282-1-1-326-elamigos-update/"
    },
    {
      "title": "Starfield update 1.7.29 – 1.7.36 [Elamigos Update]",
      "uris": [
        "https://gofile.io/d/HfrJzl"
      ],
      "uploadDate": "2023-11-20T00:00:00.000Z",
      "fileSize": "",
      "Gamedrive_Link": "https://gamedrive.org/starfield-update-1-7-29-1-7-36-elamigos-update/"
    },
    {
      "title": "Alan Wake 2 update 1.0.10 – 1.0.12 [Elamigos Update]",
      "uris": [
        "https://gofile.io/d/YrG8bi"
      ],
      "uploadDate": "2023-11-20T00:00:00.000Z",
      "fileSize": "",
      "Gamedrive_Link": "https://gamedrive.org/alan-wake-2-update-1-0-10-1-0-12-elamigos-update/"
    },
    {
      "title": "Alan Wake 2 update 1.0.8 – 1.0.10 [Elamigos Update]",
      "uris": [
        "https://gofile.io/d/8rkLlP"
      ],
      "uploadDate": "2023-11-20T00:00:00.000Z",
      "fileSize": "",
      "Gamedrive_Link": "https://gamedrive.org/alan-wake-2-update-1-0-8-1-0-10-elamigos-update/"
    },
    {
      "title": "Alan Wake 2 update 1.0.0 – 1.0.8 [Elamigos Update]",
      "uris": [
        "https://gofile.io/d/JV3dNi"
      ],
      "uploadDate": "2023-11-20T00:00:00.000Z",
      "fileSize": "",
      "Gamedrive_Link": "https://gamedrive.org/alan-wake-2-update-1-0-0-1-0-8-elamigos-update/"
    },
    {
      "title": "Cricket 24 v0.2.2044 – v0.2.2057 [GameDrive]",
      "uris": [
        "https://gofile.io/d/yWCBza"
      ],
      "uploadDate": "2023-11-13T00:00:00.000Z",
      "fileSize": "",
      "Gamedrive_Link": "https://gamedrive.org/cricket-24-v0-2-2044-v0-2-2057-gamedrive/"
    },
    {
      "title": "Cricket 24 v0.2.2037 – v0.2.2044 [GameDrive]",
      "uris": [
        "https://gofile.io/d/ii3e9h"
      ],
      "uploadDate": "2023-11-10T00:00:00.000Z",
      "fileSize": "",
      "Gamedrive_Link": "https://gamedrive.org/cricket-24-v0-2-2037-v0-2-2044-gamedrive/"
    },
    {
      "title": "Cricket 24 v0.2.1882 – v0.2.2037 [GameDrive]",
      "uris": [
        "https://gofile.io/d/Ftnk6S"
      ],
      "uploadDate": "2023-11-09T00:00:00.000Z",
      "fileSize": "",
      "Gamedrive_Link": "https://gamedrive.org/cricket-24-v0-2-1882-v0-2-2037-gamedrive/"
    },
    {
      "title": "Forza Horizon 5 update 1.600.803 – 1.607.493 [Elamigos Repack]",
      "uris": [
        "https://gofile.io/d/uEnPUW"
      ],
      "uploadDate": "2023-11-05T00:00:00.000Z",
      "fileSize": "",
      "Gamedrive_Link": "https://gamedrive.org/forza-horizon-5-update-1-600-803-1-607-493-elamigos-repack/"
    },
    {
      "title": "Forza Horizon 5 update 1.614.70 – 1.619.349 [Elamigos Repack]",
      "uris": [
        "https://gofile.io/d/VNUrBN"
      ],
      "uploadDate": "2023-11-05T00:00:00.000Z",
      "fileSize": "",
      "Gamedrive_Link": "https://gamedrive.org/forza-horizon-5-update-1-614-70-1-619-349-elamigos-repack/"
    },
    {
      "title": "Cyberpunk 2077 update 2.01 – 2.02 (26.10.2023) [Elamigos Update]",
      "uris": [
        "https://gofile.io/d/nUFpy2"
      ],
      "uploadDate": "2023-10-26T00:00:00.000Z",
      "fileSize": "",
      "Gamedrive_Link": "https://gamedrive.org/cyberpunk-2077-update-2-01-2-02-26-10-2023-elamigos-update/"
    },
    {
      "title": "Lords of the Fallen 2023 update 1.1.195 – 1.1.203 [Elamigos Update]",
      "uris": [
        "https://gofile.io/d/9hLMp7"
      ],
      "uploadDate": "2023-10-18T00:00:00.000Z",
      "fileSize": "",
      "Gamedrive_Link": "https://gamedrive.org/lords-of-the-fallen-2023-update-1-1-195-1-1-203-elamigos-update/"
    },
    {
      "title": "Lords of the Fallen 2023 update 1.1.184 – 1.1.191 [Elamigos Update]",
      "uris": [
        "https://gofile.io/d/RlVSrD"
      ],
      "uploadDate": "2023-10-18T00:00:00.000Z",
      "fileSize": "",
      "Gamedrive_Link": "https://gamedrive.org/lords-of-the-fallen-2023-update-1-1-184-1-1-191-elamigos-update/"
    },
    {
      "title": "Lords of the Fallen 2023 update 1.1.191 – 1.1.195 [Elamigos Update]",
      "uris": [
        "https://gofile.io/d/SpBIYN"
      ],
      "uploadDate": "2023-10-18T00:00:00.000Z",
      "fileSize": "",
      "Gamedrive_Link": "https://gamedrive.org/lords-of-the-fallen-2023-update-1-1-191-1-1-195-elamigos-update/"
    },
    {
      "title": "Cricket 24 v0.2.1522 – v0.2.1627 [GameDrive]",
      "uris": [
        "https://gofile.io/d/UPaVj5"
      ],
      "uploadDate": "2023-10-18T00:00:00.000Z",
      "fileSize": "",
      "Gamedrive_Link": "https://gamedrive.org/cricket-24-v0-2-1522-v0-2-1627-gamedrive/"
    },
    {
      "title": "Ratchet and Clank Rift Apart update v1.726 – v1.728 [Elamigos Update]",
      "uris": [
        "https://www.mediafire.com/file/jgjtq1hppoqxwn6/RaCRAuv1.726-TO-v1.728-Elamigos-GameDrive.Org.rar/file"
      ],
      "uploadDate": "2023-08-01T00:00:00.000Z",
      "fileSize": "",
      "Gamedrive_Link": "https://gamedrive.org/ratchet-and-clank-rift-apart-update-v1-726-v1-728-elamigos-update-1/"
    },
    {
      "title": "NBA 2K19 Update 1.08 (05.02.2019) [Elamigos Update]",
      "uris": [
        "https://vikingfile.com/f/4R5F4v135J"
      ],
      "uploadDate": "2019-02-05T00:00:00.000Z",
      "fileSize": "3.17 GB",
      "Gamedrive_Link": "https://gamedrive.org/nba-2k19-update-1-08-05-02-2019-elamigos-update/"
    },
    {
      "title": "NBA 2k18 Update 1 (11.12.2017) [Elamigos Update]",
      "uris": [
        "https://vikingfile.com/f/tVfWE1p7DH"
      ],
      "uploadDate": "2017-12-11T00:00:00.000Z",
      "fileSize": "",
      "Gamedrive_Link": "https://gamedrive.org/nba-2k18-update-1-11-12-2017-elamigos-update/"
    },
    {
      "title": "NBA 2k16 update 5 To update 9 (19.05.2016) [Elamigos Update]",
      "uris": [
        "https://vikingfile.com/f/1WMCFuQsNN"
      ],
      "uploadDate": "2016-05-19T00:00:00.000Z",
      "fileSize": "4.3 GB",
      "Gamedrive_Link": "https://gamedrive.org/nba-2k16-update-5-to-update-9-19-05-2016-elamigos-update/"
    },
    {
      "title": "NBA 2k17 Update 1 To Update 10 (08.04.2017) [Elamigos Update]",
      "uris": [
        "https://vikingfile.com/f/FOnLf3V4Yv"
      ],
      "uploadDate": "2017-04-08T00:00:00.000Z",
      "fileSize": "2.48 GB",
      "Gamedrive_Link": "https://gamedrive.org/nba-2k17-update-1-to-update-10-08-04-2017-elamigos-update/"
    },
    {
      "title": "The Last of Us Part I update v1.0.1.6 – v1.0.1.7 [Elamigos] / Last of Us update 3",
      "uris": [
        "https://www.mediafire.com/file/48r2khdl0goy4tr/TLoUP1.U1.0.1.5-To-1.0.1.7.Elamigos-GameDrive.Org.rar/file"
      ],
      "uploadDate": "2023-04-05T00:00:00.000Z",
      "fileSize": "",
      "Gamedrive_Link": "https://gamedrive.org/the-last-of-us-part-i-update-v1-0-1-6-v1-0-1-7-elamigos-last-of-us-update-3/"
    },
    {
      "title": "The Last of Us Part I update v1.0.1.5 – v1.0.1.6 [Elamigos] / Last of Us Part update 2 HotFix",
      "uris": [
        "https://www.mediafire.com/file/7d6dwepla5z0c0h/TLoUP1.U1.0.1.5-To-1.0.1.6.Elamigos-GameDrive.Org.rar/file"
      ],
      "uploadDate": "2023-03-31T00:00:00.000Z",
      "fileSize": "",
      "Gamedrive_Link": "https://gamedrive.org/the-last-of-us-part-i-update-v1-0-1-5-v1-0-1-6-elamigos-last-of-us-part-update-2-hotfix/"
    },
    {
      "title": "The Last of Us Part I update v1.0.1.0 – v1.0.1.5 [Elamigos] / Last of Us Part update 1",
      "uris": [
        "https://www.mediafire.com/file/0jgt1kc3eiksery/TLoU1.Uelamigos.v1.0.1.0-v1.0.1.5-GameDrive.Org.rar/file"
      ],
      "uploadDate": "2023-03-30T00:00:00.000Z",
      "fileSize": "",
      "Gamedrive_Link": "https://gamedrive.org/the-last-of-us-part-i-update-v1-0-1-0-v1-0-1-5-elamigos-last-of-us-part-update-1/"
    },
    {
      "title": "Returnal Update v17.02.23 – v09.03.23 [Elamigos]",
      "uris": [
        "https://www.mediafire.com/file/mlu7f9ijecjo5f8/Returnal.U.v17.02.23-TO-v09.03.23-GameDrive.Org.rar/file"
      ],
      "uploadDate": "2023-03-10T00:00:00.000Z",
      "fileSize": "",
      "Gamedrive_Link": "https://gamedrive.org/returnal-update-v17-02-23-v09-03-23-elamigos/"
    },
    {
      "title": "Wo Long Fallen Dynasty update v1.02 – v1.03 [Elamigos] / Wo Long Fallen Dynasty Update v1.03",
      "uris": [
        "https://www.mediafire.com/file/zc4jpb7k83g728g/WLFD.U.1.02-To-1.03-GameDrive.Org.rar/file"
      ],
      "uploadDate": "2023-03-10T00:00:00.000Z",
      "fileSize": "",
      "Gamedrive_Link": "https://gamedrive.org/wo-long-fallen-dynasty-update-v1-02-v1-03-elamigos-wo-long-fallen-dynasty-update-v1-03/"
    },
    {
      "title": "Forza Horizon 5 Update v1.563.816.0 – 1.567.563.0 [P2P] / Forza Horizon 5 Update 1.567.563.0 Pc Download",
      "uris": [
        "https://www.mediafire.com/file/0chrpu6wkih6c4d/FH5-Update.v1.563.816.0.to.1.567.563.0-GameDrive.Org.rar/file"
      ],
      "uploadDate": "2023-03-10T00:00:00.000Z",
      "fileSize": "",
      "Gamedrive_Link": "https://gamedrive.org/forza-horizon-5-update-v1-563-816-0-1-567-563-0-p2p-forza-horizon-5-update-1-567-563-0-pc-download/"
    },
    {
      "title": "GTA 5 / Grand Theft Auto V Update 1.64 – 1.66 (v.1.0.2845 / 02.28.23) / GTA 5 Update Only v.1.0.2845",
      "uris": [
        "https://www.mediafire.com/file/4j5kt8jhju2hsqp/GTA5.Update.1.64-To-1.66-v1.0.2845-GameDrive.Org.rar/file"
      ],
      "uploadDate": "2023-03-04T00:00:00.000Z",
      "fileSize": "",
      "Gamedrive_Link": "https://gamedrive.org/gta-5-grand-theft-auto-v-update-1-64-1-66-v-1-0-2845-02-28-23-gta-5-update-only-v-1-0-2845/"
    },
    {
      "title": "Football Manager 2023 Winter Update MKDEV / Football Manager 2023 Winter Update Crack",
      "uris": [
        "https://www.mediafire.com/file/unrfnm6pl7ggay4/Football.Manager.2023.WinterUpdate-MKDEV-GameDrive.Org.rar/file"
      ],
      "uploadDate": "2023-03-03T00:00:00.000Z",
      "fileSize": "",
      "Gamedrive_Link": "https://gamedrive.org/football-manager-2023-winter-update-mkdev-football-manager-2023-winter-update-crack/"
    },
    {
      "title": "Euro Truck Simulator 2 update 1.46.2.2 – 1.46.2.17 (07.02.2023) [Elamigos Update]",
      "uris": [
        "https://www.mediafire.com/file/5k4rxvxrqnrjdrf/ETS2.U.1.46.2.2-To-1.46.2.17-GameDrive.Org.rar/file"
      ],
      "uploadDate": "2023-02-07T00:00:00.000Z",
      "fileSize": "",
      "Gamedrive_Link": "https://gamedrive.org/euro-truck-simulator-2-update-1-46-2-2-1-46-2-17-07-02-2023-elamigos-update/"
    },
    {
      "title": "Hogwarts Legacy Update 3 (AiO) / hogwarts legacy update 3 download",
      "uris": [
        "https://gofile.io/d/9Tti2S",
        "https://vikingfile.com/f/bzQ6StxOAI",
        "https://pixeldrain.com/u/B9dha2ZE"
      ],
      "uploadDate": "2023-02-25T00:00:00.000Z",
      "fileSize": "34.93 GB",
      "Gamedrive_Link": "https://gamedrive.org/hogwarts-legacy-update-3-aio-hogwarts-legacy-update/"
    },
    {
      "title": "Returnal Update v10.02.23 – v17.02.23 [Christsnatcher]",
      "uris": [
        "https://www.mediafire.com/file/k7wdsaolmg0dy6v/Returnal_Update_1_b10573407_MULTI14-CS-GameDrive.Org.rar/file"
      ],
      "uploadDate": "2023-02-18T00:00:00.000Z",
      "fileSize": "",
      "Gamedrive_Link": "https://gamedrive.org/returnal-update-v10-02-23-v17-02-23-christsnatcher/"
    },
    {
      "title": "Call of Duty Infinite Warfare update 4 (22.12.2016)[ElAmigos Update]",
      "uris": [
        "https://vikingfile.com/f/rKLhAm1924",
        "https://pixeldrain.com/u/Cdi5NHzd"
      ],
      "uploadDate": "2016-12-22T00:00:00.000Z",
      "fileSize": "1.97 GB",
      "Gamedrive_Link": "https://gamedrive.org/call-of-duty-infinite-warfare-update-4-22-12-2016elamigos-update-call-of-duty-infinite-warfare-new-update/"
    },
    {
      "title": "Cricket 22 patch Update (0.1.2079 To 0.1.2247)",
      "uris": [
        "https://www.mediafire.com/file/hjr06f31uuy9s5j/Cricket22.patch.update.0.1.2079-To-0.1.2247-GameDrive.Org.rar/file"
      ],
      "uploadDate": "2022-10-11T00:00:00.000Z",
      "fileSize": "",
      "Gamedrive_Link": "https://gamedrive.org/cricket-22-patch-update-0-1-2079-to-0-1-2247/"
    },
    {
      "title": "Forza Horizon 5 Update v1.496.624.0 To v1.507.426.0 [ElAmigos Update] | Free Download Update",
      "uris": [
        "https://www.mediafire.com/folder/udfu8975xdus1/FH5.Update.1.496.624-To-1.507.426"
      ],
      "uploadDate": "2022-10-09T00:00:00.000Z",
      "fileSize": "",
      "Gamedrive_Link": "https://gamedrive.org/forza-horizon-5-update-v1-496-624-0-to-v1-507-426-0-elamigos-update/"
    }
  ]
}